01/05/2024 00:00:00.000 | Info | CBot instance [NewBot3.0, EURUSD, h6] started.
01/05/2024 00:00:00.000 | Info | === HybridTrendBot v6.1 Started | Fixed Lots: 0.51 ===
01/05/2024 00:00:00.000 | Info | === NEW DAY 2024-05-01 ===
02/05/2024 00:00:00.000 | Info | === NEW DAY 2024-05-02 ===
03/05/2024 00:00:00.000 | Info | === NEW DAY 2024-05-03 ===
05/05/2024 21:05:00.000 | Info | === NEW DAY 2024-05-05 ===
06/05/2024 00:00:00.000 | Info | === NEW DAY 2024-05-06 ===
07/05/2024 00:00:00.000 | Info | === NEW DAY 2024-05-07 ===
08/05/2024 00:00:00.000 | Info | === NEW DAY 2024-05-08 ===
09/05/2024 00:00:00.000 | Info | === NEW DAY 2024-05-09 ===
09/05/2024 08:30:00.000 | Trade | Executing Market Order to Sell 51000 EURUSD
09/05/2024 08:30:00.000 | Trade | → Executing Market Order to Sell 51000 EURUSD SUCCEEDED, Position PID1
09/05/2024 08:30:00.000 | Trade | Modifying position PID1 (SL: 1.07679, TP: null)
09/05/2024 08:30:00.000 | Trade | → Modifying position PID1 (SL: 1.07679, TP: null) SUCCEEDED, Position PID1
09/05/2024 08:30:00.000 | Trade | Modifying position PID1 (SL: 1.07679, TP: 1.06575)
09/05/2024 08:30:00.000 | Trade | → Modifying position PID1 (SL: 1.07679, TP: 1.06575) SUCCEEDED, Position PID1
09/05/2024 13:51:00.000 | Info | Closed Sell 51000u |PnL -179.88
10/05/2024 00:00:00.000 | Info | === NEW DAY 2024-05-10 ===
12/05/2024 21:29:00.000 | Info | === NEW DAY 2024-05-12 ===
13/05/2024 00:00:00.000 | Info | === NEW DAY 2024-05-13 ===
14/05/2024 00:00:00.000 | Info | === NEW DAY 2024-05-14 ===
15/05/2024 00:00:00.000 | Info | === NEW DAY 2024-05-15 ===
16/05/2024 00:00:00.000 | Info | === NEW DAY 2024-05-16 ===
17/05/2024 00:00:00.000 | Info | === NEW DAY 2024-05-17 ===
19/05/2024 21:05:00.000 | Info | === NEW DAY 2024-05-19 ===
20/05/2024 00:00:00.000 | Info | === NEW DAY 2024-05-20 ===
20/05/2024 09:00:00.000 | Trade | Executing Market Order to Buy 51000 EURUSD
20/05/2024 09:00:00.000 | Trade | → Executing Market Order to Buy 51000 EURUSD SUCCEEDED, Position PID2
20/05/2024 09:00:00.000 | Trade | Modifying position PID2 (SL: 1.08328, TP: null)
20/05/2024 09:00:00.000 | Trade | → Modifying position PID2 (SL: 1.08328, TP: null) SUCCEEDED, Position PID2
20/05/2024 09:00:00.000 | Trade | Modifying position PID2 (SL: 1.08328, TP: 1.09524)
20/05/2024 09:00:00.000 | Trade | → Modifying position PID2 (SL: 1.08328, TP: 1.09524) SUCCEEDED, Position PID2
21/05/2024 00:00:00.000 | Info | === NEW DAY 2024-05-21 ===
21/05/2024 13:00:00.000 | Trade | Closing position PID2 (Volume: 51000)
21/05/2024 13:00:00.000 | Trade | → Closing position PID2 (Volume: 51000) SUCCEEDED
21/05/2024 13:00:00.000 | Info | Closed Buy 51000u |PnL -97.49
22/05/2024 00:00:00.000 | Info | === NEW DAY 2024-05-22 ===
22/05/2024 02:00:00.000 | Trade | Executing Market Order to Buy 51000 EURUSD
22/05/2024 02:00:00.000 | Trade | → Executing Market Order to Buy 51000 EURUSD SUCCEEDED, Position PID3
22/05/2024 02:00:00.000 | Trade | Modifying position PID3 (SL: 1.08233, TP: null)
22/05/2024 02:00:00.000 | Trade | → Modifying position PID3 (SL: 1.08233, TP: null) SUCCEEDED, Position PID3
22/05/2024 02:00:00.000 | Trade | Modifying position PID3 (SL: 1.08233, TP: 1.09287)
22/05/2024 02:00:00.000 | Trade | → Modifying position PID3 (SL: 1.08233, TP: 1.09287) SUCCEEDED, Position PID3
22/05/2024 11:54:00.000 | Info | Closed Buy 51000u |PnL -178.55
23/05/2024 00:00:00.000 | Info | === NEW DAY 2024-05-23 ===
23/05/2024 11:58:00.000 | Trade | Executing Market Order to Buy 51000 EURUSD
23/05/2024 11:58:00.000 | Trade | → Executing Market Order to Buy 51000 EURUSD SUCCEEDED, Position PID4
23/05/2024 11:58:00.000 | Trade | Modifying position PID4 (SL: 1.0812, TP: null)
23/05/2024 11:58:00.000 | Trade | → Modifying position PID4 (SL: 1.0812, TP: null) SUCCEEDED, Position PID4
23/05/2024 11:58:00.000 | Trade | Modifying position PID4 (SL: 1.0812, TP: 1.09223)
23/05/2024 11:58:00.000 | Trade | → Modifying position PID4 (SL: 1.0812, TP: 1.09223) SUCCEEDED, Position PID4
23/05/2024 17:46:00.000 | Info | Closed Buy 51000u |PnL -184.83
24/05/2024 00:00:00.000 | Info | === NEW DAY 2024-05-24 ===
26/05/2024 21:05:00.000 | Info | === NEW DAY 2024-05-26 ===
27/05/2024 00:00:00.000 | Info | === NEW DAY 2024-05-27 ===
28/05/2024 00:00:00.000 | Info | === NEW DAY 2024-05-28 ===
29/05/2024 00:00:00.000 | Info | === NEW DAY 2024-05-29 ===
30/05/2024 00:00:00.000 | Info | === NEW DAY 2024-05-30 ===
31/05/2024 00:00:00.000 | Info | === NEW DAY 2024-05-31 ===
02/06/2024 21:05:00.000 | Info | === NEW DAY 2024-06-02 ===
03/06/2024 00:00:00.000 | Info | === NEW DAY 2024-06-03 ===
04/06/2024 00:00:00.000 | Info | === NEW DAY 2024-06-04 ===
05/06/2024 00:00:00.000 | Info | === NEW DAY 2024-06-05 ===
06/06/2024 00:00:00.000 | Info | === NEW DAY 2024-06-06 ===
07/06/2024 00:00:00.000 | Info | === NEW DAY 2024-06-07 ===
09/06/2024 21:05:00.000 | Info | === NEW DAY 2024-06-09 ===
10/06/2024 00:00:00.000 | Info | === NEW DAY 2024-06-10 ===
11/06/2024 00:00:00.000 | Info | === NEW DAY 2024-06-11 ===
12/06/2024 00:00:00.000 | Info | === NEW DAY 2024-06-12 ===
13/06/2024 00:00:00.000 | Info | === NEW DAY 2024-06-13 ===
14/06/2024 00:00:00.000 | Info | === NEW DAY 2024-06-14 ===
16/06/2024 21:05:00.000 | Info | === NEW DAY 2024-06-16 ===
17/06/2024 00:00:00.000 | Info | === NEW DAY 2024-06-17 ===
18/06/2024 00:00:00.000 | Info | === NEW DAY 2024-06-18 ===
19/06/2024 00:00:00.000 | Info | === NEW DAY 2024-06-19 ===
19/06/2024 02:00:00.000 | Trade | Executing Market Order to Sell 51000 EURUSD
19/06/2024 02:00:00.000 | Trade | → Executing Market Order to Sell 51000 EURUSD SUCCEEDED, Position PID5
19/06/2024 02:00:00.000 | Trade | Modifying position PID5 (SL: 1.07921, TP: null)
19/06/2024 02:00:00.000 | Trade | → Modifying position PID5 (SL: 1.07921, TP: null) SUCCEEDED, Position PID5
19/06/2024 02:00:00.000 | Trade | Modifying position PID5 (SL: 1.07921, TP: 1.06485)
19/06/2024 02:00:00.000 | Trade | → Modifying position PID5 (SL: 1.07921, TP: 1.06485) SUCCEEDED, Position PID5
20/06/2024 00:00:00.000 | Info | === NEW DAY 2024-06-20 ===
20/06/2024 13:00:00.000 | Trade | Closing position PID5 (Volume: 51000)
20/06/2024 13:00:00.000 | Trade | → Closing position PID5 (Volume: 51000) SUCCEEDED
20/06/2024 13:00:00.000 | Info | Closed Sell 51000u |PnL 88.91
21/06/2024 00:00:00.000 | Info | === NEW DAY 2024-06-21 ===
21/06/2024 02:00:00.000 | Trade | Executing Market Order to Sell 51000 EURUSD
21/06/2024 02:00:00.000 | Trade | → Executing Market Order to Sell 51000 EURUSD SUCCEEDED, Position PID6
21/06/2024 02:00:00.000 | Trade | Modifying position PID6 (SL: 1.07499, TP: null)
21/06/2024 02:00:00.000 | Trade | → Modifying position PID6 (SL: 1.07499, TP: null) SUCCEEDED, Position PID6
21/06/2024 02:00:00.000 | Trade | Modifying position PID6 (SL: 1.07499, TP: 1.06391)
21/06/2024 02:00:00.000 | Trade | → Modifying position PID6 (SL: 1.07499, TP: 1.06391) SUCCEEDED, Position PID6
23/06/2024 21:05:00.000 | Info | === NEW DAY 2024-06-23 ===
23/06/2024 21:05:00.000 | Trade | Closing position PID6 (Volume: 51000)
23/06/2024 21:05:00.000 | Trade | → Closing position PID6 (Volume: 51000) SUCCEEDED
23/06/2024 21:05:00.000 | Info | Closed Sell 51000u |PnL 89.40
24/06/2024 00:00:00.000 | Info | === NEW DAY 2024-06-24 ===
25/06/2024 00:00:00.000 | Info | === NEW DAY 2024-06-25 ===
25/06/2024 12:35:00.000 | Trade | Executing Market Order to Sell 51000 EURUSD
25/06/2024 12:35:00.000 | Trade | → Executing Market Order to Sell 51000 EURUSD SUCCEEDED, Position PID7
25/06/2024 12:35:00.000 | Trade | Modifying position PID7 (SL: 1.07555, TP: null)
25/06/2024 12:35:00.000 | Trade | → Modifying position PID7 (SL: 1.07555, TP: null) SUCCEEDED, Position PID7
25/06/2024 12:35:00.000 | Trade | Modifying position PID7 (SL: 1.07555, TP: 1.06219)
25/06/2024 12:35:00.000 | Trade | → Modifying position PID7 (SL: 1.07555, TP: 1.06219) SUCCEEDED, Position PID7
26/06/2024 00:00:00.000 | Info | === NEW DAY 2024-06-26 ===
26/06/2024 13:00:00.000 | Trade | Closing position PID7 (Volume: 51000)
26/06/2024 13:00:00.000 | Trade | → Closing position PID7 (Volume: 51000) SUCCEEDED
26/06/2024 13:00:00.000 | Info | Closed Sell 51000u |PnL 130.67
27/06/2024 00:00:00.000 | Info | === NEW DAY 2024-06-27 ===
28/06/2024 00:00:00.000 | Info | === NEW DAY 2024-06-28 ===
28/06/2024 07:32:00.000 | Trade | Executing Market Order to Sell 51000 EURUSD
28/06/2024 07:32:00.000 | Trade | → Executing Market Order to Sell 51000 EURUSD SUCCEEDED, Position PID8
28/06/2024 07:32:00.000 | Trade | Modifying position PID8 (SL: 1.07474, TP: null)
28/06/2024 07:32:00.000 | Trade | → Modifying position PID8 (SL: 1.07474, TP: null) SUCCEEDED, Position PID8
28/06/2024 07:32:00.000 | Trade | Modifying position PID8 (SL: 1.07474, TP: 1.06208)
28/06/2024 07:32:00.000 | Trade | → Modifying position PID8 (SL: 1.07474, TP: 1.06208) SUCCEEDED, Position PID8
30/06/2024 21:05:00.000 | Info | === NEW DAY 2024-06-30 ===
30/06/2024 21:05:00.000 | Trade | Closing position PID8 (Volume: 51000)
30/06/2024 21:05:00.000 | Trade | → Closing position PID8 (Volume: 51000) SUCCEEDED
30/06/2024 21:05:00.000 | Info | Closed Sell 51000u |PnL -185.28
01/07/2024 00:00:00.000 | Info | === NEW DAY 2024-07-01 ===
02/07/2024 00:00:00.000 | Info | === NEW DAY 2024-07-02 ===
03/07/2024 00:00:00.000 | Info | === NEW DAY 2024-07-03 ===
04/07/2024 00:00:00.000 | Info | === NEW DAY 2024-07-04 ===
05/07/2024 00:00:00.000 | Info | === NEW DAY 2024-07-05 ===
07/07/2024 21:05:00.000 | Info | === NEW DAY 2024-07-07 ===
08/07/2024 00:00:00.000 | Info | === NEW DAY 2024-07-08 ===
09/07/2024 00:00:00.000 | Info | === NEW DAY 2024-07-09 ===
10/07/2024 00:00:00.000 | Info | === NEW DAY 2024-07-10 ===
10/07/2024 02:00:00.000 | Trade | Executing Market Order to Buy 51000 EURUSD
10/07/2024 02:00:00.000 | Trade | → Executing Market Order to Buy 51000 EURUSD SUCCEEDED, Position PID9
10/07/2024 02:00:00.000 | Trade | Modifying position PID9 (SL: 1.07763, TP: null)
10/07/2024 02:00:00.000 | Trade | → Modifying position PID9 (SL: 1.07763, TP: null) SUCCEEDED, Position PID9
10/07/2024 02:00:00.000 | Trade | Modifying position PID9 (SL: 1.07763, TP: 1.08863)
10/07/2024 02:00:00.000 | Trade | → Modifying position PID9 (SL: 1.07763, TP: 1.08863) SUCCEEDED, Position PID9
11/07/2024 00:00:00.000 | Info | === NEW DAY 2024-07-11 ===
11/07/2024 09:06:00.000 | Trade | Modifying position PID9 (SL: 1.08169, TP: 1.08863)
11/07/2024 09:06:00.000 | Trade | → Modifying position PID9 (SL: 1.08169, TP: 1.08863) SUCCEEDED, Position PID9
11/07/2024 09:06:00.000 | Trade | Modifying position PID9 (SL: 1.08169, TP: 1.08863)
11/07/2024 09:06:00.000 | Trade | → Modifying position PID9 (SL: 1.08169, TP: 1.08863) SUCCEEDED, Position PID9
11/07/2024 09:06:00.000 | Info | ✅ BE moved to 1.08169
11/07/2024 11:52:00.000 | Trade | Closing position PID9 (Volume: 51000)
11/07/2024 11:52:00.000 | Trade | → Closing position PID9 (Volume: 51000) SUCCEEDED
11/07/2024 11:52:00.000 | Info | Closed Buy 51000u |PnL 141.76
11/07/2024 12:15:00.000 | Trade | Executing Market Order to Buy 51000 EURUSD
11/07/2024 12:15:00.000 | Trade | → Executing Market Order to Buy 51000 EURUSD SUCCEEDED, Position PID10
11/07/2024 12:15:00.000 | Trade | Modifying position PID10 (SL: 1.08226, TP: null)
11/07/2024 12:15:00.000 | Trade | → Modifying position PID10 (SL: 1.08226, TP: null) SUCCEEDED, Position PID10
11/07/2024 12:15:00.000 | Trade | Modifying position PID10 (SL: 1.08226, TP: 1.09144)
11/07/2024 12:15:00.000 | Trade | → Modifying position PID10 (SL: 1.08226, TP: 1.09144) SUCCEEDED, Position PID10
12/07/2024 00:00:00.000 | Info | === NEW DAY 2024-07-12 ===
12/07/2024 00:00:00.000 | Trade | Closing position PID10 (Volume: 51000)
12/07/2024 00:00:00.000 | Trade | → Closing position PID10 (Volume: 51000) SUCCEEDED
12/07/2024 00:00:00.000 | Info | Closed Buy 51000u |PnL 69.92
14/07/2024 21:05:00.000 | Info | === NEW DAY 2024-07-14 ===
15/07/2024 00:00:00.000 | Info | === NEW DAY 2024-07-15 ===
16/07/2024 00:00:00.000 | Info | === NEW DAY 2024-07-16 ===
17/07/2024 00:00:00.000 | Info | === NEW DAY 2024-07-17 ===
17/07/2024 02:00:00.000 | Trade | Executing Market Order to Buy 51000 EURUSD
17/07/2024 02:00:00.000 | Trade | → Executing Market Order to Buy 51000 EURUSD SUCCEEDED, Position PID11
17/07/2024 02:00:00.000 | Trade | Modifying position PID11 (SL: 1.086, TP: null)
17/07/2024 02:00:00.000 | Trade | → Modifying position PID11 (SL: 1.086, TP: null) SUCCEEDED, Position PID11
17/07/2024 02:00:00.000 | Trade | Modifying position PID11 (SL: 1.086, TP: 1.09815)
17/07/2024 02:00:00.000 | Trade | → Modifying position PID11 (SL: 1.086, TP: 1.09815) SUCCEEDED, Position PID11
18/07/2024 00:00:00.000 | Info | === NEW DAY 2024-07-18 ===
18/07/2024 13:00:00.000 | Trade | Closing position PID11 (Volume: 51000)
18/07/2024 13:00:00.000 | Trade | → Closing position PID11 (Volume: 51000) SUCCEEDED
18/07/2024 13:00:00.000 | Info | Closed Buy 51000u |PnL 76.25
19/07/2024 00:00:00.000 | Info | === NEW DAY 2024-07-19 ===
21/07/2024 21:05:00.000 | Info | === NEW DAY 2024-07-21 ===
22/07/2024 00:00:00.000 | Info | === NEW DAY 2024-07-22 ===
23/07/2024 00:00:00.000 | Info | === NEW DAY 2024-07-23 ===
24/07/2024 00:00:00.000 | Info | === NEW DAY 2024-07-24 ===
25/07/2024 00:00:00.000 | Info | === NEW DAY 2024-07-25 ===
26/07/2024 00:00:00.000 | Info | === NEW DAY 2024-07-26 ===
28/07/2024 21:05:00.000 | Info | === NEW DAY 2024-07-28 ===
29/07/2024 00:00:00.000 | Info | === NEW DAY 2024-07-29 ===
30/07/2024 00:00:00.000 | Info | === NEW DAY 2024-07-30 ===
31/07/2024 00:00:00.000 | Info | === NEW DAY 2024-07-31 ===
01/08/2024 00:00:00.000 | Info | === NEW DAY 2024-08-01 ===
02/08/2024 00:00:00.000 | Info | === NEW DAY 2024-08-02 ===
02/08/2024 11:30:00.000 | Trade | Executing Market Order to Buy 51000 EURUSD
02/08/2024 11:30:00.000 | Trade | → Executing Market Order to Buy 51000 EURUSD SUCCEEDED, Position PID12
02/08/2024 11:30:00.000 | Trade | Modifying position PID12 (SL: 1.07841, TP: null)
02/08/2024 11:30:00.000 | Trade | → Modifying position PID12 (SL: 1.07841, TP: null) SUCCEEDED, Position PID12
02/08/2024 11:30:00.000 | Trade | Modifying position PID12 (SL: 1.07841, TP: 1.09334)
02/08/2024 11:30:00.000 | Trade | → Modifying position PID12 (SL: 1.07841, TP: 1.09334) SUCCEEDED, Position PID12
04/08/2024 21:05:00.000 | Info | === NEW DAY 2024-08-04 ===
04/08/2024 21:05:00.000 | Trade | Modifying position PID12 (SL: 1.08387, TP: 1.09334)
04/08/2024 21:05:00.000 | Trade | → Modifying position PID12 (SL: 1.08387, TP: 1.09334) SUCCEEDED, Position PID12
04/08/2024 21:05:00.000 | Trade | Modifying position PID12 (SL: 1.08387, TP: 1.09334)
04/08/2024 21:05:00.000 | Trade | → Modifying position PID12 (SL: 1.08387, TP: 1.09334) SUCCEEDED, Position PID12
04/08/2024 21:05:00.000 | Info | ✅ BE moved to 1.08387
04/08/2024 21:05:00.000 | Trade | Executing Market Order to Sell 30600 EURUSD
04/08/2024 21:05:00.000 | Trade | → Executing Market Order to Sell 30600 EURUSD FAILED with error "BadVolume"
04/08/2024 21:05:00.000 | Trade | Closing position PID12 (Volume: 51000)
04/08/2024 21:05:00.000 | Trade | → Closing position PID12 (Volume: 51000) SUCCEEDED
04/08/2024 21:05:00.000 | Info | Closed Buy 51000u |PnL 355.35
05/08/2024 00:00:00.000 | Info | === NEW DAY 2024-08-05 ===
06/08/2024 00:00:00.000 | Info | === NEW DAY 2024-08-06 ===
07/08/2024 00:00:00.000 | Info | === NEW DAY 2024-08-07 ===
08/08/2024 00:00:00.000 | Info | === NEW DAY 2024-08-08 ===
08/08/2024 02:00:00.000 | Trade | Executing Market Order to Buy 51000 EURUSD
08/08/2024 02:00:00.000 | Trade | → Executing Market Order to Buy 51000 EURUSD SUCCEEDED, Position PID13
08/08/2024 02:00:00.000 | Trade | Modifying position PID13 (SL: 1.08638, TP: null)
08/08/2024 02:00:00.000 | Trade | → Modifying position PID13 (SL: 1.08638, TP: null) SUCCEEDED, Position PID13
08/08/2024 02:00:00.000 | Trade | Modifying position PID13 (SL: 1.08638, TP: 1.10455)
08/08/2024 02:00:00.000 | Trade | → Modifying position PID13 (SL: 1.08638, TP: 1.10455) SUCCEEDED, Position PID13
09/08/2024 00:00:00.000 | Info | === NEW DAY 2024-08-09 ===
09/08/2024 13:00:00.000 | Trade | Closing position PID13 (Volume: 51000)
09/08/2024 13:00:00.000 | Trade | → Closing position PID13 (Volume: 51000) SUCCEEDED
09/08/2024 13:00:00.000 | Info | Closed Buy 51000u |PnL -89.88
11/08/2024 21:05:00.000 | Info | === NEW DAY 2024-08-11 ===
12/08/2024 00:00:00.000 | Info | === NEW DAY 2024-08-12 ===
13/08/2024 00:00:00.000 | Info | === NEW DAY 2024-08-13 ===
14/08/2024 00:00:00.000 | Info | === NEW DAY 2024-08-14 ===
15/08/2024 00:00:00.000 | Info | === NEW DAY 2024-08-15 ===
16/08/2024 00:00:00.000 | Info | === NEW DAY 2024-08-16 ===
18/08/2024 21:05:00.000 | Info | === NEW DAY 2024-08-18 ===
19/08/2024 00:00:00.000 | Info | === NEW DAY 2024-08-19 ===
19/08/2024 02:00:00.000 | Trade | Executing Market Order to Buy 51000 EURUSD
19/08/2024 02:00:00.000 | Trade | → Executing Market Order to Buy 51000 EURUSD SUCCEEDED, Position PID14
19/08/2024 02:00:00.000 | Trade | Modifying position PID14 (SL: 1.09764, TP: null)
19/08/2024 02:00:00.000 | Trade | → Modifying position PID14 (SL: 1.09764, TP: null) SUCCEEDED, Position PID14
19/08/2024 02:00:00.000 | Trade | Modifying position PID14 (SL: 1.09764, TP: 1.11324)
19/08/2024 02:00:00.000 | Trade | → Modifying position PID14 (SL: 1.09764, TP: 1.11324) SUCCEEDED, Position PID14
20/08/2024 00:00:00.000 | Info | === NEW DAY 2024-08-20 ===
20/08/2024 00:00:00.000 | Trade | Closing position PID14 (Volume: 51000)
20/08/2024 00:00:00.000 | Trade | → Closing position PID14 (Volume: 51000) SUCCEEDED
20/08/2024 00:00:00.000 | Info | Closed Buy 51000u |PnL 226.11
21/08/2024 00:00:00.000 | Info | === NEW DAY 2024-08-21 ===
22/08/2024 00:00:00.000 | Info | === NEW DAY 2024-08-22 ===
23/08/2024 00:00:00.000 | Info | === NEW DAY 2024-08-23 ===
23/08/2024 07:40:00.000 | Trade | Executing Market Order to Buy 51000 EURUSD
23/08/2024 07:40:00.000 | Trade | → Executing Market Order to Buy 51000 EURUSD SUCCEEDED, Position PID15
23/08/2024 07:40:00.000 | Trade | Modifying position PID15 (SL: 1.10647, TP: null)
23/08/2024 07:40:00.000 | Trade | → Modifying position PID15 (SL: 1.10647, TP: null) SUCCEEDED, Position PID15
23/08/2024 07:40:00.000 | Trade | Modifying position PID15 (SL: 1.10647, TP: 1.12165)
23/08/2024 07:40:00.000 | Trade | → Modifying position PID15 (SL: 1.10647, TP: 1.12165) SUCCEEDED, Position PID15
25/08/2024 21:05:00.000 | Info | === NEW DAY 2024-08-25 ===
25/08/2024 21:05:00.000 | Trade | Closing position PID15 (Volume: 51000)
25/08/2024 21:05:00.000 | Trade | → Closing position PID15 (Volume: 51000) SUCCEEDED
25/08/2024 21:05:00.000 | Info | Closed Buy 51000u |PnL 290.29
26/08/2024 00:00:00.000 | Info | === NEW DAY 2024-08-26 ===
27/08/2024 00:00:00.000 | Info | === NEW DAY 2024-08-27 ===
28/08/2024 00:00:00.000 | Info | === NEW DAY 2024-08-28 ===
28/08/2024 06:39:00.000 | Trade | Executing Market Order to Buy 51000 EURUSD
28/08/2024 06:39:00.000 | Trade | → Executing Market Order to Buy 51000 EURUSD SUCCEEDED, Position PID16
28/08/2024 06:39:00.000 | Trade | Modifying position PID16 (SL: 1.10916, TP: null)
28/08/2024 06:39:00.000 | Trade | → Modifying position PID16 (SL: 1.10916, TP: null) SUCCEEDED, Position PID16
28/08/2024 06:39:00.000 | Trade | Modifying position PID16 (SL: 1.10916, TP: 1.12439)
28/08/2024 06:39:00.000 | Trade | → Modifying position PID16 (SL: 1.10916, TP: 1.12439) SUCCEEDED, Position PID16
29/08/2024 00:00:00.000 | Info | === NEW DAY 2024-08-29 ===
29/08/2024 08:08:00.000 | Info | Closed Buy 51000u |PnL -290.45
30/08/2024 00:00:00.000 | Info | === NEW DAY 2024-08-30 ===
01/09/2024 21:05:00.000 | Info | === NEW DAY 2024-09-01 ===
02/09/2024 00:00:00.000 | Info | === NEW DAY 2024-09-02 ===
03/09/2024 00:00:00.000 | Info | === NEW DAY 2024-09-03 ===
04/09/2024 00:00:00.000 | Info | === NEW DAY 2024-09-04 ===
05/09/2024 00:00:00.000 | Info | === NEW DAY 2024-09-05 ===
05/09/2024 02:00:00.000 | Trade | Executing Market Order to Buy 51000 EURUSD
05/09/2024 02:00:00.000 | Trade | → Executing Market Order to Buy 51000 EURUSD SUCCEEDED, Position PID17
05/09/2024 02:00:00.000 | Trade | Modifying position PID17 (SL: 1.1033, TP: null)
05/09/2024 02:00:00.000 | Trade | → Modifying position PID17 (SL: 1.1033, TP: null) SUCCEEDED, Position PID17
05/09/2024 02:00:00.000 | Trade | Modifying position PID17 (SL: 1.1033, TP: 1.1164)
05/09/2024 02:00:00.000 | Trade | → Modifying position PID17 (SL: 1.1033, TP: 1.1164) SUCCEEDED, Position PID17
06/09/2024 00:00:00.000 | Info | === NEW DAY 2024-09-06 ===
06/09/2024 12:31:00.000 | Trade | Modifying position PID17 (SL: 1.10811, TP: 1.1164)
06/09/2024 12:31:00.000 | Trade | → Modifying position PID17 (SL: 1.10811, TP: 1.1164) SUCCEEDED, Position PID17
06/09/2024 12:31:00.000 | Trade | Modifying position PID17 (SL: 1.10811, TP: 1.1164)
06/09/2024 12:31:00.000 | Trade | → Modifying position PID17 (SL: 1.10811, TP: 1.1164) SUCCEEDED, Position PID17
06/09/2024 12:31:00.000 | Info | ✅ BE moved to 1.10811
06/09/2024 13:00:00.000 | Trade | Closing position PID17 (Volume: 51000)
06/09/2024 13:00:00.000 | Trade | → Closing position PID17 (Volume: 51000) SUCCEEDED
06/09/2024 13:00:00.000 | Info | Closed Buy 51000u |PnL 169.99
08/09/2024 21:05:00.000 | Info | === NEW DAY 2024-09-08 ===
09/09/2024 00:00:00.000 | Info | === NEW DAY 2024-09-09 ===
10/09/2024 00:00:00.000 | Info | === NEW DAY 2024-09-10 ===
11/09/2024 00:00:00.000 | Info | === NEW DAY 2024-09-11 ===
12/09/2024 00:00:00.000 | Info | === NEW DAY 2024-09-12 ===
13/09/2024 00:00:00.000 | Info | === NEW DAY 2024-09-13 ===
15/09/2024 21:07:00.000 | Info | === NEW DAY 2024-09-15 ===
16/09/2024 00:00:00.000 | Info | === NEW DAY 2024-09-16 ===
17/09/2024 00:00:00.000 | Info | === NEW DAY 2024-09-17 ===
18/09/2024 00:00:00.000 | Info | === NEW DAY 2024-09-18 ===
19/09/2024 00:00:00.000 | Info | === NEW DAY 2024-09-19 ===
19/09/2024 02:05:00.000 | Trade | Executing Market Order to Buy 51000 EURUSD
19/09/2024 02:05:00.000 | Trade | → Executing Market Order to Buy 51000 EURUSD SUCCEEDED, Position PID18
19/09/2024 02:05:00.000 | Trade | Modifying position PID18 (SL: 1.10259, TP: null)
19/09/2024 02:05:00.000 | Trade | → Modifying position PID18 (SL: 1.10259, TP: null) SUCCEEDED, Position PID18
19/09/2024 02:05:00.000 | Trade | Modifying position PID18 (SL: 1.10259, TP: 1.11973)
19/09/2024 02:05:00.000 | Trade | → Modifying position PID18 (SL: 1.10259, TP: 1.11973) SUCCEEDED, Position PID18
20/09/2024 00:00:00.000 | Info | === NEW DAY 2024-09-20 ===
20/09/2024 00:00:00.000 | Trade | Modifying position PID18 (SL: 1.10884, TP: 1.11973)
20/09/2024 00:00:00.000 | Trade | → Modifying position PID18 (SL: 1.10884, TP: 1.11973) SUCCEEDED, Position PID18
20/09/2024 00:00:00.000 | Trade | Modifying position PID18 (SL: 1.10884, TP: 1.11973)
20/09/2024 00:00:00.000 | Trade | → Modifying position PID18 (SL: 1.10884, TP: 1.11973) SUCCEEDED, Position PID18
20/09/2024 00:00:00.000 | Info | ✅ BE moved to 1.10884
20/09/2024 07:07:00.000 | Trade | Executing Market Order to Sell 30600 EURUSD
20/09/2024 07:07:00.000 | Trade | → Executing Market Order to Sell 30600 EURUSD FAILED with error "BadVolume"
20/09/2024 07:11:00.000 | Trade | Executing Market Order to Sell 30600 EURUSD
20/09/2024 07:11:00.000 | Trade | → Executing Market Order to Sell 30600 EURUSD FAILED with error "BadVolume"
20/09/2024 07:12:00.000 | Trade | Executing Market Order to Sell 30600 EURUSD
20/09/2024 07:12:00.000 | Trade | → Executing Market Order to Sell 30600 EURUSD FAILED with error "BadVolume"
20/09/2024 07:13:00.000 | Trade | Executing Market Order to Sell 30600 EURUSD
20/09/2024 07:13:00.000 | Trade | → Executing Market Order to Sell 30600 EURUSD FAILED with error "BadVolume"
20/09/2024 07:14:00.000 | Trade | Executing Market Order to Sell 30600 EURUSD
20/09/2024 07:14:00.000 | Trade | → Executing Market Order to Sell 30600 EURUSD FAILED with error "BadVolume"
20/09/2024 07:15:00.000 | Trade | Executing Market Order to Sell 30600 EURUSD
20/09/2024 07:15:00.000 | Trade | → Executing Market Order to Sell 30600 EURUSD FAILED with error "BadVolume"
20/09/2024 07:16:00.000 | Trade | Executing Market Order to Sell 30600 EURUSD
20/09/2024 07:16:00.000 | Trade | → Executing Market Order to Sell 30600 EURUSD FAILED with error "BadVolume"
20/09/2024 07:17:00.000 | Trade | Executing Market Order to Sell 30600 EURUSD
20/09/2024 07:17:00.000 | Trade | → Executing Market Order to Sell 30600 EURUSD FAILED with error "BadVolume"
20/09/2024 13:00:00.000 | Trade | Closing position PID18 (Volume: 51000)
20/09/2024 13:00:00.000 | Trade | → Closing position PID18 (Volume: 51000) SUCCEEDED
20/09/2024 13:00:00.000 | Info | Closed Buy 51000u |PnL 377.37
22/09/2024 21:07:00.000 | Info | === NEW DAY 2024-09-22 ===
23/09/2024 00:00:00.000 | Info | === NEW DAY 2024-09-23 ===
23/09/2024 02:00:00.000 | Trade | Executing Market Order to Buy 51000 EURUSD
23/09/2024 02:00:00.000 | Trade | → Executing Market Order to Buy 51000 EURUSD SUCCEEDED, Position PID19
23/09/2024 02:00:00.000 | Trade | Modifying position PID19 (SL: 1.10831, TP: null)
23/09/2024 02:00:00.000 | Trade | → Modifying position PID19 (SL: 1.10831, TP: null) SUCCEEDED, Position PID19
23/09/2024 02:00:00.000 | Trade | Modifying position PID19 (SL: 1.10831, TP: 1.12982)
23/09/2024 02:00:00.000 | Trade | → Modifying position PID19 (SL: 1.10831, TP: 1.12982) SUCCEEDED, Position PID19
23/09/2024 08:15:00.000 | Info | Closed Buy 51000u |PnL -347.74
24/09/2024 00:00:00.000 | Info | === NEW DAY 2024-09-24 ===
24/09/2024 02:00:00.000 | Trade | Executing Market Order to Buy 51000 EURUSD
24/09/2024 02:00:00.000 | Trade | → Executing Market Order to Buy 51000 EURUSD SUCCEEDED, Position PID20
24/09/2024 02:00:00.000 | Trade | Modifying position PID20 (SL: 1.10186, TP: null)
24/09/2024 02:00:00.000 | Trade | → Modifying position PID20 (SL: 1.10186, TP: null) SUCCEEDED, Position PID20
24/09/2024 02:00:00.000 | Trade | Modifying position PID20 (SL: 1.10186, TP: 1.12701)
24/09/2024 02:00:00.000 | Trade | → Modifying position PID20 (SL: 1.10186, TP: 1.12701) SUCCEEDED, Position PID20
25/09/2024 00:00:00.000 | Info | === NEW DAY 2024-09-25 ===
25/09/2024 00:00:00.000 | Trade | Modifying position PID20 (SL: 1.11097, TP: 1.12701)
25/09/2024 00:00:00.000 | Trade | → Modifying position PID20 (SL: 1.11097, TP: 1.12701) SUCCEEDED, Position PID20
25/09/2024 00:00:00.000 | Trade | Modifying position PID20 (SL: 1.11097, TP: 1.12701)
25/09/2024 00:00:00.000 | Trade | → Modifying position PID20 (SL: 1.11097, TP: 1.12701) SUCCEEDED, Position PID20
25/09/2024 00:00:00.000 | Info | ✅ BE moved to 1.11097
25/09/2024 13:00:00.000 | Trade | Closing position PID20 (Volume: 51000)
25/09/2024 13:00:00.000 | Trade | → Closing position PID20 (Volume: 51000) SUCCEEDED
25/09/2024 13:00:00.000 | Info | Closed Buy 51000u |PnL 386.79
26/09/2024 00:00:00.000 | Info | === NEW DAY 2024-09-26 ===
27/09/2024 00:00:00.000 | Info | === NEW DAY 2024-09-27 ===
29/09/2024 21:16:00.000 | Info | === NEW DAY 2024-09-29 ===
30/09/2024 00:00:00.000 | Info | === NEW DAY 2024-09-30 ===
01/10/2024 00:00:00.000 | Info | === NEW DAY 2024-10-01 ===
02/10/2024 00:00:00.000 | Info | === NEW DAY 2024-10-02 ===
03/10/2024 00:00:00.000 | Info | === NEW DAY 2024-10-03 ===
04/10/2024 00:00:00.000 | Info | === NEW DAY 2024-10-04 ===
06/10/2024 21:03:00.000 | Info | === NEW DAY 2024-10-06 ===
07/10/2024 00:00:00.000 | Info | === NEW DAY 2024-10-07 ===
08/10/2024 00:00:00.000 | Info | === NEW DAY 2024-10-08 ===
09/10/2024 00:00:00.000 | Info | === NEW DAY 2024-10-09 ===
10/10/2024 00:00:00.000 | Info | === NEW DAY 2024-10-10 ===
11/10/2024 00:00:00.000 | Info | === NEW DAY 2024-10-11 ===
13/10/2024 21:01:00.000 | Info | === NEW DAY 2024-10-13 ===
14/10/2024 00:00:00.000 | Info | === NEW DAY 2024-10-14 ===
14/10/2024 02:00:00.000 | Trade | Executing Market Order to Sell 51000 EURUSD
14/10/2024 02:00:00.000 | Trade | → Executing Market Order to Sell 51000 EURUSD SUCCEEDED, Position PID21
14/10/2024 02:00:00.000 | Trade | Modifying position PID21 (SL: 1.09694, TP: null)
14/10/2024 02:00:00.000 | Trade | → Modifying position PID21 (SL: 1.09694, TP: null) SUCCEEDED, Position PID21
14/10/2024 02:00:00.000 | Trade | Modifying position PID21 (SL: 1.09694, TP: 1.08403)
14/10/2024 02:00:00.000 | Trade | → Modifying position PID21 (SL: 1.09694, TP: 1.08403) SUCCEEDED, Position PID21
15/10/2024 00:00:00.000 | Info | === NEW DAY 2024-10-15 ===
15/10/2024 00:00:00.000 | Trade | Closing position PID21 (Volume: 51000)
15/10/2024 00:00:00.000 | Trade | → Closing position PID21 (Volume: 51000) SUCCEEDED
15/10/2024 00:00:00.000 | Info | Closed Sell 51000u |PnL 57.06
15/10/2024 08:14:00.000 | Trade | Executing Market Order to Sell 51000 EURUSD
15/10/2024 08:14:00.000 | Trade | → Executing Market Order to Sell 51000 EURUSD SUCCEEDED, Position PID22
15/10/2024 08:14:00.000 | Trade | Modifying position PID22 (SL: 1.09512, TP: null)
15/10/2024 08:14:00.000 | Trade | → Modifying position PID22 (SL: 1.09512, TP: null) SUCCEEDED, Position PID22
15/10/2024 08:14:00.000 | Trade | Modifying position PID22 (SL: 1.09512, TP: 1.08244)
15/10/2024 08:14:00.000 | Trade | → Modifying position PID22 (SL: 1.09512, TP: 1.08244) SUCCEEDED, Position PID22
16/10/2024 00:00:00.000 | Info | === NEW DAY 2024-10-16 ===
16/10/2024 00:00:00.000 | Trade | Closing position PID22 (Volume: 51000)
16/10/2024 00:00:00.000 | Trade | → Closing position PID22 (Volume: 51000) SUCCEEDED
16/10/2024 00:00:00.000 | Info | Closed Sell 51000u |PnL 93.89
17/10/2024 00:00:00.000 | Info | === NEW DAY 2024-10-17 ===
18/10/2024 00:00:00.000 | Info | === NEW DAY 2024-10-18 ===
20/10/2024 21:01:00.000 | Info | === NEW DAY 2024-10-20 ===
21/10/2024 00:00:00.000 | Info | === NEW DAY 2024-10-21 ===
21/10/2024 09:04:00.000 | Trade | Executing Market Order to Sell 51000 EURUSD
21/10/2024 09:04:00.000 | Trade | → Executing Market Order to Sell 51000 EURUSD SUCCEEDED, Position PID23
21/10/2024 09:04:00.000 | Trade | Modifying position PID23 (SL: 1.09002, TP: null)
21/10/2024 09:04:00.000 | Trade | → Modifying position PID23 (SL: 1.09002, TP: null) SUCCEEDED, Position PID23
21/10/2024 09:04:00.000 | Trade | Modifying position PID23 (SL: 1.09002, TP: 1.07775)
21/10/2024 09:04:00.000 | Trade | → Modifying position PID23 (SL: 1.09002, TP: 1.07775) SUCCEEDED, Position PID23
22/10/2024 00:00:00.000 | Info | === NEW DAY 2024-10-22 ===
22/10/2024 00:00:00.000 | Trade | Closing position PID23 (Volume: 51000)
22/10/2024 00:00:00.000 | Trade | → Closing position PID23 (Volume: 51000) SUCCEEDED
22/10/2024 00:00:00.000 | Info | Closed Sell 51000u |PnL 176.00
22/10/2024 02:03:00.000 | Trade | Executing Market Order to Sell 51000 EURUSD
22/10/2024 02:03:00.000 | Trade | → Executing Market Order to Sell 51000 EURUSD SUCCEEDED, Position PID24
22/10/2024 02:03:00.000 | Trade | Modifying position PID24 (SL: 1.08657, TP: null)
22/10/2024 02:03:00.000 | Trade | → Modifying position PID24 (SL: 1.08657, TP: null) SUCCEEDED, Position PID24
22/10/2024 02:03:00.000 | Trade | Modifying position PID24 (SL: 1.08657, TP: 1.07405)
22/10/2024 02:03:00.000 | Trade | → Modifying position PID24 (SL: 1.08657, TP: 1.07405) SUCCEEDED, Position PID24
23/10/2024 00:00:00.000 | Info | === NEW DAY 2024-10-23 ===
23/10/2024 00:00:00.000 | Trade | Closing position PID24 (Volume: 51000)
23/10/2024 00:00:00.000 | Trade | → Closing position PID24 (Volume: 51000) SUCCEEDED
23/10/2024 00:00:00.000 | Info | Closed Sell 51000u |PnL 102.86
24/10/2024 00:00:00.000 | Info | === NEW DAY 2024-10-24 ===
25/10/2024 00:00:00.000 | Info | === NEW DAY 2024-10-25 ===
25/10/2024 02:00:00.000 | Trade | Executing Market Order to Sell 51000 EURUSD
25/10/2024 02:00:00.000 | Trade | → Executing Market Order to Sell 51000 EURUSD SUCCEEDED, Position PID25
25/10/2024 02:00:00.000 | Trade | Modifying position PID25 (SL: 1.08689, TP: null)
25/10/2024 02:00:00.000 | Trade | → Modifying position PID25 (SL: 1.08689, TP: null) SUCCEEDED, Position PID25
25/10/2024 02:00:00.000 | Trade | Modifying position PID25 (SL: 1.08689, TP: 1.07417)
25/10/2024 02:00:00.000 | Trade | → Modifying position PID25 (SL: 1.08689, TP: 1.07417) SUCCEEDED, Position PID25
27/10/2024 21:01:00.000 | Info | === NEW DAY 2024-10-27 ===
27/10/2024 21:01:00.000 | Trade | Closing position PID25 (Volume: 51000)
27/10/2024 21:01:00.000 | Trade | → Closing position PID25 (Volume: 51000) SUCCEEDED
27/10/2024 21:01:00.000 | Info | Closed Sell 51000u |PnL 128.44
28/10/2024 00:00:00.000 | Info | === NEW DAY 2024-10-28 ===
28/10/2024 02:00:00.000 | Trade | Executing Market Order to Sell 51000 EURUSD
28/10/2024 02:00:00.000 | Trade | → Executing Market Order to Sell 51000 EURUSD SUCCEEDED, Position PID26
28/10/2024 02:00:00.000 | Trade | Modifying position PID26 (SL: 1.08384, TP: null)
28/10/2024 02:00:00.000 | Trade | → Modifying position PID26 (SL: 1.08384, TP: null) SUCCEEDED, Position PID26
28/10/2024 02:00:00.000 | Trade | Modifying position PID26 (SL: 1.08384, TP: 1.07059)
28/10/2024 02:00:00.000 | Trade | → Modifying position PID26 (SL: 1.08384, TP: 1.07059) SUCCEEDED, Position PID26
29/10/2024 00:00:00.000 | Info | === NEW DAY 2024-10-29 ===
29/10/2024 13:00:00.000 | Trade | Closing position PID26 (Volume: 51000)
29/10/2024 13:00:00.000 | Trade | → Closing position PID26 (Volume: 51000) SUCCEEDED
29/10/2024 13:00:00.000 | Info | Closed Sell 51000u |PnL 53.47
30/10/2024 00:00:00.000 | Info | === NEW DAY 2024-10-30 ===
30/10/2024 02:00:00.000 | Trade | Executing Market Order to Sell 51000 EURUSD
30/10/2024 02:00:00.000 | Trade | → Executing Market Order to Sell 51000 EURUSD SUCCEEDED, Position PID27
30/10/2024 02:00:00.000 | Trade | Modifying position PID27 (SL: 1.08717, TP: null)
30/10/2024 02:00:00.000 | Trade | → Modifying position PID27 (SL: 1.08717, TP: null) SUCCEEDED, Position PID27
30/10/2024 02:00:00.000 | Trade | Modifying position PID27 (SL: 1.08717, TP: 1.07309)
30/10/2024 02:00:00.000 | Trade | → Modifying position PID27 (SL: 1.08717, TP: 1.07309) SUCCEEDED, Position PID27
30/10/2024 18:23:00.000 | Info | Closed Sell 51000u |PnL -229.25
31/10/2024 00:00:00.000 | Info | === NEW DAY 2024-10-31 ===
31/10/2024 02:00:00.000 | Trade | Executing Market Order to Sell 51000 EURUSD
31/10/2024 02:00:00.000 | Trade | → Executing Market Order to Sell 51000 EURUSD SUCCEEDED, Position PID28
31/10/2024 02:00:00.000 | Trade | Modifying position PID28 (SL: 1.09013, TP: null)
31/10/2024 02:00:00.000 | Trade | → Modifying position PID28 (SL: 1.09013, TP: null) SUCCEEDED, Position PID28
31/10/2024 02:00:00.000 | Trade | Modifying position PID28 (SL: 1.09013, TP: 1.07428)
31/10/2024 02:00:00.000 | Trade | → Modifying position PID28 (SL: 1.09013, TP: 1.07428) SUCCEEDED, Position PID28
01/11/2024 00:00:00.000 | Info | === NEW DAY 2024-11-01 ===
01/11/2024 12:39:00.000 | Info | Closed Sell 51000u |PnL -268.32
03/11/2024 22:01:00.000 | Info | === NEW DAY 2024-11-03 ===
04/11/2024 00:00:00.000 | Info | === NEW DAY 2024-11-04 ===
05/11/2024 00:00:00.000 | Info | === NEW DAY 2024-11-05 ===
06/11/2024 00:00:00.000 | Info | === NEW DAY 2024-11-06 ===
06/11/2024 02:00:00.000 | Trade | Executing Market Order to Sell 51000 EURUSD
06/11/2024 02:00:00.000 | Trade | → Executing Market Order to Sell 51000 EURUSD SUCCEEDED, Position PID29
06/11/2024 02:00:00.000 | Trade | Modifying position PID29 (SL: 1.09083, TP: null)
06/11/2024 02:00:00.000 | Trade | → Modifying position PID29 (SL: 1.09083, TP: null) SUCCEEDED, Position PID29
06/11/2024 02:00:00.000 | Trade | Modifying position PID29 (SL: 1.09083, TP: 1.07069)
06/11/2024 02:00:00.000 | Trade | → Modifying position PID29 (SL: 1.09083, TP: 1.07069) SUCCEEDED, Position PID29
06/11/2024 06:44:00.000 | Info | Closed Sell 51000u |PnL 591.18
07/11/2024 00:00:00.000 | Info | === NEW DAY 2024-11-07 ===
08/11/2024 00:00:00.000 | Info | === NEW DAY 2024-11-08 ===
10/11/2024 22:01:00.000 | Info | === NEW DAY 2024-11-10 ===
11/11/2024 00:00:00.000 | Info | === NEW DAY 2024-11-11 ===
11/11/2024 04:00:00.000 | Trade | Executing Market Order to Sell 51000 EURUSD
11/11/2024 04:00:00.000 | Trade | → Executing Market Order to Sell 51000 EURUSD SUCCEEDED, Position PID30
11/11/2024 04:00:00.000 | Trade | Modifying position PID30 (SL: 1.08345, TP: null)
11/11/2024 04:00:00.000 | Trade | → Modifying position PID30 (SL: 1.08345, TP: null) SUCCEEDED, Position PID30
11/11/2024 04:00:00.000 | Trade | Modifying position PID30 (SL: 1.08345, TP: 1.0505)
11/11/2024 04:00:00.000 | Trade | → Modifying position PID30 (SL: 1.08345, TP: 1.0505) SUCCEEDED, Position PID30
12/11/2024 00:00:00.000 | Info | === NEW DAY 2024-11-12 ===
12/11/2024 00:33:00.000 | Trade | Closing position PID30 (Volume: 51000)
12/11/2024 00:33:00.000 | Trade | → Closing position PID30 (Volume: 51000) SUCCEEDED
12/11/2024 00:33:00.000 | Info | Closed Sell 51000u |PnL 271.17
13/11/2024 00:00:00.000 | Info | === NEW DAY 2024-11-13 ===
14/11/2024 00:00:00.000 | Info | === NEW DAY 2024-11-14 ===
15/11/2024 00:00:00.000 | Info | === NEW DAY 2024-11-15 ===
17/11/2024 22:01:00.000 | Info | === NEW DAY 2024-11-17 ===
18/11/2024 00:00:00.000 | Info | === NEW DAY 2024-11-18 ===
18/11/2024 04:00:00.000 | Trade | Executing Market Order to Sell 51000 EURUSD
18/11/2024 04:00:00.000 | Trade | → Executing Market Order to Sell 51000 EURUSD SUCCEEDED, Position PID31
18/11/2024 04:00:00.000 | Trade | Modifying position PID31 (SL: 1.06225, TP: null)
18/11/2024 04:00:00.000 | Trade | → Modifying position PID31 (SL: 1.06225, TP: null) SUCCEEDED, Position PID31
18/11/2024 04:00:00.000 | Trade | Modifying position PID31 (SL: 1.06225, TP: 1.03753)
18/11/2024 04:00:00.000 | Trade | → Modifying position PID31 (SL: 1.06225, TP: 1.03753) SUCCEEDED, Position PID31
19/11/2024 00:00:00.000 | Info | === NEW DAY 2024-11-19 ===
19/11/2024 13:00:00.000 | Trade | Closing position PID31 (Volume: 51000)
19/11/2024 13:00:00.000 | Trade | → Closing position PID31 (Volume: 51000) SUCCEEDED
19/11/2024 13:00:00.000 | Info | Closed Sell 51000u |PnL -178.10
20/11/2024 00:00:00.000 | Info | === NEW DAY 2024-11-20 ===
20/11/2024 02:00:00.000 | Trade | Executing Market Order to Sell 51000 EURUSD
20/11/2024 02:00:00.000 | Trade | → Executing Market Order to Sell 51000 EURUSD SUCCEEDED, Position PID32
20/11/2024 02:00:00.000 | Trade | Modifying position PID32 (SL: 1.06862, TP: null)
20/11/2024 02:00:00.000 | Trade | → Modifying position PID32 (SL: 1.06862, TP: null) SUCCEEDED, Position PID32
20/11/2024 02:00:00.000 | Trade | Modifying position PID32 (SL: 1.06862, TP: 1.04455)
20/11/2024 02:00:00.000 | Trade | → Modifying position PID32 (SL: 1.06862, TP: 1.04455) SUCCEEDED, Position PID32
21/11/2024 00:00:00.000 | Info | === NEW DAY 2024-11-21 ===
21/11/2024 09:22:00.000 | Trade | Modifying position PID32 (SL: 1.05989, TP: 1.04455)
21/11/2024 09:22:00.000 | Trade | → Modifying position PID32 (SL: 1.05989, TP: 1.04455) SUCCEEDED, Position PID32
21/11/2024 09:22:00.000 | Trade | Modifying position PID32 (SL: 1.05989, TP: 1.04455)
21/11/2024 09:22:00.000 | Trade | → Modifying position PID32 (SL: 1.05989, TP: 1.04455) SUCCEEDED, Position PID32
21/11/2024 09:22:00.000 | Info | ✅ BE moved to 1.05989
21/11/2024 13:00:00.000 | Trade | Closing position PID32 (Volume: 51000)
21/11/2024 13:00:00.000 | Trade | → Closing position PID32 (Volume: 51000) SUCCEEDED
21/11/2024 13:00:00.000 | Info | Closed Sell 51000u |PnL 316.91
22/11/2024 00:00:00.000 | Info | === NEW DAY 2024-11-22 ===
24/11/2024 22:01:00.000 | Info | === NEW DAY 2024-11-24 ===
25/11/2024 00:00:00.000 | Info | === NEW DAY 2024-11-25 ===
26/11/2024 00:00:00.000 | Info | === NEW DAY 2024-11-26 ===
26/11/2024 08:56:00.000 | Trade | Executing Market Order to Sell 51000 EURUSD
26/11/2024 08:56:00.000 | Trade | → Executing Market Order to Sell 51000 EURUSD SUCCEEDED, Position PID33
26/11/2024 08:56:00.000 | Trade | Modifying position PID33 (SL: 1.05998, TP: null)
26/11/2024 08:56:00.000 | Trade | → Modifying position PID33 (SL: 1.05998, TP: null) SUCCEEDED, Position PID33
26/11/2024 08:56:00.000 | Trade | Modifying position PID33 (SL: 1.05998, TP: 1.03011)
26/11/2024 08:56:00.000 | Trade | → Modifying position PID33 (SL: 1.05998, TP: 1.03011) SUCCEEDED, Position PID33
27/11/2024 00:00:00.000 | Info | === NEW DAY 2024-11-27 ===
27/11/2024 13:00:00.000 | Trade | Closing position PID33 (Volume: 51000)
27/11/2024 13:00:00.000 | Trade | → Closing position PID33 (Volume: 51000) SUCCEEDED
27/11/2024 13:00:00.000 | Info | Closed Sell 51000u |PnL -165.98
28/11/2024 00:00:00.000 | Info | === NEW DAY 2024-11-28 ===
28/11/2024 04:00:00.000 | Trade | Executing Market Order to Sell 51000 EURUSD
28/11/2024 04:00:00.000 | Trade | → Executing Market Order to Sell 51000 EURUSD SUCCEEDED, Position PID34
28/11/2024 04:00:00.000 | Trade | Modifying position PID34 (SL: 1.06495, TP: null)
28/11/2024 04:00:00.000 | Trade | → Modifying position PID34 (SL: 1.06495, TP: null) SUCCEEDED, Position PID34
28/11/2024 04:00:00.000 | Trade | Modifying position PID34 (SL: 1.06495, TP: 1.03795)
28/11/2024 04:00:00.000 | Trade | → Modifying position PID34 (SL: 1.06495, TP: 1.03795) SUCCEEDED, Position PID34
29/11/2024 00:00:00.000 | Info | === NEW DAY 2024-11-29 ===
29/11/2024 13:00:00.000 | Trade | Closing position PID34 (Volume: 51000)
29/11/2024 13:00:00.000 | Trade | → Closing position PID34 (Volume: 51000) SUCCEEDED
29/11/2024 13:00:00.000 | Info | Closed Sell 51000u |PnL -57.82
01/12/2024 22:04:00.000 | Info | === NEW DAY 2024-12-01 ===
02/12/2024 00:00:00.000 | Info | === NEW DAY 2024-12-02 ===
03/12/2024 00:00:00.000 | Info | === NEW DAY 2024-12-03 ===
04/12/2024 00:00:00.000 | Info | === NEW DAY 2024-12-04 ===
05/12/2024 00:00:00.000 | Info | === NEW DAY 2024-12-05 ===
06/12/2024 00:00:00.000 | Info | === NEW DAY 2024-12-06 ===
08/12/2024 22:01:00.000 | Info | === NEW DAY 2024-12-08 ===
09/12/2024 00:00:00.000 | Info | === NEW DAY 2024-12-09 ===
09/12/2024 03:52:00.000 | Trade | Executing Market Order to Sell 51000 EURUSD
09/12/2024 03:52:00.000 | Trade | → Executing Market Order to Sell 51000 EURUSD SUCCEEDED, Position PID35
09/12/2024 03:52:00.000 | Trade | Modifying position PID35 (SL: 1.06215, TP: null)
09/12/2024 03:52:00.000 | Trade | → Modifying position PID35 (SL: 1.06215, TP: null) SUCCEEDED, Position PID35
09/12/2024 03:52:00.000 | Trade | Modifying position PID35 (SL: 1.06215, TP: 1.03955)
09/12/2024 03:52:00.000 | Trade | → Modifying position PID35 (SL: 1.06215, TP: 1.03955) SUCCEEDED, Position PID35
10/12/2024 00:00:00.000 | Info | === NEW DAY 2024-12-10 ===
10/12/2024 13:00:00.000 | Trade | Closing position PID35 (Volume: 51000)
10/12/2024 13:00:00.000 | Trade | → Closing position PID35 (Volume: 51000) SUCCEEDED
10/12/2024 13:00:00.000 | Info | Closed Sell 51000u |PnL 36.88
11/12/2024 00:00:00.000 | Info | === NEW DAY 2024-12-11 ===
11/12/2024 02:00:00.000 | Trade | Executing Market Order to Sell 51000 EURUSD
11/12/2024 02:00:00.000 | Trade | → Executing Market Order to Sell 51000 EURUSD SUCCEEDED, Position PID36
11/12/2024 02:00:00.000 | Trade | Modifying position PID36 (SL: 1.06073, TP: null)
11/12/2024 02:00:00.000 | Trade | → Modifying position PID36 (SL: 1.06073, TP: null) SUCCEEDED, Position PID36
11/12/2024 02:00:00.000 | Trade | Modifying position PID36 (SL: 1.06073, TP: 1.04038)
11/12/2024 02:00:00.000 | Trade | → Modifying position PID36 (SL: 1.06073, TP: 1.04038) SUCCEEDED, Position PID36
12/12/2024 00:00:00.000 | Info | === NEW DAY 2024-12-12 ===
12/12/2024 13:00:00.000 | Trade | Closing position PID36 (Volume: 51000)
12/12/2024 13:00:00.000 | Trade | → Closing position PID36 (Volume: 51000) SUCCEEDED
12/12/2024 13:00:00.000 | Info | Closed Sell 51000u |PnL 195.71
13/12/2024 00:00:00.000 | Info | === NEW DAY 2024-12-13 ===
15/12/2024 22:03:00.000 | Info | === NEW DAY 2024-12-15 ===
16/12/2024 00:00:00.000 | Info | === NEW DAY 2024-12-16 ===
17/12/2024 00:00:00.000 | Info | === NEW DAY 2024-12-17 ===
18/12/2024 00:00:00.000 | Info | === NEW DAY 2024-12-18 ===
19/12/2024 00:00:00.000 | Info | === NEW DAY 2024-12-19 ===
20/12/2024 00:00:00.000 | Info | === NEW DAY 2024-12-20 ===
22/12/2024 22:01:00.000 | Info | === NEW DAY 2024-12-22 ===
23/12/2024 00:00:00.000 | Info | === NEW DAY 2024-12-23 ===
24/12/2024 00:00:00.000 | Info | === NEW DAY 2024-12-24 ===
25/12/2024 22:05:00.000 | Info | === NEW DAY 2024-12-25 ===
26/12/2024 00:00:00.000 | Info | === NEW DAY 2024-12-26 ===
27/12/2024 00:00:00.000 | Info | === NEW DAY 2024-12-27 ===
29/12/2024 22:01:00.000 | Info | === NEW DAY 2024-12-29 ===
30/12/2024 00:00:00.000 | Info | === NEW DAY 2024-12-30 ===
31/12/2024 00:00:00.000 | Info | === NEW DAY 2024-12-31 ===
01/01/2025 22:01:00.000 | Info | === NEW DAY 2025-01-01 ===
02/01/2025 00:00:00.000 | Info | === NEW DAY 2025-01-02 ===
03/01/2025 00:00:00.000 | Info | === NEW DAY 2025-01-03 ===
05/01/2025 22:01:00.000 | Info | === NEW DAY 2025-01-05 ===
06/01/2025 00:00:00.000 | Info | === NEW DAY 2025-01-06 ===
07/01/2025 00:00:00.000 | Info | === NEW DAY 2025-01-07 ===
08/01/2025 00:00:00.000 | Info | === NEW DAY 2025-01-08 ===
09/01/2025 00:00:00.000 | Info | === NEW DAY 2025-01-09 ===
10/01/2025 00:00:00.000 | Info | === NEW DAY 2025-01-10 ===
12/01/2025 22:07:00.000 | Info | === NEW DAY 2025-01-12 ===
13/01/2025 00:00:00.000 | Info | === NEW DAY 2025-01-13 ===
14/01/2025 00:00:00.000 | Info | === NEW DAY 2025-01-14 ===
15/01/2025 00:00:00.000 | Info | === NEW DAY 2025-01-15 ===
16/01/2025 00:00:00.000 | Info | === NEW DAY 2025-01-16 ===
17/01/2025 00:00:00.000 | Info | === NEW DAY 2025-01-17 ===
19/01/2025 22:08:00.000 | Info | === NEW DAY 2025-01-19 ===
20/01/2025 00:00:00.000 | Info | === NEW DAY 2025-01-20 ===
21/01/2025 00:00:00.000 | Info | === NEW DAY 2025-01-21 ===
22/01/2025 00:00:00.000 | Info | === NEW DAY 2025-01-22 ===
23/01/2025 00:00:00.000 | Info | === NEW DAY 2025-01-23 ===
24/01/2025 00:00:00.000 | Info | === NEW DAY 2025-01-24 ===
26/01/2025 22:03:00.000 | Info | === NEW DAY 2025-01-26 ===
27/01/2025 00:00:00.000 | Info | === NEW DAY 2025-01-27 ===
28/01/2025 00:00:00.000 | Info | === NEW DAY 2025-01-28 ===
29/01/2025 00:00:00.000 | Info | === NEW DAY 2025-01-29 ===
30/01/2025 00:00:00.000 | Info | === NEW DAY 2025-01-30 ===
31/01/2025 00:00:00.000 | Info | === NEW DAY 2025-01-31 ===
02/02/2025 22:01:00.000 | Info | === NEW DAY 2025-02-02 ===
03/02/2025 00:00:00.000 | Info | === NEW DAY 2025-02-03 ===
04/02/2025 00:00:00.000 | Info | === NEW DAY 2025-02-04 ===
05/02/2025 00:00:00.000 | Info | === NEW DAY 2025-02-05 ===
06/02/2025 00:00:00.000 | Info | === NEW DAY 2025-02-06 ===
07/02/2025 00:00:00.000 | Info | === NEW DAY 2025-02-07 ===
09/02/2025 22:01:00.000 | Info | === NEW DAY 2025-02-09 ===
10/02/2025 00:00:00.000 | Info | === NEW DAY 2025-02-10 ===
11/02/2025 00:00:00.000 | Info | === NEW DAY 2025-02-11 ===
12/02/2025 00:00:00.000 | Info | === NEW DAY 2025-02-12 ===
13/02/2025 00:00:00.000 | Info | === NEW DAY 2025-02-13 ===
14/02/2025 00:00:00.000 | Info | === NEW DAY 2025-02-14 ===
16/02/2025 22:01:00.000 | Info | === NEW DAY 2025-02-16 ===
17/02/2025 00:00:00.000 | Info | === NEW DAY 2025-02-17 ===
18/02/2025 00:00:00.000 | Info | === NEW DAY 2025-02-18 ===
19/02/2025 00:00:00.000 | Info | === NEW DAY 2025-02-19 ===
20/02/2025 00:00:00.000 | Info | === NEW DAY 2025-02-20 ===
21/02/2025 00:00:00.000 | Info | === NEW DAY 2025-02-21 ===
23/02/2025 22:02:00.000 | Info | === NEW DAY 2025-02-23 ===
24/02/2025 00:00:00.000 | Info | === NEW DAY 2025-02-24 ===
25/02/2025 00:00:00.000 | Info | === NEW DAY 2025-02-25 ===
26/02/2025 00:00:00.000 | Info | === NEW DAY 2025-02-26 ===
27/02/2025 00:00:00.000 | Info | === NEW DAY 2025-02-27 ===
28/02/2025 00:00:00.000 | Info | === NEW DAY 2025-02-28 ===
02/03/2025 22:01:00.000 | Info | === NEW DAY 2025-03-02 ===
03/03/2025 00:00:00.000 | Info | === NEW DAY 2025-03-03 ===
04/03/2025 00:00:00.000 | Info | === NEW DAY 2025-03-04 ===
05/03/2025 00:00:00.000 | Info | === NEW DAY 2025-03-05 ===
06/03/2025 00:00:00.000 | Info | === NEW DAY 2025-03-06 ===
07/03/2025 00:00:00.000 | Info | === NEW DAY 2025-03-07 ===
09/03/2025 21:02:00.000 | Info | === NEW DAY 2025-03-09 ===
10/03/2025 00:00:00.000 | Info | === NEW DAY 2025-03-10 ===
10/03/2025 09:00:00.000 | Trade | Executing Market Order to Buy 51000 EURUSD
10/03/2025 09:00:00.000 | Trade | → Executing Market Order to Buy 51000 EURUSD SUCCEEDED, Position PID37
10/03/2025 09:00:00.000 | Trade | Modifying position PID37 (SL: 1.07026, TP: null)
10/03/2025 09:00:00.000 | Trade | → Modifying position PID37 (SL: 1.07026, TP: null) SUCCEEDED, Position PID37
10/03/2025 09:00:00.000 | Trade | Modifying position PID37 (SL: 1.07026, TP: 1.10056)
10/03/2025 09:00:00.000 | Trade | → Modifying position PID37 (SL: 1.07026, TP: 1.10056) SUCCEEDED, Position PID37
11/03/2025 00:00:00.000 | Info | === NEW DAY 2025-03-11 ===
11/03/2025 00:58:00.000 | Trade | Closing position PID37 (Volume: 51000)
11/03/2025 00:58:00.000 | Trade | → Closing position PID37 (Volume: 51000) SUCCEEDED
11/03/2025 00:58:00.000 | Info | Closed Buy 51000u |PnL 167.32
11/03/2025 02:02:00.000 | Trade | Executing Market Order to Buy 51000 EURUSD
11/03/2025 02:02:00.000 | Trade | → Executing Market Order to Buy 51000 EURUSD SUCCEEDED, Position PID38
11/03/2025 02:02:00.000 | Trade | Modifying position PID38 (SL: 1.07604, TP: null)
11/03/2025 02:02:00.000 | Trade | → Modifying position PID38 (SL: 1.07604, TP: null) SUCCEEDED, Position PID38
11/03/2025 02:02:00.000 | Trade | Modifying position PID38 (SL: 1.07604, TP: 1.10317)
11/03/2025 02:02:00.000 | Trade | → Modifying position PID38 (SL: 1.07604, TP: 1.10317) SUCCEEDED, Position PID38
12/03/2025 00:00:00.000 | Info | === NEW DAY 2025-03-12 ===
12/03/2025 00:00:00.000 | Trade | Closing position PID38 (Volume: 51000)
12/03/2025 00:00:00.000 | Trade | → Closing position PID38 (Volume: 51000) SUCCEEDED
12/03/2025 00:00:00.000 | Info | Closed Buy 51000u |PnL 240.90
13/03/2025 00:00:00.000 | Info | === NEW DAY 2025-03-13 ===
14/03/2025 00:00:00.000 | Info | === NEW DAY 2025-03-14 ===
14/03/2025 03:37:00.000 | Trade | Executing Market Order to Buy 51000 EURUSD
14/03/2025 03:37:00.000 | Trade | → Executing Market Order to Buy 51000 EURUSD SUCCEEDED, Position PID39
14/03/2025 03:37:00.000 | Trade | Modifying position PID39 (SL: 1.07678, TP: null)
14/03/2025 03:37:00.000 | Trade | → Modifying position PID39 (SL: 1.07678, TP: null) SUCCEEDED, Position PID39
14/03/2025 03:37:00.000 | Trade | Modifying position PID39 (SL: 1.07678, TP: 1.09843)
14/03/2025 03:37:00.000 | Trade | → Modifying position PID39 (SL: 1.07678, TP: 1.09843) SUCCEEDED, Position PID39
16/03/2025 21:01:00.000 | Info | === NEW DAY 2025-03-16 ===
16/03/2025 21:01:00.000 | Trade | Closing position PID39 (Volume: 51000)
16/03/2025 21:01:00.000 | Trade | → Closing position PID39 (Volume: 51000) SUCCEEDED
16/03/2025 21:01:00.000 | Info | Closed Buy 51000u |PnL 134.55
17/03/2025 00:00:00.000 | Info | === NEW DAY 2025-03-17 ===
17/03/2025 02:00:00.000 | Trade | Executing Market Order to Buy 51000 EURUSD
17/03/2025 02:00:00.000 | Trade | → Executing Market Order to Buy 51000 EURUSD SUCCEEDED, Position PID40
17/03/2025 02:00:00.000 | Trade | Modifying position PID40 (SL: 1.08125, TP: null)
17/03/2025 02:00:00.000 | Trade | → Modifying position PID40 (SL: 1.08125, TP: null) SUCCEEDED, Position PID40
17/03/2025 02:00:00.000 | Trade | Modifying position PID40 (SL: 1.08125, TP: 1.10121)
17/03/2025 02:00:00.000 | Trade | → Modifying position PID40 (SL: 1.08125, TP: 1.10121) SUCCEEDED, Position PID40
18/03/2025 00:00:00.000 | Info | === NEW DAY 2025-03-18 ===
18/03/2025 08:16:00.000 | Trade | Modifying position PID40 (SL: 1.08851, TP: 1.10121)
18/03/2025 08:16:00.000 | Trade | → Modifying position PID40 (SL: 1.08851, TP: 1.10121) SUCCEEDED, Position PID40
18/03/2025 08:16:00.000 | Trade | Modifying position PID40 (SL: 1.08851, TP: 1.10121)
18/03/2025 08:16:00.000 | Trade | → Modifying position PID40 (SL: 1.08851, TP: 1.10121) SUCCEEDED, Position PID40
18/03/2025 08:16:00.000 | Info | ✅ BE moved to 1.08851
18/03/2025 08:17:00.000 | Trade | Closing position PID40 (Volume: 51000)
18/03/2025 08:17:00.000 | Trade | → Closing position PID40 (Volume: 51000) SUCCEEDED
18/03/2025 08:17:00.000 | Info | Closed Buy 51000u |PnL 296.57
19/03/2025 00:00:00.000 | Info | === NEW DAY 2025-03-19 ===
19/03/2025 09:25:00.000 | Trade | Executing Market Order to Buy 51000 EURUSD
19/03/2025 09:25:00.000 | Trade | → Executing Market Order to Buy 51000 EURUSD SUCCEEDED, Position PID41
19/03/2025 09:25:00.000 | Trade | Modifying position PID41 (SL: 1.083, TP: null)
19/03/2025 09:25:00.000 | Trade | → Modifying position PID41 (SL: 1.083, TP: null) SUCCEEDED, Position PID41
19/03/2025 09:25:00.000 | Trade | Modifying position PID41 (SL: 1.083, TP: 1.10318)
19/03/2025 09:25:00.000 | Trade | → Modifying position PID41 (SL: 1.083, TP: 1.10318) SUCCEEDED, Position PID41
20/03/2025 00:00:00.000 | Info | === NEW DAY 2025-03-20 ===
20/03/2025 13:00:00.000 | Trade | Closing position PID41 (Volume: 51000)
20/03/2025 13:00:00.000 | Trade | → Closing position PID41 (Volume: 51000) SUCCEEDED
20/03/2025 13:00:00.000 | Info | Closed Buy 51000u |PnL -342.08
21/03/2025 00:00:00.000 | Info | === NEW DAY 2025-03-21 ===
23/03/2025 21:01:00.000 | Info | === NEW DAY 2025-03-23 ===
24/03/2025 00:00:00.000 | Info | === NEW DAY 2025-03-24 ===
25/03/2025 00:00:00.000 | Info | === NEW DAY 2025-03-25 ===
25/03/2025 10:27:00.000 | Trade | Executing Market Order to Buy 51000 EURUSD
25/03/2025 10:27:00.000 | Trade | → Executing Market Order to Buy 51000 EURUSD SUCCEEDED, Position PID42
25/03/2025 10:27:00.000 | Trade | Modifying position PID42 (SL: 1.07461, TP: null)
25/03/2025 10:27:00.000 | Trade | → Modifying position PID42 (SL: 1.07461, TP: null) SUCCEEDED, Position PID42
25/03/2025 10:27:00.000 | Trade | Modifying position PID42 (SL: 1.07461, TP: 1.09505)
25/03/2025 10:27:00.000 | Trade | → Modifying position PID42 (SL: 1.07461, TP: 1.09505) SUCCEEDED, Position PID42
26/03/2025 00:00:00.000 | Info | === NEW DAY 2025-03-26 ===
26/03/2025 13:00:00.000 | Trade | Closing position PID42 (Volume: 51000)
26/03/2025 13:00:00.000 | Trade | → Closing position PID42 (Volume: 51000) SUCCEEDED
26/03/2025 13:00:00.000 | Info | Closed Buy 51000u |PnL -168.41
27/03/2025 00:00:00.000 | Info | === NEW DAY 2025-03-27 ===
28/03/2025 00:00:00.000 | Info | === NEW DAY 2025-03-28 ===
30/03/2025 21:01:00.000 | Info | === NEW DAY 2025-03-30 ===
31/03/2025 00:00:00.000 | Info | === NEW DAY 2025-03-31 ===
31/03/2025 02:00:00.000 | Trade | Executing Market Order to Buy 51000 EURUSD
31/03/2025 02:00:00.000 | Trade | → Executing Market Order to Buy 51000 EURUSD SUCCEEDED, Position PID43
31/03/2025 02:00:00.000 | Trade | Modifying position PID43 (SL: 1.07626, TP: null)
31/03/2025 02:00:00.000 | Trade | → Modifying position PID43 (SL: 1.07626, TP: null) SUCCEEDED, Position PID43
31/03/2025 02:00:00.000 | Trade | Modifying position PID43 (SL: 1.07626, TP: 1.09614)
31/03/2025 02:00:00.000 | Trade | → Modifying position PID43 (SL: 1.07626, TP: 1.09614) SUCCEEDED, Position PID43
01/04/2025 00:00:00.000 | Info | === NEW DAY 2025-04-01 ===
01/04/2025 13:00:00.000 | Trade | Closing position PID43 (Volume: 51000)
01/04/2025 13:00:00.000 | Trade | → Closing position PID43 (Volume: 51000) SUCCEEDED
01/04/2025 13:00:00.000 | Info | Closed Buy 51000u |PnL -221.84
02/04/2025 00:00:00.000 | Info | === NEW DAY 2025-04-02 ===
02/04/2025 12:29:00.000 | Trade | Executing Market Order to Buy 51000 EURUSD
02/04/2025 12:29:00.000 | Trade | → Executing Market Order to Buy 51000 EURUSD SUCCEEDED, Position PID44
02/04/2025 12:29:00.000 | Trade | Modifying position PID44 (SL: 1.07415, TP: null)
02/04/2025 12:29:00.000 | Trade | → Modifying position PID44 (SL: 1.07415, TP: null) SUCCEEDED, Position PID44
02/04/2025 12:29:00.000 | Trade | Modifying position PID44 (SL: 1.07415, TP: 1.09346)
02/04/2025 12:29:00.000 | Trade | → Modifying position PID44 (SL: 1.07415, TP: 1.09346) SUCCEEDED, Position PID44
03/04/2025 00:00:00.000 | Info | === NEW DAY 2025-04-03 ===
03/04/2025 00:00:00.000 | Trade | Modifying position PID44 (SL: 1.08118, TP: 1.09346)
03/04/2025 00:00:00.000 | Trade | → Modifying position PID44 (SL: 1.08118, TP: 1.09346) SUCCEEDED, Position PID44
03/04/2025 00:00:00.000 | Trade | Modifying position PID44 (SL: 1.08118, TP: 1.09346)
03/04/2025 00:00:00.000 | Trade | → Modifying position PID44 (SL: 1.08118, TP: 1.09346) SUCCEEDED, Position PID44
03/04/2025 00:00:00.000 | Info | ✅ BE moved to 1.08118
03/04/2025 01:32:00.000 | Trade | Executing Market Order to Sell 30600 EURUSD
03/04/2025 01:32:00.000 | Trade | → Executing Market Order to Sell 30600 EURUSD FAILED with error "BadVolume"
03/04/2025 01:33:00.000 | Trade | Executing Market Order to Sell 30600 EURUSD
03/04/2025 01:33:00.000 | Trade | → Executing Market Order to Sell 30600 EURUSD FAILED with error "BadVolume"
03/04/2025 01:34:00.000 | Trade | Executing Market Order to Sell 30600 EURUSD
03/04/2025 01:34:00.000 | Trade | → Executing Market Order to Sell 30600 EURUSD FAILED with error "BadVolume"
03/04/2025 01:35:00.000 | Trade | Executing Market Order to Sell 30600 EURUSD
03/04/2025 01:35:00.000 | Trade | → Executing Market Order to Sell 30600 EURUSD FAILED with error "BadVolume"
03/04/2025 01:36:00.000 | Trade | Executing Market Order to Sell 30600 EURUSD
03/04/2025 01:36:00.000 | Trade | → Executing Market Order to Sell 30600 EURUSD FAILED with error "BadVolume"
03/04/2025 01:37:00.000 | Trade | Executing Market Order to Sell 30600 EURUSD
03/04/2025 01:37:00.000 | Trade | → Executing Market Order to Sell 30600 EURUSD FAILED with error "BadVolume"
03/04/2025 01:38:00.000 | Trade | Executing Market Order to Sell 30600 EURUSD
03/04/2025 01:38:00.000 | Trade | → Executing Market Order to Sell 30600 EURUSD FAILED with error "BadVolume"
03/04/2025 01:39:00.000 | Trade | Executing Market Order to Sell 30600 EURUSD
03/04/2025 01:39:00.000 | Trade | → Executing Market Order to Sell 30600 EURUSD FAILED with error "BadVolume"
03/04/2025 01:42:00.000 | Trade | Executing Market Order to Sell 30600 EURUSD
03/04/2025 01:42:00.000 | Trade | → Executing Market Order to Sell 30600 EURUSD FAILED with error "BadVolume"
03/04/2025 01:43:00.000 | Trade | Executing Market Order to Sell 30600 EURUSD
03/04/2025 01:43:00.000 | Trade | → Executing Market Order to Sell 30600 EURUSD FAILED with error "BadVolume"
03/04/2025 01:47:00.000 | Trade | Executing Market Order to Sell 30600 EURUSD
03/04/2025 01:47:00.000 | Trade | → Executing Market Order to Sell 30600 EURUSD FAILED with error "BadVolume"
03/04/2025 01:48:00.000 | Trade | Executing Market Order to Sell 30600 EURUSD
03/04/2025 01:48:00.000 | Trade | → Executing Market Order to Sell 30600 EURUSD FAILED with error "BadVolume"
03/04/2025 01:49:00.000 | Trade | Executing Market Order to Sell 30600 EURUSD
03/04/2025 01:49:00.000 | Trade | → Executing Market Order to Sell 30600 EURUSD FAILED with error "BadVolume"
03/04/2025 01:50:00.000 | Trade | Executing Market Order to Sell 30600 EURUSD
03/04/2025 01:50:00.000 | Trade | → Executing Market Order to Sell 30600 EURUSD FAILED with error "BadVolume"
03/04/2025 01:52:00.000 | Trade | Executing Market Order to Sell 30600 EURUSD
03/04/2025 01:52:00.000 | Trade | → Executing Market Order to Sell 30600 EURUSD FAILED with error "BadVolume"
03/04/2025 01:53:00.000 | Trade | Executing Market Order to Sell 30600 EURUSD
03/04/2025 01:53:00.000 | Trade | → Executing Market Order to Sell 30600 EURUSD FAILED with error "BadVolume"
03/04/2025 01:55:00.000 | Trade | Executing Market Order to Sell 30600 EURUSD
03/04/2025 01:55:00.000 | Trade | → Executing Market Order to Sell 30600 EURUSD FAILED with error "BadVolume"
03/04/2025 01:56:00.000 | Trade | Executing Market Order to Sell 30600 EURUSD
03/04/2025 01:56:00.000 | Trade | → Executing Market Order to Sell 30600 EURUSD FAILED with error "BadVolume"
03/04/2025 01:57:00.000 | Trade | Executing Market Order to Sell 30600 EURUSD
03/04/2025 01:57:00.000 | Trade | → Executing Market Order to Sell 30600 EURUSD FAILED with error "BadVolume"
03/04/2025 01:58:00.000 | Trade | Executing Market Order to Sell 30600 EURUSD
03/04/2025 01:58:00.000 | Trade | → Executing Market Order to Sell 30600 EURUSD FAILED with error "BadVolume"
03/04/2025 01:59:00.000 | Trade | Executing Market Order to Sell 30600 EURUSD
03/04/2025 01:59:00.000 | Trade | → Executing Market Order to Sell 30600 EURUSD FAILED with error "BadVolume"
03/04/2025 02:01:00.000 | Trade | Executing Market Order to Sell 30600 EURUSD
03/04/2025 02:01:00.000 | Trade | → Executing Market Order to Sell 30600 EURUSD FAILED with error "BadVolume"
03/04/2025 02:02:00.000 | Trade | Executing Market Order to Sell 30600 EURUSD
03/04/2025 02:02:00.000 | Trade | → Executing Market Order to Sell 30600 EURUSD FAILED with error "BadVolume"
03/04/2025 02:03:00.000 | Trade | Executing Market Order to Sell 30600 EURUSD
03/04/2025 02:03:00.000 | Trade | → Executing Market Order to Sell 30600 EURUSD FAILED with error "BadVolume"
03/04/2025 02:04:00.000 | Trade | Executing Market Order to Sell 30600 EURUSD
03/04/2025 02:04:00.000 | Trade | → Executing Market Order to Sell 30600 EURUSD FAILED with error "BadVolume"
03/04/2025 02:05:00.000 | Trade | Executing Market Order to Sell 30600 EURUSD
03/04/2025 02:05:00.000 | Trade | → Executing Market Order to Sell 30600 EURUSD FAILED with error "BadVolume"
03/04/2025 02:10:00.000 | Trade | Executing Market Order to Sell 30600 EURUSD
03/04/2025 02:10:00.000 | Trade | → Executing Market Order to Sell 30600 EURUSD FAILED with error "BadVolume"
03/04/2025 02:14:00.000 | Trade | Executing Market Order to Sell 30600 EURUSD
03/04/2025 02:14:00.000 | Trade | → Executing Market Order to Sell 30600 EURUSD FAILED with error "BadVolume"
03/04/2025 02:17:00.000 | Trade | Executing Market Order to Sell 30600 EURUSD
03/04/2025 02:17:00.000 | Trade | → Executing Market Order to Sell 30600 EURUSD FAILED with error "BadVolume"
03/04/2025 02:21:00.000 | Trade | Executing Market Order to Sell 30600 EURUSD
03/04/2025 02:21:00.000 | Trade | → Executing Market Order to Sell 30600 EURUSD FAILED with error "BadVolume"
03/04/2025 02:22:00.000 | Trade | Executing Market Order to Sell 30600 EURUSD
03/04/2025 02:22:00.000 | Trade | → Executing Market Order to Sell 30600 EURUSD FAILED with error "BadVolume"
03/04/2025 02:23:00.000 | Trade | Executing Market Order to Sell 30600 EURUSD
03/04/2025 02:23:00.000 | Trade | → Executing Market Order to Sell 30600 EURUSD FAILED with error "BadVolume"
03/04/2025 02:24:00.000 | Trade | Executing Market Order to Sell 30600 EURUSD
03/04/2025 02:24:00.000 | Trade | → Executing Market Order to Sell 30600 EURUSD FAILED with error "BadVolume"
03/04/2025 02:25:00.000 | Trade | Executing Market Order to Sell 30600 EURUSD
03/04/2025 02:25:00.000 | Trade | → Executing Market Order to Sell 30600 EURUSD FAILED with error "BadVolume"
03/04/2025 02:26:00.000 | Trade | Closing position PID44 (Volume: 51000)
03/04/2025 02:26:00.000 | Trade | → Closing position PID44 (Volume: 51000) SUCCEEDED
03/04/2025 02:26:00.000 | Trade | Executing Market Order to Buy 51000 EURUSD
03/04/2025 02:26:00.000 | Trade | → Executing Market Order to Buy 51000 EURUSD SUCCEEDED, Position PID45
03/04/2025 02:26:00.000 | Trade | Modifying position PID45 (SL: 1.08293, TP: null)
03/04/2025 02:26:00.000 | Trade | → Modifying position PID45 (SL: 1.08293, TP: null) SUCCEEDED, Position PID45
03/04/2025 02:26:00.000 | Trade | Modifying position PID45 (SL: 1.08293, TP: 1.10977)
03/04/2025 02:26:00.000 | Trade | → Modifying position PID45 (SL: 1.08293, TP: 1.10977) SUCCEEDED, Position PID45
03/04/2025 02:26:00.000 | Info | Closed Buy 51000u |PnL 474.33
03/04/2025 10:13:00.000 | Info | Closed Buy 51000u |PnL 872.17
04/04/2025 00:00:00.000 | Info | === NEW DAY 2025-04-04 ===
06/04/2025 21:01:00.000 | Info | === NEW DAY 2025-04-06 ===
07/04/2025 00:00:00.000 | Info | === NEW DAY 2025-04-07 ===
08/04/2025 00:00:00.000 | Info | === NEW DAY 2025-04-08 ===
08/04/2025 02:00:00.000 | Trade | Executing Market Order to Buy 51000 EURUSD
08/04/2025 02:00:00.000 | Trade | → Executing Market Order to Buy 51000 EURUSD SUCCEEDED, Position PID46
08/04/2025 02:00:00.000 | Trade | Modifying position PID46 (SL: 1.0756, TP: null)
08/04/2025 02:00:00.000 | Trade | → Modifying position PID46 (SL: 1.0756, TP: null) SUCCEEDED, Position PID46
08/04/2025 02:00:00.000 | Trade | Modifying position PID46 (SL: 1.0756, TP: 1.13291)
08/04/2025 02:00:00.000 | Trade | → Modifying position PID46 (SL: 1.0756, TP: 1.13291) SUCCEEDED, Position PID46
09/04/2025 00:00:00.000 | Info | === NEW DAY 2025-04-09 ===
09/04/2025 13:00:00.000 | Trade | Closing position PID46 (Volume: 51000)
09/04/2025 13:00:00.000 | Trade | → Closing position PID46 (Volume: 51000) SUCCEEDED
09/04/2025 13:00:00.000 | Info | Closed Buy 51000u |PnL 501.69
10/04/2025 00:00:00.000 | Info | === NEW DAY 2025-04-10 ===
10/04/2025 02:00:00.000 | Trade | Executing Market Order to Buy 51000 EURUSD
10/04/2025 02:00:00.000 | Trade | → Executing Market Order to Buy 51000 EURUSD SUCCEEDED, Position PID47
10/04/2025 02:00:00.000 | Trade | Modifying position PID47 (SL: 1.07925, TP: null)
10/04/2025 02:00:00.000 | Trade | → Modifying position PID47 (SL: 1.07925, TP: null) SUCCEEDED, Position PID47
10/04/2025 02:00:00.000 | Trade | Modifying position PID47 (SL: 1.07925, TP: 1.12976)
10/04/2025 02:00:00.000 | Trade | → Modifying position PID47 (SL: 1.07925, TP: 1.12976) SUCCEEDED, Position PID47
11/04/2025 00:00:00.000 | Info | === NEW DAY 2025-04-11 ===
11/04/2025 00:00:00.000 | Trade | Closing position PID47 (Volume: 51000)
11/04/2025 00:00:00.000 | Trade | → Closing position PID47 (Volume: 51000) SUCCEEDED
11/04/2025 00:00:00.000 | Info | Closed Buy 51000u |PnL 1261.55
13/04/2025 21:14:00.000 | Info | === NEW DAY 2025-04-13 ===
14/04/2025 00:00:00.000 | Info | === NEW DAY 2025-04-14 ===
15/04/2025 00:00:00.000 | Info | === NEW DAY 2025-04-15 ===
16/04/2025 00:00:00.000 | Info | === NEW DAY 2025-04-16 ===
16/04/2025 02:00:00.000 | Trade | Executing Market Order to Buy 51000 EURUSD
16/04/2025 02:00:00.000 | Trade | → Executing Market Order to Buy 51000 EURUSD SUCCEEDED, Position PID48
16/04/2025 02:00:00.000 | Trade | Modifying position PID48 (SL: 1.11362, TP: null)
16/04/2025 02:00:00.000 | Trade | → Modifying position PID48 (SL: 1.11362, TP: null) SUCCEEDED, Position PID48
16/04/2025 02:00:00.000 | Trade | Modifying position PID48 (SL: 1.11362, TP: 1.16653)
16/04/2025 02:00:00.000 | Trade | → Modifying position PID48 (SL: 1.11362, TP: 1.16653) SUCCEEDED, Position PID48
17/04/2025 00:00:00.000 | Info | === NEW DAY 2025-04-17 ===
17/04/2025 13:00:00.000 | Trade | Closing position PID48 (Volume: 51000)
17/04/2025 13:00:00.000 | Trade | → Closing position PID48 (Volume: 51000) SUCCEEDED
17/04/2025 13:00:00.000 | Info | Closed Buy 51000u |PnL 109.91
18/04/2025 00:00:00.000 | Info | === NEW DAY 2025-04-18 ===
18/04/2025 02:00:00.000 | Trade | Executing Market Order to Buy 51000 EURUSD
18/04/2025 02:00:00.000 | Trade | → Executing Market Order to Buy 51000 EURUSD SUCCEEDED, Position PID49
18/04/2025 02:00:00.000 | Trade | Modifying position PID49 (SL: 1.12673, TP: null)
18/04/2025 02:00:00.000 | Trade | → Modifying position PID49 (SL: 1.12673, TP: null) SUCCEEDED, Position PID49
18/04/2025 02:00:00.000 | Trade | Modifying position PID49 (SL: 1.12673, TP: 1.15607)
18/04/2025 02:00:00.000 | Trade | → Modifying position PID49 (SL: 1.12673, TP: 1.15607) SUCCEEDED, Position PID49
20/04/2025 21:01:00.000 | Info | === NEW DAY 2025-04-20 ===
20/04/2025 21:01:00.000 | Trade | Closing position PID49 (Volume: 51000)
20/04/2025 21:01:00.000 | Trade | → Closing position PID49 (Volume: 51000) SUCCEEDED
20/04/2025 21:01:00.000 | Info | Closed Buy 51000u |PnL 88.77
21/04/2025 00:00:00.000 | Info | === NEW DAY 2025-04-21 ===
22/04/2025 00:00:00.000 | Info | === NEW DAY 2025-04-22 ===
23/04/2025 00:00:00.000 | Info | === NEW DAY 2025-04-23 ===
24/04/2025 00:00:00.000 | Info | === NEW DAY 2025-04-24 ===
25/04/2025 00:00:00.000 | Info | === NEW DAY 2025-04-25 ===
27/04/2025 21:32:00.000 | Info | === NEW DAY 2025-04-27 ===
28/04/2025 00:00:00.000 | Info | === NEW DAY 2025-04-28 ===
28/04/2025 02:00:00.000 | Trade | Executing Market Order to Buy 51000 EURUSD
28/04/2025 02:00:00.000 | Trade | → Executing Market Order to Buy 51000 EURUSD SUCCEEDED, Position PID50
28/04/2025 02:00:00.000 | Trade | Modifying position PID50 (SL: 1.12342, TP: null)
28/04/2025 02:00:00.000 | Trade | → Modifying position PID50 (SL: 1.12342, TP: null) SUCCEEDED, Position PID50
28/04/2025 02:00:00.000 | Trade | Modifying position PID50 (SL: 1.12342, TP: 1.15643)
28/04/2025 02:00:00.000 | Trade | → Modifying position PID50 (SL: 1.12342, TP: 1.15643) SUCCEEDED, Position PID50
29/04/2025 00:00:00.000 | Info | === NEW DAY 2025-04-29 ===
29/04/2025 13:00:00.000 | Trade | Closing position PID50 (Volume: 51000)
29/04/2025 13:00:00.000 | Trade | → Closing position PID50 (Volume: 51000) SUCCEEDED
29/04/2025 13:00:00.000 | Info | Closed Buy 51000u |PnL 248.08
30/04/2025 00:00:00.000 | Info | === NEW DAY 2025-04-30 ===
01/05/2025 00:00:00.000 | Info | === NEW DAY 2025-05-01 ===
02/05/2025 00:00:00.000 | Info | === NEW DAY 2025-05-02 ===
04/05/2025 21:09:00.000 | Info | === NEW DAY 2025-05-04 ===
05/05/2025 00:00:00.000 | Info | === NEW DAY 2025-05-05 ===
06/05/2025 00:00:00.000 | Info | === NEW DAY 2025-05-06 ===
07/05/2025 00:00:00.000 | Info | === NEW DAY 2025-05-07 ===
08/05/2025 00:00:00.000 | Info | === NEW DAY 2025-05-08 ===
09/05/2025 00:00:00.000 | Info | === NEW DAY 2025-05-09 ===
11/05/2025 21:02:00.000 | Info | === NEW DAY 2025-05-11 ===
12/05/2025 00:00:00.000 | Info | === NEW DAY 2025-05-12 ===
13/05/2025 00:00:00.000 | Info | === NEW DAY 2025-05-13 ===
14/05/2025 00:00:00.000 | Info | === NEW DAY 2025-05-14 ===
15/05/2025 00:00:00.000 | Info | === NEW DAY 2025-05-15 ===
16/05/2025 00:00:00.000 | Info | === NEW DAY 2025-05-16 ===
18/05/2025 21:01:00.000 | Info | === NEW DAY 2025-05-18 ===
19/05/2025 00:00:00.000 | Info | === NEW DAY 2025-05-19 ===
20/05/2025 00:00:00.000 | Info | === NEW DAY 2025-05-20 ===
21/05/2025 00:00:00.000 | Info | === NEW DAY 2025-05-21 ===
22/05/2025 00:00:00.000 | Info | === NEW DAY 2025-05-22 ===
23/05/2025 00:00:00.000 | Info | === NEW DAY 2025-05-23 ===
23/05/2025 09:00:00.000 | Trade | Executing Market Order to Buy 51000 EURUSD
23/05/2025 09:00:00.000 | Trade | → Executing Market Order to Buy 51000 EURUSD SUCCEEDED, Position PID51
23/05/2025 09:00:00.000 | Trade | Modifying position PID51 (SL: 1.12634, TP: null)
23/05/2025 09:00:00.000 | Trade | → Modifying position PID51 (SL: 1.12634, TP: null) SUCCEEDED, Position PID51
23/05/2025 09:00:00.000 | Trade | Modifying position PID51 (SL: 1.12634, TP: 1.14863)
23/05/2025 09:00:00.000 | Trade | → Modifying position PID51 (SL: 1.12634, TP: 1.14863) SUCCEEDED, Position PID51
25/05/2025 21:01:00.000 | Info | === NEW DAY 2025-05-25 ===
25/05/2025 21:01:00.000 | Trade | Closing position PID51 (Volume: 51000)
25/05/2025 21:01:00.000 | Trade | → Closing position PID51 (Volume: 51000) SUCCEEDED
25/05/2025 21:01:00.000 | Info | Closed Buy 51000u |PnL 75.76
25/05/2025 23:59:00.000 | Info | === HybridTrendBot v6.1 Stopped ===
25/05/2025 23:59:00.000 | Info | CBot instance [NewBot3.0, EURUSD, h6] stopped.
