25/02/2025 00:00:00.000 | Info | CBot instance [NewBot3.0, EURUSD, h1] started.
25/02/2025 00:00:00.000 | Info | === HybridTrendBot v6.0 Started (ADX filter) ===
25/02/2025 00:00:00.000 | Info | Symbol: EURUSD. Fixed Volume: 1000 units.
25/02/2025 00:00:00.000 | Info | OnStart completed.
26/02/2025 00:00:00.000 | Info | === NEW DAY: 2025-02-26 ===
26/02/2025 03:00:00.000 | Info | 🚀 Order prep — Entry:1.05077, SL:1.04849, TP:1.05441, Vol:1000
26/02/2025 03:00:00.000 | Trade | Executing Market Order to Buy 1000 EURUSD
26/02/2025 03:00:00.000 | Trade | → Executing Market Order to Buy 1000 EURUSD SUCCEEDED, Position PID1
26/02/2025 03:00:00.000 | Trade | Modifying position PID1 (SL: 1.04849, TP: null)
26/02/2025 03:00:00.000 | Trade | → Modifying position PID1 (SL: 1.04849, TP: null) SUCCEEDED, Position PID1
26/02/2025 03:00:00.000 | Trade | Modifying position PID1 (SL: 1.04849, TP: 1.05441)
26/02/2025 03:00:00.000 | Trade | → Modifying position PID1 (SL: 1.04849, TP: 1.05441) SUCCEEDED, Position PID1
26/02/2025 12:47:00.000 | Info | === CLOSED Buy 1000u |PnL:-2.21|Pips:-24.4 ===
26/02/2025 12:47:00.000 | Info | Day PnL:-2.21 | Closed:1 / Exec:1
27/02/2025 00:00:00.000 | Info | === NEW DAY: 2025-02-27 ===
28/02/2025 00:00:00.000 | Info | === NEW DAY: 2025-02-28 ===
28/02/2025 08:00:00.000 | Info | 🚀 Order prep — Entry:1.03959, SL:1.04152, TP:1.03650, Vol:1000
28/02/2025 08:00:00.000 | Trade | Executing Market Order to Sell 1000 EURUSD
28/02/2025 08:00:00.000 | Trade | → Executing Market Order to Sell 1000 EURUSD SUCCEEDED, Position PID2
28/02/2025 08:00:00.000 | Trade | Modifying position PID2 (SL: 1.04152, TP: null)
28/02/2025 08:00:00.000 | Trade | → Modifying position PID2 (SL: 1.04152, TP: null) SUCCEEDED, Position PID2
28/02/2025 08:00:00.000 | Trade | Modifying position PID2 (SL: 1.04152, TP: 1.0365)
28/02/2025 08:00:00.000 | Trade | → Modifying position PID2 (SL: 1.04152, TP: 1.0365) SUCCEEDED, Position PID2
28/02/2025 13:13:00.000 | Info | === CLOSED Sell 1000u |PnL:-1.82|Pips:-20.0 ===
28/02/2025 13:13:00.000 | Info | Day PnL:-1.82 | Closed:1 / Exec:1
28/02/2025 13:14:00.000 | Info | 🚀 Order prep — Entry:1.04115, SL:1.04329, TP:1.03773, Vol:1000
28/02/2025 13:14:00.000 | Trade | Executing Market Order to Sell 1000 EURUSD
28/02/2025 13:14:00.000 | Trade | → Executing Market Order to Sell 1000 EURUSD SUCCEEDED, Position PID3
28/02/2025 13:14:00.000 | Trade | Modifying position PID3 (SL: 1.04329, TP: null)
28/02/2025 13:14:00.000 | Trade | → Modifying position PID3 (SL: 1.04329, TP: null) SUCCEEDED, Position PID3
28/02/2025 13:14:00.000 | Trade | Modifying position PID3 (SL: 1.04329, TP: 1.03773)
28/02/2025 13:14:00.000 | Trade | → Modifying position PID3 (SL: 1.04329, TP: 1.03773) SUCCEEDED, Position PID3
28/02/2025 14:00:00.000 | Info | Closing pos ID:3 — Session end
28/02/2025 14:00:00.000 | Trade | Closing position PID3 (Volume: 1000)
28/02/2025 14:00:00.000 | Trade | → Closing position PID3 (Volume: 1000) SUCCEEDED
28/02/2025 14:00:00.000 | Info | === CLOSED Sell 1000u |PnL:0.23|Pips:3.3 ===
28/02/2025 14:00:00.000 | Info | Day PnL:-1.59 | Closed:2 / Exec:2
02/03/2025 22:01:00.000 | Info | === NEW DAY: 2025-03-02 ===
03/03/2025 00:00:00.000 | Info | === NEW DAY: 2025-03-03 ===
04/03/2025 00:00:00.000 | Info | === NEW DAY: 2025-03-04 ===
04/03/2025 07:00:00.000 | Info | 🚀 Order prep — Entry:1.04878, SL:1.04615, TP:1.05299, Vol:1000
04/03/2025 07:00:00.000 | Trade | Executing Market Order to Buy 1000 EURUSD
04/03/2025 07:00:00.000 | Trade | → Executing Market Order to Buy 1000 EURUSD SUCCEEDED, Position PID4
04/03/2025 07:00:00.000 | Trade | Modifying position PID4 (SL: 1.04615, TP: null)
04/03/2025 07:00:00.000 | Trade | → Modifying position PID4 (SL: 1.04615, TP: null) SUCCEEDED, Position PID4
04/03/2025 07:00:00.000 | Trade | Modifying position PID4 (SL: 1.04615, TP: 1.05299)
04/03/2025 07:00:00.000 | Trade | → Modifying position PID4 (SL: 1.04615, TP: 1.05299) SUCCEEDED, Position PID4
04/03/2025 08:25:00.000 | Info | Closing pos ID:4 — RSI exit
04/03/2025 08:25:00.000 | Trade | Closing position PID4 (Volume: 1000)
04/03/2025 08:25:00.000 | Trade | → Closing position PID4 (Volume: 1000) SUCCEEDED
04/03/2025 08:25:00.000 | Info | === CLOSED Buy 1000u |PnL:1.71|Pips:20.1 ===
04/03/2025 08:25:00.000 | Info | Day PnL:1.71 | Closed:1 / Exec:1
04/03/2025 09:20:00.000 | Info | 🚀 Order prep — Entry:1.05129, SL:1.04831, TP:1.05605, Vol:1000
04/03/2025 09:20:00.000 | Trade | Executing Market Order to Buy 1000 EURUSD
04/03/2025 09:20:00.000 | Trade | → Executing Market Order to Buy 1000 EURUSD SUCCEEDED, Position PID5
04/03/2025 09:20:00.000 | Trade | Modifying position PID5 (SL: 1.04831, TP: null)
04/03/2025 09:20:00.000 | Trade | → Modifying position PID5 (SL: 1.04831, TP: null) SUCCEEDED, Position PID5
04/03/2025 09:20:00.000 | Trade | Modifying position PID5 (SL: 1.04831, TP: 1.05605)
04/03/2025 09:20:00.000 | Trade | → Modifying position PID5 (SL: 1.04831, TP: 1.05605) SUCCEEDED, Position PID5
04/03/2025 09:29:00.000 | Info | Closing pos ID:5 — RSI exit
04/03/2025 09:29:00.000 | Trade | Closing position PID5 (Volume: 1000)
04/03/2025 09:29:00.000 | Trade | → Closing position PID5 (Volume: 1000) SUCCEEDED
04/03/2025 09:29:00.000 | Info | === CLOSED Buy 1000u |PnL:0.23|Pips:3.3 ===
04/03/2025 09:29:00.000 | Info | Day PnL:1.94 | Closed:2 / Exec:2
04/03/2025 10:26:00.000 | Info | 🚀 Order prep — Entry:1.05037, SL:1.04741, TP:1.05511, Vol:1000
04/03/2025 10:26:00.000 | Trade | Executing Market Order to Buy 1000 EURUSD
04/03/2025 10:26:00.000 | Trade | → Executing Market Order to Buy 1000 EURUSD SUCCEEDED, Position PID6
04/03/2025 10:26:00.000 | Trade | Modifying position PID6 (SL: 1.04741, TP: null)
04/03/2025 10:26:00.000 | Trade | → Modifying position PID6 (SL: 1.04741, TP: null) SUCCEEDED, Position PID6
04/03/2025 10:26:00.000 | Trade | Modifying position PID6 (SL: 1.04741, TP: 1.05511)
04/03/2025 10:26:00.000 | Trade | → Modifying position PID6 (SL: 1.04741, TP: 1.05511) SUCCEEDED, Position PID6
04/03/2025 10:40:00.000 | Info | Closing pos ID:6 — RSI exit
04/03/2025 10:40:00.000 | Trade | Closing position PID6 (Volume: 1000)
04/03/2025 10:40:00.000 | Trade | → Closing position PID6 (Volume: 1000) SUCCEEDED
04/03/2025 10:40:00.000 | Info | === CLOSED Buy 1000u |PnL:0.77|Pips:9.4 ===
04/03/2025 10:40:00.000 | Info | Day PnL:2.71 | Closed:3 / Exec:3
05/03/2025 00:00:00.000 | Info | === NEW DAY: 2025-03-05 ===
06/03/2025 00:00:00.000 | Info | === NEW DAY: 2025-03-06 ===
06/03/2025 03:50:00.000 | Info | 🚀 Order prep — Entry:1.07911, SL:1.07472, TP:1.08613, Vol:1000
06/03/2025 03:50:00.000 | Trade | Executing Market Order to Buy 1000 EURUSD
06/03/2025 03:50:00.000 | Trade | → Executing Market Order to Buy 1000 EURUSD SUCCEEDED, Position PID7
06/03/2025 03:50:00.000 | Trade | Modifying position PID7 (SL: 1.07472, TP: null)
06/03/2025 03:50:00.000 | Trade | → Modifying position PID7 (SL: 1.07472, TP: null) SUCCEEDED, Position PID7
06/03/2025 03:50:00.000 | Trade | Modifying position PID7 (SL: 1.07472, TP: 1.08613)
06/03/2025 03:50:00.000 | Trade | → Modifying position PID7 (SL: 1.07472, TP: 1.08613) SUCCEEDED, Position PID7
06/03/2025 04:37:00.000 | Info | Closing pos ID:7 — RSI exit
06/03/2025 04:37:00.000 | Trade | Closing position PID7 (Volume: 1000)
06/03/2025 04:37:00.000 | Trade | → Closing position PID7 (Volume: 1000) SUCCEEDED
06/03/2025 04:37:00.000 | Info | === CLOSED Buy 1000u |PnL:0.23|Pips:3.3 ===
06/03/2025 04:37:00.000 | Info | Day PnL:0.23 | Closed:1 / Exec:1
06/03/2025 06:40:00.000 | Info | 🚀 Order prep — Entry:1.08045, SL:1.07703, TP:1.08592, Vol:1000
06/03/2025 06:40:00.000 | Trade | Executing Market Order to Buy 1000 EURUSD
06/03/2025 06:40:00.000 | Trade | → Executing Market Order to Buy 1000 EURUSD SUCCEEDED, Position PID8
06/03/2025 06:40:00.000 | Trade | Modifying position PID8 (SL: 1.07703, TP: null)
06/03/2025 06:40:00.000 | Trade | → Modifying position PID8 (SL: 1.07703, TP: null) SUCCEEDED, Position PID8
06/03/2025 06:40:00.000 | Trade | Modifying position PID8 (SL: 1.07703, TP: 1.08592)
06/03/2025 06:40:00.000 | Trade | → Modifying position PID8 (SL: 1.07703, TP: 1.08592) SUCCEEDED, Position PID8
06/03/2025 06:43:00.000 | Info | Closing pos ID:8 — RSI exit
06/03/2025 06:43:00.000 | Trade | Closing position PID8 (Volume: 1000)
06/03/2025 06:43:00.000 | Trade | → Closing position PID8 (Volume: 1000) SUCCEEDED
06/03/2025 06:43:00.000 | Info | === CLOSED Buy 1000u |PnL:-0.10|Pips:-0.4 ===
06/03/2025 06:43:00.000 | Info | Day PnL:0.13 | Closed:2 / Exec:2
06/03/2025 06:47:00.000 | Info | 🚀 Order prep — Entry:1.08041, SL:1.07697, TP:1.08592, Vol:1000
06/03/2025 06:47:00.000 | Trade | Executing Market Order to Buy 1000 EURUSD
06/03/2025 06:47:00.000 | Trade | → Executing Market Order to Buy 1000 EURUSD SUCCEEDED, Position PID9
06/03/2025 06:47:00.000 | Trade | Modifying position PID9 (SL: 1.07697, TP: null)
06/03/2025 06:47:00.000 | Trade | → Modifying position PID9 (SL: 1.07697, TP: null) SUCCEEDED, Position PID9
06/03/2025 06:47:00.000 | Trade | Modifying position PID9 (SL: 1.07697, TP: 1.08592)
06/03/2025 06:47:00.000 | Trade | → Modifying position PID9 (SL: 1.07697, TP: 1.08592) SUCCEEDED, Position PID9
06/03/2025 06:50:00.000 | Info | Closing pos ID:9 — RSI exit
06/03/2025 06:50:00.000 | Trade | Closing position PID9 (Volume: 1000)
06/03/2025 06:50:00.000 | Trade | → Closing position PID9 (Volume: 1000) SUCCEEDED
06/03/2025 06:50:00.000 | Info | === CLOSED Buy 1000u |PnL:-0.05|Pips:0.1 ===
06/03/2025 06:50:00.000 | Info | Day PnL:0.08 | Closed:3 / Exec:3
06/03/2025 06:51:00.000 | Info | 🚀 Order prep — Entry:1.08049, SL:1.07705, TP:1.08600, Vol:1000
06/03/2025 06:51:00.000 | Trade | Executing Market Order to Buy 1000 EURUSD
06/03/2025 06:51:00.000 | Trade | → Executing Market Order to Buy 1000 EURUSD SUCCEEDED, Position PID10
06/03/2025 06:51:00.000 | Trade | Modifying position PID10 (SL: 1.07705, TP: null)
06/03/2025 06:51:00.000 | Trade | → Modifying position PID10 (SL: 1.07705, TP: null) SUCCEEDED, Position PID10
06/03/2025 06:51:00.000 | Trade | Modifying position PID10 (SL: 1.07705, TP: 1.086)
06/03/2025 06:51:00.000 | Trade | → Modifying position PID10 (SL: 1.07705, TP: 1.086) SUCCEEDED, Position PID10
06/03/2025 18:44:00.000 | Info | === CLOSED Buy 1000u |PnL:-3.15|Pips:-35.1 ===
06/03/2025 18:44:00.000 | Info | Day PnL:-3.07 | Closed:4 / Exec:4
07/03/2025 00:00:00.000 | Info | === NEW DAY: 2025-03-07 ===
07/03/2025 03:00:00.000 | Info | 🚀 Order prep — Entry:1.08002, SL:1.07589, TP:1.08662, Vol:1000
07/03/2025 03:00:00.000 | Trade | Executing Market Order to Buy 1000 EURUSD
07/03/2025 03:00:00.000 | Trade | → Executing Market Order to Buy 1000 EURUSD SUCCEEDED, Position PID11
07/03/2025 03:00:00.000 | Trade | Modifying position PID11 (SL: 1.07589, TP: null)
07/03/2025 03:00:00.000 | Trade | → Modifying position PID11 (SL: 1.07589, TP: null) SUCCEEDED, Position PID11
07/03/2025 03:00:00.000 | Trade | Modifying position PID11 (SL: 1.07589, TP: 1.08662)
07/03/2025 03:00:00.000 | Trade | → Modifying position PID11 (SL: 1.07589, TP: 1.08662) SUCCEEDED, Position PID11
07/03/2025 07:45:00.000 | Trade | Modifying position PID11 (SL: 1.08012, TP: 1.08662)
07/03/2025 07:45:00.000 | Trade | → Modifying position PID11 (SL: 1.08012, TP: 1.08662) SUCCEEDED, Position PID11
07/03/2025 07:45:00.000 | Trade | Modifying position PID11 (SL: 1.08012, TP: 1.08662)
07/03/2025 07:45:00.000 | Trade | → Modifying position PID11 (SL: 1.08012, TP: 1.08662) SUCCEEDED, Position PID11
07/03/2025 07:45:00.000 | Info | ✅ Breakeven moved to 1.08012
07/03/2025 08:19:00.000 | Trade | Executing Market Order to Sell 300 EURUSD
07/03/2025 08:19:00.000 | Trade | → Executing Market Order to Sell 300 EURUSD FAILED with error "BadVolume"
07/03/2025 08:19:00.000 | Info | ❌ Partial close error:BadVolume
07/03/2025 08:24:00.000 | Info | Closing pos ID:11 — RSI exit
07/03/2025 08:24:00.000 | Trade | Closing position PID11 (Volume: 1000)
07/03/2025 08:24:00.000 | Trade | → Closing position PID11 (Volume: 1000) SUCCEEDED
07/03/2025 08:24:00.000 | Info | === CLOSED Buy 1000u |PnL:3.81|Pips:44.0 ===
07/03/2025 08:24:00.000 | Info | Day PnL:3.81 | Closed:1 / Exec:1
09/03/2025 21:02:00.000 | Info | === NEW DAY: 2025-03-09 ===
10/03/2025 00:00:00.000 | Info | === NEW DAY: 2025-03-10 ===
10/03/2025 03:00:00.000 | Info | 🚀 Order prep — Entry:1.08375, SL:1.07975, TP:1.09014, Vol:1000
10/03/2025 03:00:00.000 | Trade | Executing Market Order to Buy 1000 EURUSD
10/03/2025 03:00:00.000 | Trade | → Executing Market Order to Buy 1000 EURUSD SUCCEEDED, Position PID12
10/03/2025 03:00:00.000 | Trade | Modifying position PID12 (SL: 1.07975, TP: null)
10/03/2025 03:00:00.000 | Trade | → Modifying position PID12 (SL: 1.07975, TP: null) SUCCEEDED, Position PID12
10/03/2025 03:00:00.000 | Trade | Modifying position PID12 (SL: 1.07975, TP: 1.09014)
10/03/2025 03:00:00.000 | Trade | → Modifying position PID12 (SL: 1.07975, TP: 1.09014) SUCCEEDED, Position PID12
10/03/2025 14:00:00.000 | Info | Closing pos ID:12 — Session end
10/03/2025 14:00:00.000 | Trade | Closing position PID12 (Volume: 1000)
10/03/2025 14:00:00.000 | Trade | → Closing position PID12 (Volume: 1000) SUCCEEDED
10/03/2025 14:00:00.000 | Info | === CLOSED Buy 1000u |PnL:-0.27|Pips:-2.4 ===
10/03/2025 14:00:00.000 | Info | Day PnL:-0.27 | Closed:1 / Exec:1
11/03/2025 00:00:00.000 | Info | === NEW DAY: 2025-03-11 ===
12/03/2025 00:00:00.000 | Info | === NEW DAY: 2025-03-12 ===
13/03/2025 00:00:00.000 | Info | === NEW DAY: 2025-03-13 ===
14/03/2025 00:00:00.000 | Info | === NEW DAY: 2025-03-14 ===
14/03/2025 10:08:00.000 | Info | 🚀 Order prep — Entry:1.08678, SL:1.08446, TP:1.09049, Vol:1000
14/03/2025 10:08:00.000 | Trade | Executing Market Order to Buy 1000 EURUSD
14/03/2025 10:08:00.000 | Trade | → Executing Market Order to Buy 1000 EURUSD SUCCEEDED, Position PID13
14/03/2025 10:08:00.000 | Trade | Modifying position PID13 (SL: 1.08446, TP: null)
14/03/2025 10:08:00.000 | Trade | → Modifying position PID13 (SL: 1.08446, TP: null) SUCCEEDED, Position PID13
14/03/2025 10:08:00.000 | Trade | Modifying position PID13 (SL: 1.08446, TP: 1.09049)
14/03/2025 10:08:00.000 | Trade | → Modifying position PID13 (SL: 1.08446, TP: 1.09049) SUCCEEDED, Position PID13
14/03/2025 10:45:00.000 | Trade | Modifying position PID13 (SL: 1.08688, TP: 1.09049)
14/03/2025 10:45:00.000 | Trade | → Modifying position PID13 (SL: 1.08688, TP: 1.09049) SUCCEEDED, Position PID13
14/03/2025 10:45:00.000 | Trade | Modifying position PID13 (SL: 1.08688, TP: 1.09049)
14/03/2025 10:45:00.000 | Trade | → Modifying position PID13 (SL: 1.08688, TP: 1.09049) SUCCEEDED, Position PID13
14/03/2025 10:45:00.000 | Info | ✅ Breakeven moved to 1.08688
14/03/2025 10:46:00.000 | Trade | Executing Market Order to Sell 300 EURUSD
14/03/2025 10:46:00.000 | Trade | → Executing Market Order to Sell 300 EURUSD FAILED with error "BadVolume"
14/03/2025 10:46:00.000 | Info | ❌ Partial close error:BadVolume
14/03/2025 10:47:00.000 | Info | === CLOSED Buy 1000u |PnL:3.57|Pips:41.3 ===
14/03/2025 10:47:00.000 | Info | Day PnL:3.57 | Closed:1 / Exec:1
16/03/2025 21:01:00.000 | Info | === NEW DAY: 2025-03-16 ===
17/03/2025 00:00:00.000 | Info | === NEW DAY: 2025-03-17 ===
18/03/2025 00:00:00.000 | Info | === NEW DAY: 2025-03-18 ===
18/03/2025 03:00:00.000 | Info | 🚀 Order prep — Entry:1.09097, SL:1.08926, TP:1.09371, Vol:1000
18/03/2025 03:00:00.000 | Trade | Executing Market Order to Buy 1000 EURUSD
18/03/2025 03:00:00.000 | Trade | → Executing Market Order to Buy 1000 EURUSD SUCCEEDED, Position PID14
18/03/2025 03:00:00.000 | Trade | Modifying position PID14 (SL: 1.08926, TP: null)
18/03/2025 03:00:00.000 | Trade | → Modifying position PID14 (SL: 1.08926, TP: null) SUCCEEDED, Position PID14
18/03/2025 03:00:00.000 | Trade | Modifying position PID14 (SL: 1.08926, TP: 1.09371)
18/03/2025 03:00:00.000 | Trade | → Modifying position PID14 (SL: 1.08926, TP: 1.09371) SUCCEEDED, Position PID14
18/03/2025 07:36:00.000 | Trade | Modifying position PID14 (SL: 1.09107, TP: 1.09371)
18/03/2025 07:36:00.000 | Trade | → Modifying position PID14 (SL: 1.09107, TP: 1.09371) SUCCEEDED, Position PID14
18/03/2025 07:36:00.000 | Trade | Modifying position PID14 (SL: 1.09107, TP: 1.09371)
18/03/2025 07:36:00.000 | Trade | → Modifying position PID14 (SL: 1.09107, TP: 1.09371) SUCCEEDED, Position PID14
18/03/2025 07:36:00.000 | Info | ✅ Breakeven moved to 1.09107
18/03/2025 07:37:00.000 | Trade | Executing Market Order to Sell 300 EURUSD
18/03/2025 07:37:00.000 | Trade | → Executing Market Order to Sell 300 EURUSD FAILED with error "BadVolume"
18/03/2025 07:37:00.000 | Info | ❌ Partial close error:BadVolume
18/03/2025 07:38:00.000 | Trade | Executing Market Order to Sell 300 EURUSD
18/03/2025 07:38:00.000 | Trade | → Executing Market Order to Sell 300 EURUSD FAILED with error "BadVolume"
18/03/2025 07:38:00.000 | Info | ❌ Partial close error:BadVolume
18/03/2025 07:39:00.000 | Trade | Executing Market Order to Sell 300 EURUSD
18/03/2025 07:39:00.000 | Trade | → Executing Market Order to Sell 300 EURUSD FAILED with error "BadVolume"
18/03/2025 07:39:00.000 | Info | ❌ Partial close error:BadVolume
18/03/2025 07:40:00.000 | Trade | Executing Market Order to Sell 300 EURUSD
18/03/2025 07:40:00.000 | Trade | → Executing Market Order to Sell 300 EURUSD FAILED with error "BadVolume"
18/03/2025 07:40:00.000 | Info | ❌ Partial close error:BadVolume
18/03/2025 07:41:00.000 | Trade | Executing Market Order to Sell 300 EURUSD
18/03/2025 07:41:00.000 | Trade | → Executing Market Order to Sell 300 EURUSD FAILED with error "BadVolume"
18/03/2025 07:41:00.000 | Info | ❌ Partial close error:BadVolume
18/03/2025 07:42:00.000 | Trade | Executing Market Order to Sell 300 EURUSD
18/03/2025 07:42:00.000 | Trade | → Executing Market Order to Sell 300 EURUSD FAILED with error "BadVolume"
18/03/2025 07:42:00.000 | Info | ❌ Partial close error:BadVolume
18/03/2025 07:47:00.000 | Trade | Executing Market Order to Sell 300 EURUSD
18/03/2025 07:47:00.000 | Trade | → Executing Market Order to Sell 300 EURUSD FAILED with error "BadVolume"
18/03/2025 07:47:00.000 | Info | ❌ Partial close error:BadVolume
18/03/2025 07:48:00.000 | Trade | Executing Market Order to Sell 300 EURUSD
18/03/2025 07:48:00.000 | Trade | → Executing Market Order to Sell 300 EURUSD FAILED with error "BadVolume"
18/03/2025 07:48:00.000 | Info | ❌ Partial close error:BadVolume
18/03/2025 07:49:00.000 | Trade | Executing Market Order to Sell 300 EURUSD
18/03/2025 07:49:00.000 | Trade | → Executing Market Order to Sell 300 EURUSD FAILED with error "BadVolume"
18/03/2025 07:49:00.000 | Info | ❌ Partial close error:BadVolume
18/03/2025 07:50:00.000 | Trade | Executing Market Order to Sell 300 EURUSD
18/03/2025 07:50:00.000 | Trade | → Executing Market Order to Sell 300 EURUSD FAILED with error "BadVolume"
18/03/2025 07:50:00.000 | Info | ❌ Partial close error:BadVolume
18/03/2025 07:51:00.000 | Trade | Executing Market Order to Sell 300 EURUSD
18/03/2025 07:51:00.000 | Trade | → Executing Market Order to Sell 300 EURUSD FAILED with error "BadVolume"
18/03/2025 07:51:00.000 | Info | ❌ Partial close error:BadVolume
18/03/2025 07:52:00.000 | Trade | Executing Market Order to Sell 300 EURUSD
18/03/2025 07:52:00.000 | Trade | → Executing Market Order to Sell 300 EURUSD FAILED with error "BadVolume"
18/03/2025 07:52:00.000 | Info | ❌ Partial close error:BadVolume
18/03/2025 07:56:00.000 | Trade | Executing Market Order to Sell 300 EURUSD
18/03/2025 07:56:00.000 | Trade | → Executing Market Order to Sell 300 EURUSD FAILED with error "BadVolume"
18/03/2025 07:56:00.000 | Info | ❌ Partial close error:BadVolume
18/03/2025 07:57:00.000 | Trade | Executing Market Order to Sell 300 EURUSD
18/03/2025 07:57:00.000 | Trade | → Executing Market Order to Sell 300 EURUSD FAILED with error "BadVolume"
18/03/2025 07:57:00.000 | Info | ❌ Partial close error:BadVolume
18/03/2025 07:58:00.000 | Trade | Executing Market Order to Sell 300 EURUSD
18/03/2025 07:58:00.000 | Trade | → Executing Market Order to Sell 300 EURUSD FAILED with error "BadVolume"
18/03/2025 07:58:00.000 | Info | ❌ Partial close error:BadVolume
18/03/2025 07:59:00.000 | Trade | Executing Market Order to Sell 300 EURUSD
18/03/2025 07:59:00.000 | Trade | → Executing Market Order to Sell 300 EURUSD FAILED with error "BadVolume"
18/03/2025 07:59:00.000 | Info | ❌ Partial close error:BadVolume
18/03/2025 08:00:00.000 | Trade | Executing Market Order to Sell 300 EURUSD
18/03/2025 08:00:00.000 | Trade | → Executing Market Order to Sell 300 EURUSD FAILED with error "BadVolume"
18/03/2025 08:00:00.000 | Info | ❌ Partial close error:BadVolume
18/03/2025 08:01:00.000 | Info | === CLOSED Buy 1000u |PnL:2.56|Pips:29.8 ===
18/03/2025 08:01:00.000 | Info | Day PnL:2.56 | Closed:1 / Exec:1
19/03/2025 00:00:00.000 | Info | === NEW DAY: 2025-03-19 ===
20/03/2025 00:00:00.000 | Info | === NEW DAY: 2025-03-20 ===
21/03/2025 00:00:00.000 | Info | === NEW DAY: 2025-03-21 ===
23/03/2025 21:01:00.000 | Info | === NEW DAY: 2025-03-23 ===
24/03/2025 00:00:00.000 | Info | === NEW DAY: 2025-03-24 ===
24/03/2025 03:47:00.000 | Info | 🚀 Order prep — Entry:1.08242, SL:1.08522, TP:1.07794, Vol:1000
24/03/2025 03:47:00.000 | Trade | Executing Market Order to Sell 1000 EURUSD
24/03/2025 03:47:00.000 | Trade | → Executing Market Order to Sell 1000 EURUSD SUCCEEDED, Position PID15
24/03/2025 03:47:00.000 | Trade | Modifying position PID15 (SL: 1.08522, TP: null)
24/03/2025 03:47:00.000 | Trade | → Modifying position PID15 (SL: 1.08522, TP: null) SUCCEEDED, Position PID15
24/03/2025 03:47:00.000 | Trade | Modifying position PID15 (SL: 1.08522, TP: 1.07794)
24/03/2025 03:47:00.000 | Trade | → Modifying position PID15 (SL: 1.08522, TP: 1.07794) SUCCEEDED, Position PID15
24/03/2025 08:23:00.000 | Info | === CLOSED Sell 1000u |PnL:-2.73|Pips:-30.3 ===
24/03/2025 08:23:00.000 | Info | Day PnL:-2.73 | Closed:1 / Exec:1
25/03/2025 00:00:00.000 | Info | === NEW DAY: 2025-03-25 ===
26/03/2025 00:00:00.000 | Info | === NEW DAY: 2025-03-26 ===
26/03/2025 06:00:00.000 | Info | 🚀 Order prep — Entry:1.07853, SL:1.08025, TP:1.07578, Vol:1000
26/03/2025 06:00:00.000 | Trade | Executing Market Order to Sell 1000 EURUSD
26/03/2025 06:00:00.000 | Trade | → Executing Market Order to Sell 1000 EURUSD SUCCEEDED, Position PID16
26/03/2025 06:00:00.000 | Trade | Modifying position PID16 (SL: 1.08025, TP: null)
26/03/2025 06:00:00.000 | Trade | → Modifying position PID16 (SL: 1.08025, TP: null) SUCCEEDED, Position PID16
26/03/2025 06:00:00.000 | Trade | Modifying position PID16 (SL: 1.08025, TP: 1.07578)
26/03/2025 06:00:00.000 | Trade | → Modifying position PID16 (SL: 1.08025, TP: 1.07578) SUCCEEDED, Position PID16
26/03/2025 09:35:00.000 | Info | === CLOSED Sell 1000u |PnL:-1.68|Pips:-18.4 ===
26/03/2025 09:35:00.000 | Info | Day PnL:-1.68 | Closed:1 / Exec:1
27/03/2025 00:00:00.000 | Info | === NEW DAY: 2025-03-27 ===
27/03/2025 13:12:00.000 | Info | 🚀 Order prep — Entry:1.07820, SL:1.08139, TP:1.07310, Vol:1000
27/03/2025 13:12:00.000 | Trade | Executing Market Order to Sell 1000 EURUSD
27/03/2025 13:12:00.000 | Trade | → Executing Market Order to Sell 1000 EURUSD SUCCEEDED, Position PID17
27/03/2025 13:12:00.000 | Trade | Modifying position PID17 (SL: 1.08139, TP: null)
27/03/2025 13:12:00.000 | Trade | → Modifying position PID17 (SL: 1.08139, TP: null) SUCCEEDED, Position PID17
27/03/2025 13:12:00.000 | Trade | Modifying position PID17 (SL: 1.08139, TP: 1.0731)
27/03/2025 13:12:00.000 | Trade | → Modifying position PID17 (SL: 1.08139, TP: 1.0731) SUCCEEDED, Position PID17
27/03/2025 14:00:00.000 | Info | Closing pos ID:17 — Session end
27/03/2025 14:00:00.000 | Trade | Closing position PID17 (Volume: 1000)
27/03/2025 14:00:00.000 | Trade | → Closing position PID17 (Volume: 1000) SUCCEEDED
27/03/2025 14:00:00.000 | Info | === CLOSED Sell 1000u |PnL:-0.01|Pips:0.6 ===
27/03/2025 14:00:00.000 | Info | Day PnL:-0.01 | Closed:1 / Exec:1
28/03/2025 00:00:00.000 | Info | === NEW DAY: 2025-03-28 ===
28/03/2025 04:21:00.000 | Info | 🚀 Order prep — Entry:1.07862, SL:1.08070, TP:1.07529, Vol:1000
28/03/2025 04:21:00.000 | Trade | Executing Market Order to Sell 1000 EURUSD
28/03/2025 04:21:00.000 | Trade | → Executing Market Order to Sell 1000 EURUSD SUCCEEDED, Position PID18
28/03/2025 04:21:00.000 | Trade | Modifying position PID18 (SL: 1.0807, TP: null)
28/03/2025 04:21:00.000 | Trade | → Modifying position PID18 (SL: 1.0807, TP: null) SUCCEEDED, Position PID18
28/03/2025 04:21:00.000 | Trade | Modifying position PID18 (SL: 1.0807, TP: 1.07529)
28/03/2025 04:21:00.000 | Trade | → Modifying position PID18 (SL: 1.0807, TP: 1.07529) SUCCEEDED, Position PID18
28/03/2025 12:09:00.000 | Trade | Modifying position PID18 (SL: 1.07852, TP: 1.07529)
28/03/2025 12:09:00.000 | Trade | → Modifying position PID18 (SL: 1.07852, TP: 1.07529) SUCCEEDED, Position PID18
28/03/2025 12:09:00.000 | Trade | Modifying position PID18 (SL: 1.07852, TP: 1.07529)
28/03/2025 12:09:00.000 | Trade | → Modifying position PID18 (SL: 1.07852, TP: 1.07529) SUCCEEDED, Position PID18
28/03/2025 12:09:00.000 | Info | ✅ Breakeven moved to 1.07852
28/03/2025 12:51:00.000 | Info | === CLOSED Sell 1000u |PnL:0.01|Pips:0.8 ===
28/03/2025 12:51:00.000 | Info | Day PnL:0.01 | Closed:1 / Exec:1
30/03/2025 21:01:00.000 | Info | === NEW DAY: 2025-03-30 ===
31/03/2025 00:00:00.000 | Info | === NEW DAY: 2025-03-31 ===
31/03/2025 10:12:00.000 | Info | 🚀 Order prep — Entry:1.08087, SL:1.08423, TP:1.07549, Vol:1000
31/03/2025 10:12:00.000 | Trade | Executing Market Order to Sell 1000 EURUSD
31/03/2025 10:12:00.000 | Trade | → Executing Market Order to Sell 1000 EURUSD SUCCEEDED, Position PID19
31/03/2025 10:12:00.000 | Trade | Modifying position PID19 (SL: 1.08423, TP: null)
31/03/2025 10:12:00.000 | Trade | → Modifying position PID19 (SL: 1.08423, TP: null) SUCCEEDED, Position PID19
31/03/2025 10:12:00.000 | Trade | Modifying position PID19 (SL: 1.08423, TP: 1.07549)
31/03/2025 10:12:00.000 | Trade | → Modifying position PID19 (SL: 1.08423, TP: 1.07549) SUCCEEDED, Position PID19
31/03/2025 14:00:00.000 | Info | Closing pos ID:19 — Session end
31/03/2025 14:00:00.000 | Trade | Closing position PID19 (Volume: 1000)
31/03/2025 14:00:00.000 | Trade | → Closing position PID19 (Volume: 1000) SUCCEEDED
31/03/2025 14:00:00.000 | Info | === CLOSED Sell 1000u |PnL:-0.07|Pips:-0.1 ===
31/03/2025 14:00:00.000 | Info | Day PnL:-0.07 | Closed:1 / Exec:1
01/04/2025 00:00:00.000 | Info | === NEW DAY: 2025-04-01 ===
02/04/2025 00:00:00.000 | Info | === NEW DAY: 2025-04-02 ===
03/04/2025 00:00:00.000 | Info | === NEW DAY: 2025-04-03 ===
04/04/2025 00:00:00.000 | Info | === NEW DAY: 2025-04-04 ===
04/04/2025 04:14:00.000 | Info | 🚀 Order prep — Entry:1.10897, SL:1.10384, TP:1.11717, Vol:1000
04/04/2025 04:14:00.000 | Trade | Executing Market Order to Buy 1000 EURUSD
04/04/2025 04:14:00.000 | Trade | → Executing Market Order to Buy 1000 EURUSD SUCCEEDED, Position PID20
04/04/2025 04:14:00.000 | Trade | Modifying position PID20 (SL: 1.10384, TP: null)
04/04/2025 04:14:00.000 | Trade | → Modifying position PID20 (SL: 1.10384, TP: null) SUCCEEDED, Position PID20
04/04/2025 04:14:00.000 | Trade | Modifying position PID20 (SL: 1.10384, TP: 1.11717)
04/04/2025 04:14:00.000 | Trade | → Modifying position PID20 (SL: 1.10384, TP: 1.11717) SUCCEEDED, Position PID20
04/04/2025 07:37:00.000 | Info | === CLOSED Buy 1000u |PnL:-4.62|Pips:-51.8 ===
04/04/2025 07:37:00.000 | Info | Day PnL:-4.62 | Closed:1 / Exec:1
04/04/2025 13:18:00.000 | Info | 🚀 Order prep — Entry:1.10401, SL:1.09589, TP:1.11700, Vol:1000
04/04/2025 13:18:00.000 | Trade | Executing Market Order to Buy 1000 EURUSD
04/04/2025 13:18:00.000 | Trade | → Executing Market Order to Buy 1000 EURUSD SUCCEEDED, Position PID21
04/04/2025 13:18:00.000 | Trade | Modifying position PID21 (SL: 1.09589, TP: null)
04/04/2025 13:18:00.000 | Trade | → Modifying position PID21 (SL: 1.09589, TP: null) SUCCEEDED, Position PID21
04/04/2025 13:18:00.000 | Trade | Modifying position PID21 (SL: 1.09589, TP: 1.117)
04/04/2025 13:18:00.000 | Trade | → Modifying position PID21 (SL: 1.09589, TP: 1.117) SUCCEEDED, Position PID21
04/04/2025 14:00:00.000 | Info | Closing pos ID:21 — Session end
04/04/2025 14:00:00.000 | Trade | Closing position PID21 (Volume: 1000)
04/04/2025 14:00:00.000 | Trade | → Closing position PID21 (Volume: 1000) SUCCEEDED
04/04/2025 14:00:00.000 | Info | === CLOSED Buy 1000u |PnL:-3.11|Pips:-34.7 ===
04/04/2025 14:00:00.000 | Info | Day PnL:-7.73 | Closed:2 / Exec:2
06/04/2025 21:01:00.000 | Info | === NEW DAY: 2025-04-06 ===
07/04/2025 00:00:00.000 | Info | === NEW DAY: 2025-04-07 ===
07/04/2025 04:27:00.000 | Info | 🚀 Order prep — Entry:1.09761, SL:1.08946, TP:1.11065, Vol:1000
07/04/2025 04:27:00.000 | Trade | Executing Market Order to Buy 1000 EURUSD
07/04/2025 04:27:00.000 | Trade | → Executing Market Order to Buy 1000 EURUSD SUCCEEDED, Position PID22
07/04/2025 04:27:00.000 | Trade | Modifying position PID22 (SL: 1.08946, TP: null)
07/04/2025 04:27:00.000 | Trade | → Modifying position PID22 (SL: 1.08946, TP: null) SUCCEEDED, Position PID22
07/04/2025 04:27:00.000 | Trade | Modifying position PID22 (SL: 1.08946, TP: 1.11065)
07/04/2025 04:27:00.000 | Trade | → Modifying position PID22 (SL: 1.08946, TP: 1.11065) SUCCEEDED, Position PID22
07/04/2025 14:00:00.000 | Info | Closing pos ID:22 — Session end
07/04/2025 14:00:00.000 | Trade | Closing position PID22 (Volume: 1000)
07/04/2025 14:00:00.000 | Trade | → Closing position PID22 (Volume: 1000) SUCCEEDED
07/04/2025 14:00:00.000 | Info | === CLOSED Buy 1000u |PnL:-3.10|Pips:-34.6 ===
07/04/2025 14:00:00.000 | Info | Day PnL:-3.10 | Closed:1 / Exec:1
08/04/2025 00:00:00.000 | Info | === NEW DAY: 2025-04-08 ===
09/04/2025 00:00:00.000 | Info | === NEW DAY: 2025-04-09 ===
09/04/2025 11:02:00.000 | Info | 🚀 Order prep — Entry:1.10256, SL:1.09542, TP:1.11398, Vol:1000
09/04/2025 11:02:00.000 | Trade | Executing Market Order to Buy 1000 EURUSD
09/04/2025 11:02:00.000 | Trade | → Executing Market Order to Buy 1000 EURUSD SUCCEEDED, Position PID23
09/04/2025 11:02:00.000 | Trade | Modifying position PID23 (SL: 1.09542, TP: null)
09/04/2025 11:02:00.000 | Trade | → Modifying position PID23 (SL: 1.09542, TP: null) SUCCEEDED, Position PID23
09/04/2025 11:02:00.000 | Trade | Modifying position PID23 (SL: 1.09542, TP: 1.11398)
09/04/2025 11:02:00.000 | Trade | → Modifying position PID23 (SL: 1.09542, TP: 1.11398) SUCCEEDED, Position PID23
09/04/2025 12:39:00.000 | Trade | Modifying position PID23 (SL: 1.10266, TP: 1.11398)
09/04/2025 12:39:00.000 | Trade | → Modifying position PID23 (SL: 1.10266, TP: 1.11398) SUCCEEDED, Position PID23
09/04/2025 12:39:00.000 | Trade | Modifying position PID23 (SL: 1.10266, TP: 1.11398)
09/04/2025 12:39:00.000 | Trade | → Modifying position PID23 (SL: 1.10266, TP: 1.11398) SUCCEEDED, Position PID23
09/04/2025 12:39:00.000 | Info | ✅ Breakeven moved to 1.10266
09/04/2025 14:00:00.000 | Info | Closing pos ID:23 — Session end
09/04/2025 14:00:00.000 | Trade | Closing position PID23 (Volume: 1000)
09/04/2025 14:00:00.000 | Trade | → Closing position PID23 (Volume: 1000) SUCCEEDED
09/04/2025 14:00:00.000 | Info | === CLOSED Buy 1000u |PnL:1.64|Pips:19.3 ===
09/04/2025 14:00:00.000 | Info | Day PnL:1.64 | Closed:1 / Exec:1
10/04/2025 00:00:00.000 | Info | === NEW DAY: 2025-04-10 ===
11/04/2025 00:00:00.000 | Info | === NEW DAY: 2025-04-11 ===
11/04/2025 11:14:00.000 | Info | 🚀 Order prep — Entry:1.13455, SL:1.12271, TP:1.15349, Vol:1000
11/04/2025 11:14:00.000 | Trade | Executing Market Order to Buy 1000 EURUSD
11/04/2025 11:14:00.000 | Trade | → Executing Market Order to Buy 1000 EURUSD SUCCEEDED, Position PID24
11/04/2025 11:14:00.000 | Trade | Modifying position PID24 (SL: 1.12271, TP: null)
11/04/2025 11:14:00.000 | Trade | → Modifying position PID24 (SL: 1.12271, TP: null) SUCCEEDED, Position PID24
11/04/2025 11:14:00.000 | Trade | Modifying position PID24 (SL: 1.12271, TP: 1.15349)
11/04/2025 11:14:00.000 | Trade | → Modifying position PID24 (SL: 1.12271, TP: 1.15349) SUCCEEDED, Position PID24
11/04/2025 14:00:00.000 | Info | Closing pos ID:24 — Session end
11/04/2025 14:00:00.000 | Trade | Closing position PID24 (Volume: 1000)
11/04/2025 14:00:00.000 | Trade | → Closing position PID24 (Volume: 1000) SUCCEEDED
11/04/2025 14:00:00.000 | Info | === CLOSED Buy 1000u |PnL:1.34|Pips:15.9 ===
11/04/2025 14:00:00.000 | Info | Day PnL:1.34 | Closed:1 / Exec:1
13/04/2025 21:14:00.000 | Info | === NEW DAY: 2025-04-13 ===
14/04/2025 00:00:00.000 | Info | === NEW DAY: 2025-04-14 ===
14/04/2025 03:00:00.000 | Info | 🚀 Order prep — Entry:1.13727, SL:1.13042, TP:1.14823, Vol:1000
14/04/2025 03:00:00.000 | Trade | Executing Market Order to Buy 1000 EURUSD
14/04/2025 03:00:00.000 | Trade | → Executing Market Order to Buy 1000 EURUSD SUCCEEDED, Position PID25
14/04/2025 03:00:00.000 | Trade | Modifying position PID25 (SL: 1.13042, TP: null)
14/04/2025 03:00:00.000 | Trade | → Modifying position PID25 (SL: 1.13042, TP: null) SUCCEEDED, Position PID25
14/04/2025 03:00:00.000 | Trade | Modifying position PID25 (SL: 1.13042, TP: 1.14823)
14/04/2025 03:00:00.000 | Trade | → Modifying position PID25 (SL: 1.13042, TP: 1.14823) SUCCEEDED, Position PID25
14/04/2025 13:10:00.000 | Info | === CLOSED Buy 1000u |PnL:-6.19|Pips:-69.7 ===
14/04/2025 13:10:00.000 | Info | Day PnL:-6.19 | Closed:1 / Exec:1
14/04/2025 13:10:00.000 | Info | 🚀 Order prep — Entry:1.13038, SL:1.12352, TP:1.14135, Vol:1000
14/04/2025 13:10:00.000 | Trade | Executing Market Order to Buy 1000 EURUSD
14/04/2025 13:10:00.000 | Trade | → Executing Market Order to Buy 1000 EURUSD SUCCEEDED, Position PID26
14/04/2025 13:10:00.000 | Trade | Modifying position PID26 (SL: 1.12352, TP: null)
14/04/2025 13:10:00.000 | Trade | → Modifying position PID26 (SL: 1.12352, TP: null) SUCCEEDED, Position PID26
14/04/2025 13:10:00.000 | Trade | Modifying position PID26 (SL: 1.12352, TP: 1.14135)
14/04/2025 13:10:00.000 | Trade | → Modifying position PID26 (SL: 1.12352, TP: 1.14135) SUCCEEDED, Position PID26
14/04/2025 14:00:00.000 | Info | Closing pos ID:26 — Session end
14/04/2025 14:00:00.000 | Trade | Closing position PID26 (Volume: 1000)
14/04/2025 14:00:00.000 | Trade | → Closing position PID26 (Volume: 1000) SUCCEEDED
14/04/2025 14:00:00.000 | Info | === CLOSED Buy 1000u |PnL:2.02|Pips:23.6 ===
14/04/2025 14:00:00.000 | Info | Day PnL:-4.17 | Closed:2 / Exec:2
15/04/2025 00:00:00.000 | Info | === NEW DAY: 2025-04-15 ===
16/04/2025 00:00:00.000 | Info | === NEW DAY: 2025-04-16 ===
16/04/2025 13:01:00.000 | Info | 🚀 Order prep — Entry:1.13558, SL:1.13076, TP:1.14330, Vol:1000
16/04/2025 13:01:00.000 | Trade | Executing Market Order to Buy 1000 EURUSD
16/04/2025 13:01:00.000 | Trade | → Executing Market Order to Buy 1000 EURUSD SUCCEEDED, Position PID27
16/04/2025 13:01:00.000 | Trade | Modifying position PID27 (SL: 1.13076, TP: null)
16/04/2025 13:01:00.000 | Trade | → Modifying position PID27 (SL: 1.13076, TP: null) SUCCEEDED, Position PID27
16/04/2025 13:01:00.000 | Trade | Modifying position PID27 (SL: 1.13076, TP: 1.1433)
16/04/2025 13:01:00.000 | Trade | → Modifying position PID27 (SL: 1.13076, TP: 1.1433) SUCCEEDED, Position PID27
16/04/2025 14:00:00.000 | Info | Closing pos ID:27 — Session end
16/04/2025 14:00:00.000 | Trade | Closing position PID27 (Volume: 1000)
16/04/2025 14:00:00.000 | Trade | → Closing position PID27 (Volume: 1000) SUCCEEDED
16/04/2025 14:00:00.000 | Info | === CLOSED Buy 1000u |PnL:1.00|Pips:12.0 ===
16/04/2025 14:00:00.000 | Info | Day PnL:1.00 | Closed:1 / Exec:1
17/04/2025 00:00:00.000 | Info | === NEW DAY: 2025-04-17 ===
17/04/2025 03:00:00.000 | Info | 🚀 Order prep — Entry:1.13792, SL:1.13409, TP:1.14405, Vol:1000
17/04/2025 03:00:00.000 | Trade | Executing Market Order to Buy 1000 EURUSD
17/04/2025 03:00:00.000 | Trade | → Executing Market Order to Buy 1000 EURUSD SUCCEEDED, Position PID28
17/04/2025 03:00:00.000 | Trade | Modifying position PID28 (SL: 1.13409, TP: null)
17/04/2025 03:00:00.000 | Trade | → Modifying position PID28 (SL: 1.13409, TP: null) SUCCEEDED, Position PID28
17/04/2025 03:00:00.000 | Trade | Modifying position PID28 (SL: 1.13409, TP: 1.14405)
17/04/2025 03:00:00.000 | Trade | → Modifying position PID28 (SL: 1.13409, TP: 1.14405) SUCCEEDED, Position PID28
17/04/2025 12:21:00.000 | Info | === CLOSED Buy 1000u |PnL:-3.92|Pips:-43.9 ===
17/04/2025 12:21:00.000 | Info | Day PnL:-3.92 | Closed:1 / Exec:1
18/04/2025 00:00:00.000 | Info | === NEW DAY: 2025-04-18 ===
20/04/2025 21:01:00.000 | Info | === NEW DAY: 2025-04-20 ===
21/04/2025 00:00:00.000 | Info | === NEW DAY: 2025-04-21 ===
21/04/2025 13:43:00.000 | Info | 🚀 Order prep — Entry:1.15150, SL:1.14509, TP:1.16175, Vol:1000
21/04/2025 13:43:00.000 | Trade | Executing Market Order to Buy 1000 EURUSD
21/04/2025 13:43:00.000 | Trade | → Executing Market Order to Buy 1000 EURUSD SUCCEEDED, Position PID29
21/04/2025 13:43:00.000 | Trade | Modifying position PID29 (SL: 1.14509, TP: null)
21/04/2025 13:43:00.000 | Trade | → Modifying position PID29 (SL: 1.14509, TP: null) SUCCEEDED, Position PID29
21/04/2025 13:43:00.000 | Trade | Modifying position PID29 (SL: 1.14509, TP: 1.16175)
21/04/2025 13:43:00.000 | Trade | → Modifying position PID29 (SL: 1.14509, TP: 1.16175) SUCCEEDED, Position PID29
21/04/2025 14:00:00.000 | Info | Closing pos ID:29 — Session end
21/04/2025 14:00:00.000 | Trade | Closing position PID29 (Volume: 1000)
21/04/2025 14:00:00.000 | Trade | → Closing position PID29 (Volume: 1000) SUCCEEDED
21/04/2025 14:00:00.000 | Info | === CLOSED Buy 1000u |PnL:0.28|Pips:3.9 ===
21/04/2025 14:00:00.000 | Info | Day PnL:0.28 | Closed:1 / Exec:1
22/04/2025 00:00:00.000 | Info | === NEW DAY: 2025-04-22 ===
22/04/2025 03:00:00.000 | Info | 🚀 Order prep — Entry:1.15215, SL:1.14853, TP:1.15794, Vol:1000
22/04/2025 03:00:00.000 | Trade | Executing Market Order to Buy 1000 EURUSD
22/04/2025 03:00:00.000 | Trade | → Executing Market Order to Buy 1000 EURUSD SUCCEEDED, Position PID30
22/04/2025 03:00:00.000 | Trade | Modifying position PID30 (SL: 1.14853, TP: null)
22/04/2025 03:00:00.000 | Trade | → Modifying position PID30 (SL: 1.14853, TP: null) SUCCEEDED, Position PID30
22/04/2025 03:00:00.000 | Trade | Modifying position PID30 (SL: 1.14853, TP: 1.15794)
22/04/2025 03:00:00.000 | Trade | → Modifying position PID30 (SL: 1.14853, TP: 1.15794) SUCCEEDED, Position PID30
22/04/2025 07:45:00.000 | Info | === CLOSED Buy 1000u |PnL:-3.40|Pips:-37.9 ===
22/04/2025 07:45:00.000 | Info | Day PnL:-3.40 | Closed:1 / Exec:1
22/04/2025 07:45:00.000 | Info | 🚀 Order prep — Entry:1.14844, SL:1.14420, TP:1.15522, Vol:1000
22/04/2025 07:45:00.000 | Trade | Executing Market Order to Buy 1000 EURUSD
22/04/2025 07:45:00.000 | Trade | → Executing Market Order to Buy 1000 EURUSD SUCCEEDED, Position PID31
22/04/2025 07:45:00.000 | Trade | Modifying position PID31 (SL: 1.1442, TP: null)
22/04/2025 07:45:00.000 | Trade | → Modifying position PID31 (SL: 1.1442, TP: null) SUCCEEDED, Position PID31
22/04/2025 07:45:00.000 | Trade | Modifying position PID31 (SL: 1.1442, TP: 1.15522)
22/04/2025 07:45:00.000 | Trade | → Modifying position PID31 (SL: 1.1442, TP: 1.15522) SUCCEEDED, Position PID31
22/04/2025 14:00:00.000 | Info | Closing pos ID:31 — Session end
22/04/2025 14:00:00.000 | Trade | Closing position PID31 (Volume: 1000)
22/04/2025 14:00:00.000 | Trade | → Closing position PID31 (Volume: 1000) SUCCEEDED
22/04/2025 14:00:00.000 | Info | === CLOSED Buy 1000u |PnL:-0.95|Pips:-10.1 ===
22/04/2025 14:00:00.000 | Info | Day PnL:-4.35 | Closed:2 / Exec:2
23/04/2025 00:00:00.000 | Info | === NEW DAY: 2025-04-23 ===
23/04/2025 09:21:00.000 | Info | 🚀 Order prep — Entry:1.14393, SL:1.13719, TP:1.15472, Vol:1000
23/04/2025 09:21:00.000 | Trade | Executing Market Order to Buy 1000 EURUSD
23/04/2025 09:21:00.000 | Trade | → Executing Market Order to Buy 1000 EURUSD SUCCEEDED, Position PID32
23/04/2025 09:21:00.000 | Trade | Modifying position PID32 (SL: 1.13719, TP: null)
23/04/2025 09:21:00.000 | Trade | → Modifying position PID32 (SL: 1.13719, TP: null) SUCCEEDED, Position PID32
23/04/2025 09:21:00.000 | Trade | Modifying position PID32 (SL: 1.13719, TP: 1.15472)
23/04/2025 09:21:00.000 | Trade | → Modifying position PID32 (SL: 1.13719, TP: 1.15472) SUCCEEDED, Position PID32
23/04/2025 13:48:00.000 | Info | === CLOSED Buy 1000u |PnL:-6.93|Pips:-78.1 ===
23/04/2025 13:48:00.000 | Info | Day PnL:-6.93 | Closed:1 / Exec:1
24/04/2025 00:00:00.000 | Info | === NEW DAY: 2025-04-24 ===
25/04/2025 00:00:00.000 | Info | === NEW DAY: 2025-04-25 ===
27/04/2025 21:32:00.000 | Info | === NEW DAY: 2025-04-27 ===
28/04/2025 00:00:00.000 | Info | === NEW DAY: 2025-04-28 ===
29/04/2025 00:00:00.000 | Info | === NEW DAY: 2025-04-29 ===
30/04/2025 00:00:00.000 | Info | === NEW DAY: 2025-04-30 ===
01/05/2025 00:00:00.000 | Info | === NEW DAY: 2025-05-01 ===
01/05/2025 08:00:00.000 | Info | 🚀 Order prep — Entry:1.13101, SL:1.13377, TP:1.12659, Vol:1000
01/05/2025 08:00:00.000 | Trade | Executing Market Order to Sell 1000 EURUSD
01/05/2025 08:00:00.000 | Trade | → Executing Market Order to Sell 1000 EURUSD SUCCEEDED, Position PID33
01/05/2025 08:00:00.000 | Trade | Modifying position PID33 (SL: 1.13377, TP: null)
01/05/2025 08:00:00.000 | Trade | → Modifying position PID33 (SL: 1.13377, TP: null) SUCCEEDED, Position PID33
01/05/2025 08:00:00.000 | Trade | Modifying position PID33 (SL: 1.13377, TP: 1.12659)
01/05/2025 08:00:00.000 | Trade | → Modifying position PID33 (SL: 1.13377, TP: 1.12659) SUCCEEDED, Position PID33
01/05/2025 11:19:00.000 | Info | === CLOSED Sell 1000u |PnL:-2.88|Pips:-32.0 ===
01/05/2025 11:19:00.000 | Info | Day PnL:-2.88 | Closed:1 / Exec:1
01/05/2025 11:19:00.000 | Info | 🚀 Order prep — Entry:1.13408, SL:1.13714, TP:1.12918, Vol:1000
01/05/2025 11:19:00.000 | Trade | Executing Market Order to Sell 1000 EURUSD
01/05/2025 11:19:00.000 | Trade | → Executing Market Order to Sell 1000 EURUSD SUCCEEDED, Position PID34
01/05/2025 11:19:00.000 | Trade | Modifying position PID34 (SL: 1.13714, TP: null)
01/05/2025 11:19:00.000 | Trade | → Modifying position PID34 (SL: 1.13714, TP: null) SUCCEEDED, Position PID34
01/05/2025 11:19:00.000 | Trade | Modifying position PID34 (SL: 1.13714, TP: 1.12918)
01/05/2025 11:19:00.000 | Trade | → Modifying position PID34 (SL: 1.13714, TP: 1.12918) SUCCEEDED, Position PID34
01/05/2025 12:16:00.000 | Trade | Modifying position PID34 (SL: 1.13398, TP: 1.12918)
01/05/2025 12:16:00.000 | Trade | → Modifying position PID34 (SL: 1.13398, TP: 1.12918) SUCCEEDED, Position PID34
01/05/2025 12:16:00.000 | Trade | Modifying position PID34 (SL: 1.13398, TP: 1.12918)
01/05/2025 12:16:00.000 | Trade | → Modifying position PID34 (SL: 1.13398, TP: 1.12918) SUCCEEDED, Position PID34
01/05/2025 12:16:00.000 | Info | ✅ Breakeven moved to 1.13398
01/05/2025 12:20:00.000 | Trade | Executing Market Order to Buy 300 EURUSD
01/05/2025 12:20:00.000 | Trade | → Executing Market Order to Buy 300 EURUSD FAILED with error "BadVolume"
01/05/2025 12:20:00.000 | Info | ❌ Partial close error:BadVolume
01/05/2025 12:32:00.000 | Info | === CLOSED Sell 1000u |PnL:0.03|Pips:1.0 ===
01/05/2025 12:32:00.000 | Info | Day PnL:-2.85 | Closed:2 / Exec:2
01/05/2025 12:32:00.000 | Info | 🚀 Order prep — Entry:1.13318, SL:1.13674, TP:1.12749, Vol:1000
01/05/2025 12:32:00.000 | Trade | Executing Market Order to Sell 1000 EURUSD
01/05/2025 12:32:00.000 | Trade | → Executing Market Order to Sell 1000 EURUSD SUCCEEDED, Position PID35
01/05/2025 12:32:00.000 | Trade | Modifying position PID35 (SL: 1.13674, TP: null)
01/05/2025 12:32:00.000 | Trade | → Modifying position PID35 (SL: 1.13674, TP: null) SUCCEEDED, Position PID35
01/05/2025 12:32:00.000 | Trade | Modifying position PID35 (SL: 1.13674, TP: 1.12749)
01/05/2025 12:32:00.000 | Trade | → Modifying position PID35 (SL: 1.13674, TP: 1.12749) SUCCEEDED, Position PID35
01/05/2025 14:00:00.000 | Info | Closing pos ID:35 — Session end
01/05/2025 14:00:00.000 | Trade | Closing position PID35 (Volume: 1000)
01/05/2025 14:00:00.000 | Trade | → Closing position PID35 (Volume: 1000) SUCCEEDED
01/05/2025 14:00:00.000 | Info | === CLOSED Sell 1000u |PnL:1.44|Pips:17.0 ===
01/05/2025 14:00:00.000 | Info | Day PnL:-1.41 | Closed:3 / Exec:3
02/05/2025 00:00:00.000 | Info | === NEW DAY: 2025-05-02 ===
02/05/2025 03:00:00.000 | Info | 🚀 Order prep — Entry:1.12942, SL:1.13263, TP:1.12429, Vol:1000
02/05/2025 03:00:00.000 | Trade | Executing Market Order to Sell 1000 EURUSD
02/05/2025 03:00:00.000 | Trade | → Executing Market Order to Sell 1000 EURUSD SUCCEEDED, Position PID36
02/05/2025 03:00:00.000 | Trade | Modifying position PID36 (SL: 1.13263, TP: null)
02/05/2025 03:00:00.000 | Trade | → Modifying position PID36 (SL: 1.13263, TP: null) SUCCEEDED, Position PID36
02/05/2025 03:00:00.000 | Trade | Modifying position PID36 (SL: 1.13263, TP: 1.12429)
02/05/2025 03:00:00.000 | Trade | → Modifying position PID36 (SL: 1.13263, TP: 1.12429) SUCCEEDED, Position PID36
02/05/2025 06:21:00.000 | Info | === CLOSED Sell 1000u |PnL:-2.94|Pips:-32.7 ===
02/05/2025 06:21:00.000 | Info | Day PnL:-2.94 | Closed:1 / Exec:1
02/05/2025 06:46:00.000 | Info | 🚀 Order prep — Entry:1.13185, SL:1.13473, TP:1.12724, Vol:1000
02/05/2025 06:46:00.000 | Trade | Executing Market Order to Sell 1000 EURUSD
02/05/2025 06:46:00.000 | Trade | → Executing Market Order to Sell 1000 EURUSD SUCCEEDED, Position PID37
02/05/2025 06:46:00.000 | Trade | Modifying position PID37 (SL: 1.13473, TP: null)
02/05/2025 06:46:00.000 | Trade | → Modifying position PID37 (SL: 1.13473, TP: null) SUCCEEDED, Position PID37
02/05/2025 06:46:00.000 | Trade | Modifying position PID37 (SL: 1.13473, TP: 1.12724)
02/05/2025 06:46:00.000 | Trade | → Modifying position PID37 (SL: 1.13473, TP: 1.12724) SUCCEEDED, Position PID37
02/05/2025 09:40:00.000 | Info | === CLOSED Sell 1000u |PnL:-2.70|Pips:-30.0 ===
02/05/2025 09:40:00.000 | Info | Day PnL:-5.64 | Closed:2 / Exec:2
04/05/2025 21:09:00.000 | Info | === NEW DAY: 2025-05-04 ===
05/05/2025 00:00:00.000 | Info | === NEW DAY: 2025-05-05 ===
06/05/2025 00:00:00.000 | Info | === NEW DAY: 2025-05-06 ===
07/05/2025 00:00:00.000 | Info | === NEW DAY: 2025-05-07 ===
08/05/2025 00:00:00.000 | Info | === NEW DAY: 2025-05-08 ===
09/05/2025 00:00:00.000 | Info | === NEW DAY: 2025-05-09 ===
09/05/2025 03:01:00.000 | Info | 🚀 Order prep — Entry:1.12228, SL:1.12620, TP:1.11600, Vol:1000
09/05/2025 03:01:00.000 | Trade | Executing Market Order to Sell 1000 EURUSD
09/05/2025 03:01:00.000 | Trade | → Executing Market Order to Sell 1000 EURUSD SUCCEEDED, Position PID38
09/05/2025 03:01:00.000 | Trade | Modifying position PID38 (SL: 1.1262, TP: null)
09/05/2025 03:01:00.000 | Trade | → Modifying position PID38 (SL: 1.1262, TP: null) SUCCEEDED, Position PID38
09/05/2025 03:01:00.000 | Trade | Modifying position PID38 (SL: 1.1262, TP: 1.116)
09/05/2025 03:01:00.000 | Trade | → Modifying position PID38 (SL: 1.1262, TP: 1.116) SUCCEEDED, Position PID38
09/05/2025 13:10:00.000 | Info | === CLOSED Sell 1000u |PnL:-3.61|Pips:-40.3 ===
09/05/2025 13:10:00.000 | Info | Day PnL:-3.61 | Closed:1 / Exec:1
11/05/2025 21:02:00.000 | Info | === NEW DAY: 2025-05-11 ===
12/05/2025 00:00:00.000 | Info | === NEW DAY: 2025-05-12 ===
13/05/2025 00:00:00.000 | Info | === NEW DAY: 2025-05-13 ===
13/05/2025 03:00:00.000 | Info | 🚀 Order prep — Entry:1.11030, SL:1.11322, TP:1.10563, Vol:1000
13/05/2025 03:00:00.000 | Trade | Executing Market Order to Sell 1000 EURUSD
13/05/2025 03:00:00.000 | Trade | → Executing Market Order to Sell 1000 EURUSD SUCCEEDED, Position PID39
13/05/2025 03:00:00.000 | Trade | Modifying position PID39 (SL: 1.11322, TP: null)
13/05/2025 03:00:00.000 | Trade | → Modifying position PID39 (SL: 1.11322, TP: null) SUCCEEDED, Position PID39
13/05/2025 03:00:00.000 | Trade | Modifying position PID39 (SL: 1.11322, TP: 1.10563)
13/05/2025 03:00:00.000 | Trade | → Modifying position PID39 (SL: 1.11322, TP: 1.10563) SUCCEEDED, Position PID39
13/05/2025 12:46:00.000 | Info | === CLOSED Sell 1000u |PnL:-2.65|Pips:-29.4 ===
13/05/2025 12:46:00.000 | Info | Day PnL:-2.65 | Closed:1 / Exec:1
13/05/2025 12:46:00.000 | Info | 🚀 Order prep — Entry:1.11264, SL:1.11549, TP:1.10808, Vol:1000
13/05/2025 12:46:00.000 | Trade | Executing Market Order to Sell 1000 EURUSD
13/05/2025 12:46:00.000 | Trade | → Executing Market Order to Sell 1000 EURUSD SUCCEEDED, Position PID40
13/05/2025 12:46:00.000 | Trade | Modifying position PID40 (SL: 1.11549, TP: null)
13/05/2025 12:46:00.000 | Trade | → Modifying position PID40 (SL: 1.11549, TP: null) SUCCEEDED, Position PID40
13/05/2025 12:46:00.000 | Trade | Modifying position PID40 (SL: 1.11549, TP: 1.10808)
13/05/2025 12:46:00.000 | Trade | → Modifying position PID40 (SL: 1.11549, TP: 1.10808) SUCCEEDED, Position PID40
13/05/2025 14:00:00.000 | Info | Closing pos ID:40 — Session end
13/05/2025 14:00:00.000 | Trade | Closing position PID40 (Volume: 1000)
13/05/2025 14:00:00.000 | Trade | → Closing position PID40 (Volume: 1000) SUCCEEDED
13/05/2025 14:00:00.000 | Info | === CLOSED Sell 1000u |PnL:-0.94|Pips:-10.0 ===
13/05/2025 14:00:00.000 | Info | Day PnL:-3.59 | Closed:2 / Exec:2
14/05/2025 00:00:00.000 | Info | === NEW DAY: 2025-05-14 ===
15/05/2025 00:00:00.000 | Info | === NEW DAY: 2025-05-15 ===
15/05/2025 11:34:00.000 | Info | 🚀 Order prep — Entry:1.11878, SL:1.12198, TP:1.11366, Vol:1000
15/05/2025 11:34:00.000 | Trade | Executing Market Order to Sell 1000 EURUSD
15/05/2025 11:34:00.000 | Trade | → Executing Market Order to Sell 1000 EURUSD SUCCEEDED, Position PID41
15/05/2025 11:34:00.000 | Trade | Modifying position PID41 (SL: 1.12198, TP: null)
15/05/2025 11:34:00.000 | Trade | → Modifying position PID41 (SL: 1.12198, TP: null) SUCCEEDED, Position PID41
15/05/2025 11:34:00.000 | Trade | Modifying position PID41 (SL: 1.12198, TP: 1.11366)
15/05/2025 11:34:00.000 | Trade | → Modifying position PID41 (SL: 1.12198, TP: 1.11366) SUCCEEDED, Position PID41
15/05/2025 13:08:00.000 | Info | === CLOSED Sell 1000u |PnL:-3.10|Pips:-34.6 ===
15/05/2025 13:08:00.000 | Info | Day PnL:-3.10 | Closed:1 / Exec:1
16/05/2025 00:00:00.000 | Info | === NEW DAY: 2025-05-16 ===
18/05/2025 21:01:00.000 | Info | === NEW DAY: 2025-05-18 ===
19/05/2025 00:00:00.000 | Info | === NEW DAY: 2025-05-19 ===
20/05/2025 00:00:00.000 | Info | === NEW DAY: 2025-05-20 ===
20/05/2025 06:00:00.000 | Info | 🚀 Order prep — Entry:1.12556, SL:1.12314, TP:1.12943, Vol:1000
20/05/2025 06:00:00.000 | Trade | Executing Market Order to Buy 1000 EURUSD
20/05/2025 06:00:00.000 | Trade | → Executing Market Order to Buy 1000 EURUSD SUCCEEDED, Position PID42
20/05/2025 06:00:00.000 | Trade | Modifying position PID42 (SL: 1.12314, TP: null)
20/05/2025 06:00:00.000 | Trade | → Modifying position PID42 (SL: 1.12314, TP: null) SUCCEEDED, Position PID42
20/05/2025 06:00:00.000 | Trade | Modifying position PID42 (SL: 1.12314, TP: 1.12943)
20/05/2025 06:00:00.000 | Trade | → Modifying position PID42 (SL: 1.12314, TP: 1.12943) SUCCEEDED, Position PID42
20/05/2025 12:19:00.000 | Info | === CLOSED Buy 1000u |PnL:-2.36|Pips:-26.1 ===
20/05/2025 12:19:00.000 | Info | Day PnL:-2.36 | Closed:1 / Exec:1
20/05/2025 12:19:00.000 | Info | 🚀 Order prep — Entry:1.12319, SL:1.11980, TP:1.12861, Vol:1000
20/05/2025 12:19:00.000 | Trade | Executing Market Order to Buy 1000 EURUSD
20/05/2025 12:19:00.000 | Trade | → Executing Market Order to Buy 1000 EURUSD SUCCEEDED, Position PID43
20/05/2025 12:19:00.000 | Trade | Modifying position PID43 (SL: 1.1198, TP: null)
20/05/2025 12:19:00.000 | Trade | → Modifying position PID43 (SL: 1.1198, TP: null) SUCCEEDED, Position PID43
20/05/2025 12:19:00.000 | Trade | Modifying position PID43 (SL: 1.1198, TP: 1.12861)
20/05/2025 12:19:00.000 | Trade | → Modifying position PID43 (SL: 1.1198, TP: 1.12861) SUCCEEDED, Position PID43
20/05/2025 14:00:00.000 | Info | Closing pos ID:43 — Session end
20/05/2025 14:00:00.000 | Trade | Closing position PID43 (Volume: 1000)
20/05/2025 14:00:00.000 | Trade | → Closing position PID43 (Volume: 1000) SUCCEEDED
20/05/2025 14:00:00.000 | Info | === CLOSED Buy 1000u |PnL:1.20|Pips:14.3 ===
20/05/2025 14:00:00.000 | Info | Day PnL:-1.16 | Closed:2 / Exec:2
21/05/2025 00:00:00.000 | Info | === NEW DAY: 2025-05-21 ===
21/05/2025 12:00:00.000 | Info | 🚀 Order prep — Entry:1.13254, SL:1.12874, TP:1.13862, Vol:1000
21/05/2025 12:00:00.000 | Trade | Executing Market Order to Buy 1000 EURUSD
21/05/2025 12:00:00.000 | Trade | → Executing Market Order to Buy 1000 EURUSD SUCCEEDED, Position PID44
21/05/2025 12:00:00.000 | Trade | Modifying position PID44 (SL: 1.12874, TP: null)
21/05/2025 12:00:00.000 | Trade | → Modifying position PID44 (SL: 1.12874, TP: null) SUCCEEDED, Position PID44
21/05/2025 12:00:00.000 | Trade | Modifying position PID44 (SL: 1.12874, TP: 1.13862)
21/05/2025 12:00:00.000 | Trade | → Modifying position PID44 (SL: 1.12874, TP: 1.13862) SUCCEEDED, Position PID44
21/05/2025 14:00:00.000 | Info | Closing pos ID:44 — Session end
21/05/2025 14:00:00.000 | Trade | Closing position PID44 (Volume: 1000)
21/05/2025 14:00:00.000 | Trade | → Closing position PID44 (Volume: 1000) SUCCEEDED
21/05/2025 14:00:00.000 | Info | === CLOSED Buy 1000u |PnL:0.97|Pips:11.7 ===
21/05/2025 14:00:00.000 | Info | Day PnL:0.97 | Closed:1 / Exec:1
22/05/2025 00:00:00.000 | Info | === NEW DAY: 2025-05-22 ===
22/05/2025 03:00:00.000 | Info | 🚀 Order prep — Entry:1.13400, SL:1.13070, TP:1.13928, Vol:1000
22/05/2025 03:00:00.000 | Trade | Executing Market Order to Buy 1000 EURUSD
22/05/2025 03:00:00.000 | Trade | → Executing Market Order to Buy 1000 EURUSD SUCCEEDED, Position PID45
22/05/2025 03:00:00.000 | Trade | Modifying position PID45 (SL: 1.1307, TP: null)
22/05/2025 03:00:00.000 | Trade | → Modifying position PID45 (SL: 1.1307, TP: null) SUCCEEDED, Position PID45
22/05/2025 03:00:00.000 | Trade | Modifying position PID45 (SL: 1.1307, TP: 1.13928)
22/05/2025 03:00:00.000 | Trade | → Modifying position PID45 (SL: 1.1307, TP: 1.13928) SUCCEEDED, Position PID45
22/05/2025 07:31:00.000 | Info | === CLOSED Buy 1000u |PnL:-3.99|Pips:-44.7 ===
22/05/2025 07:31:00.000 | Info | Day PnL:-3.99 | Closed:1 / Exec:1
22/05/2025 07:31:00.000 | Info | 🚀 Order prep — Entry:1.13083, SL:1.12740, TP:1.13632, Vol:1000
22/05/2025 07:31:00.000 | Trade | Executing Market Order to Buy 1000 EURUSD
22/05/2025 07:31:00.000 | Trade | → Executing Market Order to Buy 1000 EURUSD SUCCEEDED, Position PID46
22/05/2025 07:31:00.000 | Trade | Modifying position PID46 (SL: 1.1274, TP: null)
22/05/2025 07:31:00.000 | Trade | → Modifying position PID46 (SL: 1.1274, TP: null) SUCCEEDED, Position PID46
22/05/2025 07:31:00.000 | Trade | Modifying position PID46 (SL: 1.1274, TP: 1.13632)
22/05/2025 07:31:00.000 | Trade | → Modifying position PID46 (SL: 1.1274, TP: 1.13632) SUCCEEDED, Position PID46
22/05/2025 14:00:00.000 | Info | Closing pos ID:46 — Session end
22/05/2025 14:00:00.000 | Trade | Closing position PID46 (Volume: 1000)
22/05/2025 14:00:00.000 | Trade | → Closing position PID46 (Volume: 1000) SUCCEEDED
22/05/2025 14:00:00.000 | Info | === CLOSED Buy 1000u |PnL:-2.31|Pips:-25.6 ===
22/05/2025 14:00:00.000 | Info | Day PnL:-6.30 | Closed:2 / Exec:2
23/05/2025 00:00:00.000 | Info | === NEW DAY: 2025-05-23 ===
23/05/2025 12:49:00.000 | Info | 🚀 Order prep — Entry:1.13424, SL:1.12956, TP:1.14173, Vol:1000
23/05/2025 12:49:00.000 | Trade | Executing Market Order to Buy 1000 EURUSD
23/05/2025 12:49:00.000 | Trade | → Executing Market Order to Buy 1000 EURUSD SUCCEEDED, Position PID47
23/05/2025 12:49:00.000 | Trade | Modifying position PID47 (SL: 1.12956, TP: null)
23/05/2025 12:49:00.000 | Trade | → Modifying position PID47 (SL: 1.12956, TP: null) SUCCEEDED, Position PID47
23/05/2025 12:49:00.000 | Trade | Modifying position PID47 (SL: 1.12956, TP: 1.14173)
23/05/2025 12:49:00.000 | Trade | → Modifying position PID47 (SL: 1.12956, TP: 1.14173) SUCCEEDED, Position PID47
23/05/2025 14:00:00.000 | Info | Closing pos ID:47 — Session end
23/05/2025 14:00:00.000 | Trade | Closing position PID47 (Volume: 1000)
23/05/2025 14:00:00.000 | Trade | → Closing position PID47 (Volume: 1000) SUCCEEDED
23/05/2025 14:00:00.000 | Info | === CLOSED Buy 1000u |PnL:-2.52|Pips:-27.9 ===
23/05/2025 14:00:00.000 | Info | Day PnL:-2.52 | Closed:1 / Exec:1
25/05/2025 21:01:00.000 | Info | === NEW DAY: 2025-05-25 ===
25/05/2025 23:59:00.000 | Info | === HybridTrendBot v6.0 Stopped ===
25/05/2025 23:59:00.000 | Info | CBot instance [NewBot3.0, EURUSD, h1] stopped.
