25/02/2025 00:00:00.000 | Info | CBot instance [NewBot3.0, EURUSD, h1] started.
25/02/2025 00:00:00.000 | Info | === HybridTrendBot v6.0 Started (ADX filter) ===
25/02/2025 00:00:00.000 | Info | Symbol: EURUSD. Fixed Volume: 1000 units.
25/02/2025 00:00:00.000 | Info | OnStart completed.
26/02/2025 00:00:00.000 | Info | === NEW DAY: 2025-02-26 ===
26/02/2025 03:00:00.000 | Info | 🚀 Order prep — Entry:1.05077, SL:1.04849, TP:1.05532, Vol:1000
26/02/2025 03:00:00.000 | Trade | Executing Market Order to Buy 1000 EURUSD
26/02/2025 03:00:00.000 | Trade | → Executing Market Order to Buy 1000 EURUSD SUCCEEDED, Position PID1
26/02/2025 03:00:00.000 | Trade | Modifying position PID1 (SL: 1.04849, TP: null)
26/02/2025 03:00:00.000 | Trade | → Modifying position PID1 (SL: 1.04849, TP: null) SUCCEEDED, Position PID1
26/02/2025 03:00:00.000 | Trade | Modifying position PID1 (SL: 1.04849, TP: 1.05532)
26/02/2025 03:00:00.000 | Trade | → Modifying position PID1 (SL: 1.04849, TP: 1.05532) SUCCEEDED, Position PID1
26/02/2025 12:47:00.000 | Info | === CLOSED Buy 1000u |PnL:-2.21|Pips:-24.4 ===
26/02/2025 12:47:00.000 | Info | Day PnL:-2.21 | Closed:1 / Exec:1
27/02/2025 00:00:00.000 | Info | === NEW DAY: 2025-02-27 ===
28/02/2025 00:00:00.000 | Info | === NEW DAY: 2025-02-28 ===
28/02/2025 08:00:00.000 | Info | 🚀 Order prep — Entry:1.03959, SL:1.04152, TP:1.03572, Vol:1000
28/02/2025 08:00:00.000 | Trade | Executing Market Order to Sell 1000 EURUSD
28/02/2025 08:00:00.000 | Trade | → Executing Market Order to Sell 1000 EURUSD SUCCEEDED, Position PID2
28/02/2025 08:00:00.000 | Trade | Modifying position PID2 (SL: 1.04152, TP: null)
28/02/2025 08:00:00.000 | Trade | → Modifying position PID2 (SL: 1.04152, TP: null) SUCCEEDED, Position PID2
28/02/2025 08:00:00.000 | Trade | Modifying position PID2 (SL: 1.04152, TP: 1.03572)
28/02/2025 08:00:00.000 | Trade | → Modifying position PID2 (SL: 1.04152, TP: 1.03572) SUCCEEDED, Position PID2
28/02/2025 13:13:00.000 | Info | === CLOSED Sell 1000u |PnL:-1.82|Pips:-20.0 ===
28/02/2025 13:13:00.000 | Info | Day PnL:-1.82 | Closed:1 / Exec:1
28/02/2025 13:14:00.000 | Info | 🚀 Order prep — Entry:1.04115, SL:1.04329, TP:1.03688, Vol:1000
28/02/2025 13:14:00.000 | Trade | Executing Market Order to Sell 1000 EURUSD
28/02/2025 13:14:00.000 | Trade | → Executing Market Order to Sell 1000 EURUSD SUCCEEDED, Position PID3
28/02/2025 13:14:00.000 | Trade | Modifying position PID3 (SL: 1.04329, TP: null)
28/02/2025 13:14:00.000 | Trade | → Modifying position PID3 (SL: 1.04329, TP: null) SUCCEEDED, Position PID3
28/02/2025 13:14:00.000 | Trade | Modifying position PID3 (SL: 1.04329, TP: 1.03688)
28/02/2025 13:14:00.000 | Trade | → Modifying position PID3 (SL: 1.04329, TP: 1.03688) SUCCEEDED, Position PID3
28/02/2025 14:00:00.000 | Info | Closing pos ID:3 — Session end
28/02/2025 14:00:00.000 | Trade | Closing position PID3 (Volume: 1000)
28/02/2025 14:00:00.000 | Trade | → Closing position PID3 (Volume: 1000) SUCCEEDED
28/02/2025 14:00:00.000 | Info | === CLOSED Sell 1000u |PnL:0.23|Pips:3.3 ===
28/02/2025 14:00:00.000 | Info | Day PnL:-1.59 | Closed:2 / Exec:2
02/03/2025 22:01:00.000 | Info | === NEW DAY: 2025-03-02 ===
03/03/2025 00:00:00.000 | Info | === NEW DAY: 2025-03-03 ===
04/03/2025 00:00:00.000 | Info | === NEW DAY: 2025-03-04 ===
04/03/2025 07:00:00.000 | Info | 🚀 Order prep — Entry:1.04878, SL:1.04615, TP:1.05404, Vol:1000
04/03/2025 07:00:00.000 | Trade | Executing Market Order to Buy 1000 EURUSD
04/03/2025 07:00:00.000 | Trade | → Executing Market Order to Buy 1000 EURUSD SUCCEEDED, Position PID4
04/03/2025 07:00:00.000 | Trade | Modifying position PID4 (SL: 1.04615, TP: null)
04/03/2025 07:00:00.000 | Trade | → Modifying position PID4 (SL: 1.04615, TP: null) SUCCEEDED, Position PID4
04/03/2025 07:00:00.000 | Trade | Modifying position PID4 (SL: 1.04615, TP: 1.05404)
04/03/2025 07:00:00.000 | Trade | → Modifying position PID4 (SL: 1.04615, TP: 1.05404) SUCCEEDED, Position PID4
04/03/2025 08:25:00.000 | Info | Closing pos ID:4 — RSI exit
04/03/2025 08:25:00.000 | Trade | Closing position PID4 (Volume: 1000)
04/03/2025 08:25:00.000 | Trade | → Closing position PID4 (Volume: 1000) SUCCEEDED
04/03/2025 08:25:00.000 | Info | === CLOSED Buy 1000u |PnL:1.71|Pips:20.1 ===
04/03/2025 08:25:00.000 | Info | Day PnL:1.71 | Closed:1 / Exec:1
04/03/2025 09:20:00.000 | Info | 🚀 Order prep — Entry:1.05129, SL:1.04831, TP:1.05724, Vol:1000
04/03/2025 09:20:00.000 | Trade | Executing Market Order to Buy 1000 EURUSD
04/03/2025 09:20:00.000 | Trade | → Executing Market Order to Buy 1000 EURUSD SUCCEEDED, Position PID5
04/03/2025 09:20:00.000 | Trade | Modifying position PID5 (SL: 1.04831, TP: null)
04/03/2025 09:20:00.000 | Trade | → Modifying position PID5 (SL: 1.04831, TP: null) SUCCEEDED, Position PID5
04/03/2025 09:20:00.000 | Trade | Modifying position PID5 (SL: 1.04831, TP: 1.05724)
04/03/2025 09:20:00.000 | Trade | → Modifying position PID5 (SL: 1.04831, TP: 1.05724) SUCCEEDED, Position PID5
04/03/2025 09:29:00.000 | Info | Closing pos ID:5 — RSI exit
04/03/2025 09:29:00.000 | Trade | Closing position PID5 (Volume: 1000)
04/03/2025 09:29:00.000 | Trade | → Closing position PID5 (Volume: 1000) SUCCEEDED
04/03/2025 09:29:00.000 | Info | === CLOSED Buy 1000u |PnL:0.23|Pips:3.3 ===
04/03/2025 09:29:00.000 | Info | Day PnL:1.94 | Closed:2 / Exec:2
04/03/2025 10:26:00.000 | Info | 🚀 Order prep — Entry:1.05037, SL:1.04741, TP:1.05630, Vol:1000
04/03/2025 10:26:00.000 | Trade | Executing Market Order to Buy 1000 EURUSD
04/03/2025 10:26:00.000 | Trade | → Executing Market Order to Buy 1000 EURUSD SUCCEEDED, Position PID6
04/03/2025 10:26:00.000 | Trade | Modifying position PID6 (SL: 1.04741, TP: null)
04/03/2025 10:26:00.000 | Trade | → Modifying position PID6 (SL: 1.04741, TP: null) SUCCEEDED, Position PID6
04/03/2025 10:26:00.000 | Trade | Modifying position PID6 (SL: 1.04741, TP: 1.0563)
04/03/2025 10:26:00.000 | Trade | → Modifying position PID6 (SL: 1.04741, TP: 1.0563) SUCCEEDED, Position PID6
04/03/2025 10:40:00.000 | Info | Closing pos ID:6 — RSI exit
04/03/2025 10:40:00.000 | Trade | Closing position PID6 (Volume: 1000)
04/03/2025 10:40:00.000 | Trade | → Closing position PID6 (Volume: 1000) SUCCEEDED
04/03/2025 10:40:00.000 | Info | === CLOSED Buy 1000u |PnL:0.77|Pips:9.4 ===
04/03/2025 10:40:00.000 | Info | Day PnL:2.71 | Closed:3 / Exec:3
05/03/2025 00:00:00.000 | Info | === NEW DAY: 2025-03-05 ===
06/03/2025 00:00:00.000 | Info | === NEW DAY: 2025-03-06 ===
06/03/2025 03:50:00.000 | Info | 🚀 Order prep — Entry:1.07911, SL:1.07472, TP:1.08788, Vol:1000
06/03/2025 03:50:00.000 | Trade | Executing Market Order to Buy 1000 EURUSD
06/03/2025 03:50:00.000 | Trade | → Executing Market Order to Buy 1000 EURUSD SUCCEEDED, Position PID7
06/03/2025 03:50:00.000 | Trade | Modifying position PID7 (SL: 1.07472, TP: null)
06/03/2025 03:50:00.000 | Trade | → Modifying position PID7 (SL: 1.07472, TP: null) SUCCEEDED, Position PID7
06/03/2025 03:50:00.000 | Trade | Modifying position PID7 (SL: 1.07472, TP: 1.08788)
06/03/2025 03:50:00.000 | Trade | → Modifying position PID7 (SL: 1.07472, TP: 1.08788) SUCCEEDED, Position PID7
06/03/2025 04:37:00.000 | Info | Closing pos ID:7 — RSI exit
06/03/2025 04:37:00.000 | Trade | Closing position PID7 (Volume: 1000)
06/03/2025 04:37:00.000 | Trade | → Closing position PID7 (Volume: 1000) SUCCEEDED
06/03/2025 04:37:00.000 | Info | === CLOSED Buy 1000u |PnL:0.23|Pips:3.3 ===
06/03/2025 04:37:00.000 | Info | Day PnL:0.23 | Closed:1 / Exec:1
06/03/2025 06:40:00.000 | Info | 🚀 Order prep — Entry:1.08045, SL:1.07703, TP:1.08729, Vol:1000
06/03/2025 06:40:00.000 | Trade | Executing Market Order to Buy 1000 EURUSD
06/03/2025 06:40:00.000 | Trade | → Executing Market Order to Buy 1000 EURUSD SUCCEEDED, Position PID8
06/03/2025 06:40:00.000 | Trade | Modifying position PID8 (SL: 1.07703, TP: null)
06/03/2025 06:40:00.000 | Trade | → Modifying position PID8 (SL: 1.07703, TP: null) SUCCEEDED, Position PID8
06/03/2025 06:40:00.000 | Trade | Modifying position PID8 (SL: 1.07703, TP: 1.08729)
06/03/2025 06:40:00.000 | Trade | → Modifying position PID8 (SL: 1.07703, TP: 1.08729) SUCCEEDED, Position PID8
06/03/2025 06:43:00.000 | Info | Closing pos ID:8 — RSI exit
06/03/2025 06:43:00.000 | Trade | Closing position PID8 (Volume: 1000)
06/03/2025 06:43:00.000 | Trade | → Closing position PID8 (Volume: 1000) SUCCEEDED
06/03/2025 06:43:00.000 | Info | === CLOSED Buy 1000u |PnL:-0.10|Pips:-0.4 ===
06/03/2025 06:43:00.000 | Info | Day PnL:0.13 | Closed:2 / Exec:2
06/03/2025 06:47:00.000 | Info | 🚀 Order prep — Entry:1.08041, SL:1.07697, TP:1.08729, Vol:1000
06/03/2025 06:47:00.000 | Trade | Executing Market Order to Buy 1000 EURUSD
06/03/2025 06:47:00.000 | Trade | → Executing Market Order to Buy 1000 EURUSD SUCCEEDED, Position PID9
06/03/2025 06:47:00.000 | Trade | Modifying position PID9 (SL: 1.07697, TP: null)
06/03/2025 06:47:00.000 | Trade | → Modifying position PID9 (SL: 1.07697, TP: null) SUCCEEDED, Position PID9
06/03/2025 06:47:00.000 | Trade | Modifying position PID9 (SL: 1.07697, TP: 1.08729)
06/03/2025 06:47:00.000 | Trade | → Modifying position PID9 (SL: 1.07697, TP: 1.08729) SUCCEEDED, Position PID9
06/03/2025 06:50:00.000 | Info | Closing pos ID:9 — RSI exit
06/03/2025 06:50:00.000 | Trade | Closing position PID9 (Volume: 1000)
06/03/2025 06:50:00.000 | Trade | → Closing position PID9 (Volume: 1000) SUCCEEDED
06/03/2025 06:50:00.000 | Info | === CLOSED Buy 1000u |PnL:-0.05|Pips:0.1 ===
06/03/2025 06:50:00.000 | Info | Day PnL:0.08 | Closed:3 / Exec:3
06/03/2025 06:51:00.000 | Info | 🚀 Order prep — Entry:1.08049, SL:1.07705, TP:1.08737, Vol:1000
06/03/2025 06:51:00.000 | Trade | Executing Market Order to Buy 1000 EURUSD
06/03/2025 06:51:00.000 | Trade | → Executing Market Order to Buy 1000 EURUSD SUCCEEDED, Position PID10
06/03/2025 06:51:00.000 | Trade | Modifying position PID10 (SL: 1.07705, TP: null)
06/03/2025 06:51:00.000 | Trade | → Modifying position PID10 (SL: 1.07705, TP: null) SUCCEEDED, Position PID10
06/03/2025 06:51:00.000 | Trade | Modifying position PID10 (SL: 1.07705, TP: 1.08737)
06/03/2025 06:51:00.000 | Trade | → Modifying position PID10 (SL: 1.07705, TP: 1.08737) SUCCEEDED, Position PID10
06/03/2025 18:44:00.000 | Info | === CLOSED Buy 1000u |PnL:-3.15|Pips:-35.1 ===
06/03/2025 18:44:00.000 | Info | Day PnL:-3.07 | Closed:4 / Exec:4
07/03/2025 00:00:00.000 | Info | === NEW DAY: 2025-03-07 ===
07/03/2025 03:00:00.000 | Info | 🚀 Order prep — Entry:1.08002, SL:1.07589, TP:1.08827, Vol:1000
07/03/2025 03:00:00.000 | Trade | Executing Market Order to Buy 1000 EURUSD
07/03/2025 03:00:00.000 | Trade | → Executing Market Order to Buy 1000 EURUSD SUCCEEDED, Position PID11
07/03/2025 03:00:00.000 | Trade | Modifying position PID11 (SL: 1.07589, TP: null)
07/03/2025 03:00:00.000 | Trade | → Modifying position PID11 (SL: 1.07589, TP: null) SUCCEEDED, Position PID11
07/03/2025 03:00:00.000 | Trade | Modifying position PID11 (SL: 1.07589, TP: 1.08827)
07/03/2025 03:00:00.000 | Trade | → Modifying position PID11 (SL: 1.07589, TP: 1.08827) SUCCEEDED, Position PID11
07/03/2025 07:21:00.000 | Trade | Modifying position PID11 (SL: 1.08012, TP: 1.08827)
07/03/2025 07:21:00.000 | Trade | → Modifying position PID11 (SL: 1.08012, TP: 1.08827) SUCCEEDED, Position PID11
07/03/2025 07:21:00.000 | Trade | Modifying position PID11 (SL: 1.08012, TP: 1.08827)
07/03/2025 07:21:00.000 | Trade | → Modifying position PID11 (SL: 1.08012, TP: 1.08827) SUCCEEDED, Position PID11
07/03/2025 07:21:00.000 | Info | ✅ Breakeven moved to 1.08012
07/03/2025 08:24:00.000 | Info | Closing pos ID:11 — RSI exit
07/03/2025 08:24:00.000 | Trade | Closing position PID11 (Volume: 1000)
07/03/2025 08:24:00.000 | Trade | → Closing position PID11 (Volume: 1000) SUCCEEDED
07/03/2025 08:24:00.000 | Info | === CLOSED Buy 1000u |PnL:3.81|Pips:44.0 ===
07/03/2025 08:24:00.000 | Info | Day PnL:3.81 | Closed:1 / Exec:1
09/03/2025 21:02:00.000 | Info | === NEW DAY: 2025-03-09 ===
10/03/2025 00:00:00.000 | Info | === NEW DAY: 2025-03-10 ===
10/03/2025 03:00:00.000 | Info | 🚀 Order prep — Entry:1.08375, SL:1.07975, TP:1.09174, Vol:1000
10/03/2025 03:00:00.000 | Trade | Executing Market Order to Buy 1000 EURUSD
10/03/2025 03:00:00.000 | Trade | → Executing Market Order to Buy 1000 EURUSD SUCCEEDED, Position PID12
10/03/2025 03:00:00.000 | Trade | Modifying position PID12 (SL: 1.07975, TP: null)
10/03/2025 03:00:00.000 | Trade | → Modifying position PID12 (SL: 1.07975, TP: null) SUCCEEDED, Position PID12
10/03/2025 03:00:00.000 | Trade | Modifying position PID12 (SL: 1.07975, TP: 1.09174)
10/03/2025 03:00:00.000 | Trade | → Modifying position PID12 (SL: 1.07975, TP: 1.09174) SUCCEEDED, Position PID12
10/03/2025 10:27:00.000 | Trade | Modifying position PID12 (SL: 1.08385, TP: 1.09174)
10/03/2025 10:27:00.000 | Trade | → Modifying position PID12 (SL: 1.08385, TP: 1.09174) SUCCEEDED, Position PID12
10/03/2025 10:27:00.000 | Trade | Modifying position PID12 (SL: 1.08385, TP: 1.09174)
10/03/2025 10:27:00.000 | Trade | → Modifying position PID12 (SL: 1.08385, TP: 1.09174) SUCCEEDED, Position PID12
10/03/2025 10:27:00.000 | Info | ✅ Breakeven moved to 1.08385
10/03/2025 11:05:00.000 | Info | === CLOSED Buy 1000u |PnL:-0.89|Pips:-9.4 ===
10/03/2025 11:05:00.000 | Info | Day PnL:-0.89 | Closed:1 / Exec:1
10/03/2025 11:05:00.000 | Info | 🚀 Order prep — Entry:1.08314, SL:1.07895, TP:1.09151, Vol:1000
10/03/2025 11:05:00.000 | Trade | Executing Market Order to Buy 1000 EURUSD
10/03/2025 11:05:00.000 | Trade | → Executing Market Order to Buy 1000 EURUSD SUCCEEDED, Position PID13
10/03/2025 11:05:00.000 | Trade | Modifying position PID13 (SL: 1.07895, TP: null)
10/03/2025 11:05:00.000 | Trade | → Modifying position PID13 (SL: 1.07895, TP: null) SUCCEEDED, Position PID13
10/03/2025 11:05:00.000 | Trade | Modifying position PID13 (SL: 1.07895, TP: 1.09151)
10/03/2025 11:05:00.000 | Trade | → Modifying position PID13 (SL: 1.07895, TP: 1.09151) SUCCEEDED, Position PID13
10/03/2025 14:00:00.000 | Info | Closing pos ID:13 — Session end
10/03/2025 14:00:00.000 | Trade | Closing position PID13 (Volume: 1000)
10/03/2025 14:00:00.000 | Trade | → Closing position PID13 (Volume: 1000) SUCCEEDED
10/03/2025 14:00:00.000 | Info | === CLOSED Buy 1000u |PnL:0.27|Pips:3.7 ===
10/03/2025 14:00:00.000 | Info | Day PnL:-0.62 | Closed:2 / Exec:2
11/03/2025 00:00:00.000 | Info | === NEW DAY: 2025-03-11 ===
12/03/2025 00:00:00.000 | Info | === NEW DAY: 2025-03-12 ===
13/03/2025 00:00:00.000 | Info | === NEW DAY: 2025-03-13 ===
14/03/2025 00:00:00.000 | Info | === NEW DAY: 2025-03-14 ===
14/03/2025 10:08:00.000 | Info | 🚀 Order prep — Entry:1.08678, SL:1.08446, TP:1.09141, Vol:1000
14/03/2025 10:08:00.000 | Trade | Executing Market Order to Buy 1000 EURUSD
14/03/2025 10:08:00.000 | Trade | → Executing Market Order to Buy 1000 EURUSD SUCCEEDED, Position PID14
14/03/2025 10:08:00.000 | Trade | Modifying position PID14 (SL: 1.08446, TP: null)
14/03/2025 10:08:00.000 | Trade | → Modifying position PID14 (SL: 1.08446, TP: null) SUCCEEDED, Position PID14
14/03/2025 10:08:00.000 | Trade | Modifying position PID14 (SL: 1.08446, TP: 1.09141)
14/03/2025 10:08:00.000 | Trade | → Modifying position PID14 (SL: 1.08446, TP: 1.09141) SUCCEEDED, Position PID14
14/03/2025 10:43:00.000 | Trade | Modifying position PID14 (SL: 1.08688, TP: 1.09141)
14/03/2025 10:43:00.000 | Trade | → Modifying position PID14 (SL: 1.08688, TP: 1.09141) SUCCEEDED, Position PID14
14/03/2025 10:43:00.000 | Trade | Modifying position PID14 (SL: 1.08688, TP: 1.09141)
14/03/2025 10:43:00.000 | Trade | → Modifying position PID14 (SL: 1.08688, TP: 1.09141) SUCCEEDED, Position PID14
14/03/2025 10:43:00.000 | Info | ✅ Breakeven moved to 1.08688
14/03/2025 10:47:00.000 | Trade | Executing Market Order to Sell 700 EURUSD
14/03/2025 10:47:00.000 | Trade | → Executing Market Order to Sell 700 EURUSD FAILED with error "BadVolume"
14/03/2025 10:47:00.000 | Info | ❌ Partial close error:BadVolume
14/03/2025 10:53:00.000 | Trade | Executing Market Order to Sell 700 EURUSD
14/03/2025 10:53:00.000 | Trade | → Executing Market Order to Sell 700 EURUSD FAILED with error "BadVolume"
14/03/2025 10:53:00.000 | Info | ❌ Partial close error:BadVolume
14/03/2025 10:54:00.000 | Trade | Executing Market Order to Sell 700 EURUSD
14/03/2025 10:54:00.000 | Trade | → Executing Market Order to Sell 700 EURUSD FAILED with error "BadVolume"
14/03/2025 10:54:00.000 | Info | ❌ Partial close error:BadVolume
14/03/2025 10:55:00.000 | Trade | Executing Market Order to Sell 700 EURUSD
14/03/2025 10:55:00.000 | Trade | → Executing Market Order to Sell 700 EURUSD FAILED with error "BadVolume"
14/03/2025 10:55:00.000 | Info | ❌ Partial close error:BadVolume
14/03/2025 10:56:00.000 | Trade | Executing Market Order to Sell 700 EURUSD
14/03/2025 10:56:00.000 | Trade | → Executing Market Order to Sell 700 EURUSD FAILED with error "BadVolume"
14/03/2025 10:56:00.000 | Info | ❌ Partial close error:BadVolume
14/03/2025 11:31:00.000 | Trade | Executing Market Order to Sell 700 EURUSD
14/03/2025 11:31:00.000 | Trade | → Executing Market Order to Sell 700 EURUSD FAILED with error "BadVolume"
14/03/2025 11:31:00.000 | Info | ❌ Partial close error:BadVolume
14/03/2025 11:32:00.000 | Trade | Executing Market Order to Sell 700 EURUSD
14/03/2025 11:32:00.000 | Trade | → Executing Market Order to Sell 700 EURUSD FAILED with error "BadVolume"
14/03/2025 11:32:00.000 | Info | ❌ Partial close error:BadVolume
14/03/2025 11:33:00.000 | Trade | Executing Market Order to Sell 700 EURUSD
14/03/2025 11:33:00.000 | Trade | → Executing Market Order to Sell 700 EURUSD FAILED with error "BadVolume"
14/03/2025 11:33:00.000 | Info | ❌ Partial close error:BadVolume
14/03/2025 11:34:00.000 | Trade | Executing Market Order to Sell 700 EURUSD
14/03/2025 11:34:00.000 | Trade | → Executing Market Order to Sell 700 EURUSD FAILED with error "BadVolume"
14/03/2025 11:34:00.000 | Info | ❌ Partial close error:BadVolume
14/03/2025 11:35:00.000 | Trade | Executing Market Order to Sell 700 EURUSD
14/03/2025 11:35:00.000 | Trade | → Executing Market Order to Sell 700 EURUSD FAILED with error "BadVolume"
14/03/2025 11:35:00.000 | Info | ❌ Partial close error:BadVolume
14/03/2025 11:36:00.000 | Trade | Executing Market Order to Sell 700 EURUSD
14/03/2025 11:36:00.000 | Trade | → Executing Market Order to Sell 700 EURUSD FAILED with error "BadVolume"
14/03/2025 11:36:00.000 | Info | ❌ Partial close error:BadVolume
14/03/2025 11:40:00.000 | Trade | Executing Market Order to Sell 700 EURUSD
14/03/2025 11:40:00.000 | Trade | → Executing Market Order to Sell 700 EURUSD FAILED with error "BadVolume"
14/03/2025 11:40:00.000 | Info | ❌ Partial close error:BadVolume
14/03/2025 11:41:00.000 | Trade | Executing Market Order to Sell 700 EURUSD
14/03/2025 11:41:00.000 | Trade | → Executing Market Order to Sell 700 EURUSD FAILED with error "BadVolume"
14/03/2025 11:41:00.000 | Info | ❌ Partial close error:BadVolume
14/03/2025 11:50:00.000 | Trade | Executing Market Order to Sell 700 EURUSD
14/03/2025 11:50:00.000 | Trade | → Executing Market Order to Sell 700 EURUSD FAILED with error "BadVolume"
14/03/2025 11:50:00.000 | Info | ❌ Partial close error:BadVolume
14/03/2025 12:02:00.000 | Trade | Executing Market Order to Sell 700 EURUSD
14/03/2025 12:02:00.000 | Trade | → Executing Market Order to Sell 700 EURUSD FAILED with error "BadVolume"
14/03/2025 12:02:00.000 | Info | ❌ Partial close error:BadVolume
14/03/2025 12:03:00.000 | Trade | Executing Market Order to Sell 700 EURUSD
14/03/2025 12:03:00.000 | Trade | → Executing Market Order to Sell 700 EURUSD FAILED with error "BadVolume"
14/03/2025 12:03:00.000 | Info | ❌ Partial close error:BadVolume
14/03/2025 12:04:00.000 | Trade | Executing Market Order to Sell 700 EURUSD
14/03/2025 12:04:00.000 | Trade | → Executing Market Order to Sell 700 EURUSD FAILED with error "BadVolume"
14/03/2025 12:04:00.000 | Info | ❌ Partial close error:BadVolume
14/03/2025 12:05:00.000 | Trade | Executing Market Order to Sell 700 EURUSD
14/03/2025 12:05:00.000 | Trade | → Executing Market Order to Sell 700 EURUSD FAILED with error "BadVolume"
14/03/2025 12:05:00.000 | Info | ❌ Partial close error:BadVolume
14/03/2025 12:06:00.000 | Trade | Executing Market Order to Sell 700 EURUSD
14/03/2025 12:06:00.000 | Trade | → Executing Market Order to Sell 700 EURUSD FAILED with error "BadVolume"
14/03/2025 12:06:00.000 | Info | ❌ Partial close error:BadVolume
14/03/2025 12:07:00.000 | Trade | Executing Market Order to Sell 700 EURUSD
14/03/2025 12:07:00.000 | Trade | → Executing Market Order to Sell 700 EURUSD FAILED with error "BadVolume"
14/03/2025 12:07:00.000 | Info | ❌ Partial close error:BadVolume
14/03/2025 12:08:00.000 | Trade | Executing Market Order to Sell 700 EURUSD
14/03/2025 12:08:00.000 | Trade | → Executing Market Order to Sell 700 EURUSD FAILED with error "BadVolume"
14/03/2025 12:08:00.000 | Info | ❌ Partial close error:BadVolume
14/03/2025 12:09:00.000 | Trade | Executing Market Order to Sell 700 EURUSD
14/03/2025 12:09:00.000 | Trade | → Executing Market Order to Sell 700 EURUSD FAILED with error "BadVolume"
14/03/2025 12:09:00.000 | Info | ❌ Partial close error:BadVolume
14/03/2025 12:10:00.000 | Trade | Executing Market Order to Sell 700 EURUSD
14/03/2025 12:10:00.000 | Trade | → Executing Market Order to Sell 700 EURUSD FAILED with error "BadVolume"
14/03/2025 12:10:00.000 | Info | ❌ Partial close error:BadVolume
14/03/2025 12:11:00.000 | Trade | Executing Market Order to Sell 700 EURUSD
14/03/2025 12:11:00.000 | Trade | → Executing Market Order to Sell 700 EURUSD FAILED with error "BadVolume"
14/03/2025 12:11:00.000 | Info | ❌ Partial close error:BadVolume
14/03/2025 12:12:00.000 | Trade | Executing Market Order to Sell 700 EURUSD
14/03/2025 12:12:00.000 | Trade | → Executing Market Order to Sell 700 EURUSD FAILED with error "BadVolume"
14/03/2025 12:12:00.000 | Info | ❌ Partial close error:BadVolume
14/03/2025 12:13:00.000 | Trade | Executing Market Order to Sell 700 EURUSD
14/03/2025 12:13:00.000 | Trade | → Executing Market Order to Sell 700 EURUSD FAILED with error "BadVolume"
14/03/2025 12:13:00.000 | Info | ❌ Partial close error:BadVolume
14/03/2025 12:14:00.000 | Trade | Executing Market Order to Sell 700 EURUSD
14/03/2025 12:14:00.000 | Trade | → Executing Market Order to Sell 700 EURUSD FAILED with error "BadVolume"
14/03/2025 12:14:00.000 | Info | ❌ Partial close error:BadVolume
14/03/2025 12:15:00.000 | Trade | Executing Market Order to Sell 700 EURUSD
14/03/2025 12:15:00.000 | Trade | → Executing Market Order to Sell 700 EURUSD FAILED with error "BadVolume"
14/03/2025 12:15:00.000 | Info | ❌ Partial close error:BadVolume
14/03/2025 12:16:00.000 | Trade | Executing Market Order to Sell 700 EURUSD
14/03/2025 12:16:00.000 | Trade | → Executing Market Order to Sell 700 EURUSD FAILED with error "BadVolume"
14/03/2025 12:16:00.000 | Info | ❌ Partial close error:BadVolume
14/03/2025 12:17:00.000 | Trade | Executing Market Order to Sell 700 EURUSD
14/03/2025 12:17:00.000 | Trade | → Executing Market Order to Sell 700 EURUSD FAILED with error "BadVolume"
14/03/2025 12:17:00.000 | Info | ❌ Partial close error:BadVolume
14/03/2025 12:18:00.000 | Trade | Executing Market Order to Sell 700 EURUSD
14/03/2025 12:18:00.000 | Trade | → Executing Market Order to Sell 700 EURUSD FAILED with error "BadVolume"
14/03/2025 12:18:00.000 | Info | ❌ Partial close error:BadVolume
14/03/2025 12:19:00.000 | Trade | Executing Market Order to Sell 700 EURUSD
14/03/2025 12:19:00.000 | Trade | → Executing Market Order to Sell 700 EURUSD FAILED with error "BadVolume"
14/03/2025 12:19:00.000 | Info | ❌ Partial close error:BadVolume
14/03/2025 12:20:00.000 | Trade | Executing Market Order to Sell 700 EURUSD
14/03/2025 12:20:00.000 | Trade | → Executing Market Order to Sell 700 EURUSD FAILED with error "BadVolume"
14/03/2025 12:20:00.000 | Info | ❌ Partial close error:BadVolume
14/03/2025 12:21:00.000 | Trade | Executing Market Order to Sell 700 EURUSD
14/03/2025 12:21:00.000 | Trade | → Executing Market Order to Sell 700 EURUSD FAILED with error "BadVolume"
14/03/2025 12:21:00.000 | Info | ❌ Partial close error:BadVolume
14/03/2025 12:22:00.000 | Trade | Executing Market Order to Sell 700 EURUSD
14/03/2025 12:22:00.000 | Trade | → Executing Market Order to Sell 700 EURUSD FAILED with error "BadVolume"
14/03/2025 12:22:00.000 | Info | ❌ Partial close error:BadVolume
14/03/2025 12:23:00.000 | Trade | Executing Market Order to Sell 700 EURUSD
14/03/2025 12:23:00.000 | Trade | → Executing Market Order to Sell 700 EURUSD FAILED with error "BadVolume"
14/03/2025 12:23:00.000 | Info | ❌ Partial close error:BadVolume
14/03/2025 12:24:00.000 | Trade | Executing Market Order to Sell 700 EURUSD
14/03/2025 12:24:00.000 | Trade | → Executing Market Order to Sell 700 EURUSD FAILED with error "BadVolume"
14/03/2025 12:24:00.000 | Info | ❌ Partial close error:BadVolume
14/03/2025 12:25:00.000 | Trade | Executing Market Order to Sell 700 EURUSD
14/03/2025 12:25:00.000 | Trade | → Executing Market Order to Sell 700 EURUSD FAILED with error "BadVolume"
14/03/2025 12:25:00.000 | Info | ❌ Partial close error:BadVolume
14/03/2025 12:26:00.000 | Trade | Executing Market Order to Sell 700 EURUSD
14/03/2025 12:26:00.000 | Trade | → Executing Market Order to Sell 700 EURUSD FAILED with error "BadVolume"
14/03/2025 12:26:00.000 | Info | ❌ Partial close error:BadVolume
14/03/2025 12:27:00.000 | Trade | Executing Market Order to Sell 700 EURUSD
14/03/2025 12:27:00.000 | Trade | → Executing Market Order to Sell 700 EURUSD FAILED with error "BadVolume"
14/03/2025 12:27:00.000 | Info | ❌ Partial close error:BadVolume
14/03/2025 12:28:00.000 | Trade | Executing Market Order to Sell 700 EURUSD
14/03/2025 12:28:00.000 | Trade | → Executing Market Order to Sell 700 EURUSD FAILED with error "BadVolume"
14/03/2025 12:28:00.000 | Info | ❌ Partial close error:BadVolume
14/03/2025 12:29:00.000 | Trade | Executing Market Order to Sell 700 EURUSD
14/03/2025 12:29:00.000 | Trade | → Executing Market Order to Sell 700 EURUSD FAILED with error "BadVolume"
14/03/2025 12:29:00.000 | Info | ❌ Partial close error:BadVolume
14/03/2025 12:30:00.000 | Trade | Executing Market Order to Sell 700 EURUSD
14/03/2025 12:30:00.000 | Trade | → Executing Market Order to Sell 700 EURUSD FAILED with error "BadVolume"
14/03/2025 12:30:00.000 | Info | ❌ Partial close error:BadVolume
14/03/2025 12:31:00.000 | Trade | Executing Market Order to Sell 700 EURUSD
14/03/2025 12:31:00.000 | Trade | → Executing Market Order to Sell 700 EURUSD FAILED with error "BadVolume"
14/03/2025 12:31:00.000 | Info | ❌ Partial close error:BadVolume
14/03/2025 12:32:00.000 | Trade | Executing Market Order to Sell 700 EURUSD
14/03/2025 12:32:00.000 | Trade | → Executing Market Order to Sell 700 EURUSD FAILED with error "BadVolume"
14/03/2025 12:32:00.000 | Info | ❌ Partial close error:BadVolume
14/03/2025 12:33:00.000 | Trade | Executing Market Order to Sell 700 EURUSD
14/03/2025 12:33:00.000 | Trade | → Executing Market Order to Sell 700 EURUSD FAILED with error "BadVolume"
14/03/2025 12:33:00.000 | Info | ❌ Partial close error:BadVolume
14/03/2025 12:34:00.000 | Trade | Executing Market Order to Sell 700 EURUSD
14/03/2025 12:34:00.000 | Trade | → Executing Market Order to Sell 700 EURUSD FAILED with error "BadVolume"
14/03/2025 12:34:00.000 | Info | ❌ Partial close error:BadVolume
14/03/2025 12:35:00.000 | Trade | Executing Market Order to Sell 700 EURUSD
14/03/2025 12:35:00.000 | Trade | → Executing Market Order to Sell 700 EURUSD FAILED with error "BadVolume"
14/03/2025 12:35:00.000 | Info | ❌ Partial close error:BadVolume
14/03/2025 12:36:00.000 | Trade | Executing Market Order to Sell 700 EURUSD
14/03/2025 12:36:00.000 | Trade | → Executing Market Order to Sell 700 EURUSD FAILED with error "BadVolume"
14/03/2025 12:36:00.000 | Info | ❌ Partial close error:BadVolume
14/03/2025 12:37:00.000 | Trade | Executing Market Order to Sell 700 EURUSD
14/03/2025 12:37:00.000 | Trade | → Executing Market Order to Sell 700 EURUSD FAILED with error "BadVolume"
14/03/2025 12:37:00.000 | Info | ❌ Partial close error:BadVolume
14/03/2025 12:38:00.000 | Trade | Executing Market Order to Sell 700 EURUSD
14/03/2025 12:38:00.000 | Trade | → Executing Market Order to Sell 700 EURUSD FAILED with error "BadVolume"
14/03/2025 12:38:00.000 | Info | ❌ Partial close error:BadVolume
14/03/2025 12:39:00.000 | Trade | Executing Market Order to Sell 700 EURUSD
14/03/2025 12:39:00.000 | Trade | → Executing Market Order to Sell 700 EURUSD FAILED with error "BadVolume"
14/03/2025 12:39:00.000 | Info | ❌ Partial close error:BadVolume
14/03/2025 12:42:00.000 | Trade | Executing Market Order to Sell 700 EURUSD
14/03/2025 12:42:00.000 | Trade | → Executing Market Order to Sell 700 EURUSD FAILED with error "BadVolume"
14/03/2025 12:42:00.000 | Info | ❌ Partial close error:BadVolume
14/03/2025 12:43:00.000 | Trade | Executing Market Order to Sell 700 EURUSD
14/03/2025 12:43:00.000 | Trade | → Executing Market Order to Sell 700 EURUSD FAILED with error "BadVolume"
14/03/2025 12:43:00.000 | Info | ❌ Partial close error:BadVolume
14/03/2025 12:44:00.000 | Trade | Executing Market Order to Sell 700 EURUSD
14/03/2025 12:44:00.000 | Trade | → Executing Market Order to Sell 700 EURUSD FAILED with error "BadVolume"
14/03/2025 12:44:00.000 | Info | ❌ Partial close error:BadVolume
14/03/2025 14:00:00.000 | Info | Closing pos ID:14 — Session end
14/03/2025 14:00:00.000 | Trade | Closing position PID14 (Volume: 1000)
14/03/2025 14:00:00.000 | Trade | → Closing position PID14 (Volume: 1000) SUCCEEDED
14/03/2025 14:00:00.000 | Info | === CLOSED Buy 1000u |PnL:0.49|Pips:6.3 ===
14/03/2025 14:00:00.000 | Info | Day PnL:0.49 | Closed:1 / Exec:1
16/03/2025 21:01:00.000 | Info | === NEW DAY: 2025-03-16 ===
17/03/2025 00:00:00.000 | Info | === NEW DAY: 2025-03-17 ===
18/03/2025 00:00:00.000 | Info | === NEW DAY: 2025-03-18 ===
18/03/2025 03:00:00.000 | Info | 🚀 Order prep — Entry:1.09097, SL:1.08926, TP:1.09439, Vol:1000
18/03/2025 03:00:00.000 | Trade | Executing Market Order to Buy 1000 EURUSD
18/03/2025 03:00:00.000 | Trade | → Executing Market Order to Buy 1000 EURUSD SUCCEEDED, Position PID15
18/03/2025 03:00:00.000 | Trade | Modifying position PID15 (SL: 1.08926, TP: null)
18/03/2025 03:00:00.000 | Trade | → Modifying position PID15 (SL: 1.08926, TP: null) SUCCEEDED, Position PID15
18/03/2025 03:00:00.000 | Trade | Modifying position PID15 (SL: 1.08926, TP: 1.09439)
18/03/2025 03:00:00.000 | Trade | → Modifying position PID15 (SL: 1.08926, TP: 1.09439) SUCCEEDED, Position PID15
18/03/2025 07:03:00.000 | Trade | Modifying position PID15 (SL: 1.09107, TP: 1.09439)
18/03/2025 07:03:00.000 | Trade | → Modifying position PID15 (SL: 1.09107, TP: 1.09439) SUCCEEDED, Position PID15
18/03/2025 07:03:00.000 | Trade | Modifying position PID15 (SL: 1.09107, TP: 1.09439)
18/03/2025 07:03:00.000 | Trade | → Modifying position PID15 (SL: 1.09107, TP: 1.09439) SUCCEEDED, Position PID15
18/03/2025 07:03:00.000 | Info | ✅ Breakeven moved to 1.09107
18/03/2025 08:01:00.000 | Info | Closing pos ID:15 — RSI exit
18/03/2025 08:01:00.000 | Trade | Closing position PID15 (Volume: 1000)
18/03/2025 08:01:00.000 | Trade | → Closing position PID15 (Volume: 1000) SUCCEEDED
18/03/2025 08:01:00.000 | Info | === CLOSED Buy 1000u |PnL:2.54|Pips:29.6 ===
18/03/2025 08:01:00.000 | Info | Day PnL:2.54 | Closed:1 / Exec:1
19/03/2025 00:00:00.000 | Info | === NEW DAY: 2025-03-19 ===
20/03/2025 00:00:00.000 | Info | === NEW DAY: 2025-03-20 ===
21/03/2025 00:00:00.000 | Info | === NEW DAY: 2025-03-21 ===
23/03/2025 21:01:00.000 | Info | === NEW DAY: 2025-03-23 ===
24/03/2025 00:00:00.000 | Info | === NEW DAY: 2025-03-24 ===
24/03/2025 03:47:00.000 | Info | 🚀 Order prep — Entry:1.08242, SL:1.08522, TP:1.07682, Vol:1000
24/03/2025 03:47:00.000 | Trade | Executing Market Order to Sell 1000 EURUSD
24/03/2025 03:47:00.000 | Trade | → Executing Market Order to Sell 1000 EURUSD SUCCEEDED, Position PID16
24/03/2025 03:47:00.000 | Trade | Modifying position PID16 (SL: 1.08522, TP: null)
24/03/2025 03:47:00.000 | Trade | → Modifying position PID16 (SL: 1.08522, TP: null) SUCCEEDED, Position PID16
24/03/2025 03:47:00.000 | Trade | Modifying position PID16 (SL: 1.08522, TP: 1.07682)
24/03/2025 03:47:00.000 | Trade | → Modifying position PID16 (SL: 1.08522, TP: 1.07682) SUCCEEDED, Position PID16
24/03/2025 08:23:00.000 | Info | === CLOSED Sell 1000u |PnL:-2.73|Pips:-30.3 ===
24/03/2025 08:23:00.000 | Info | Day PnL:-2.73 | Closed:1 / Exec:1
25/03/2025 00:00:00.000 | Info | === NEW DAY: 2025-03-25 ===
26/03/2025 00:00:00.000 | Info | === NEW DAY: 2025-03-26 ===
26/03/2025 06:00:00.000 | Info | 🚀 Order prep — Entry:1.07853, SL:1.08025, TP:1.07509, Vol:1000
26/03/2025 06:00:00.000 | Trade | Executing Market Order to Sell 1000 EURUSD
26/03/2025 06:00:00.000 | Trade | → Executing Market Order to Sell 1000 EURUSD SUCCEEDED, Position PID17
26/03/2025 06:00:00.000 | Trade | Modifying position PID17 (SL: 1.08025, TP: null)
26/03/2025 06:00:00.000 | Trade | → Modifying position PID17 (SL: 1.08025, TP: null) SUCCEEDED, Position PID17
26/03/2025 06:00:00.000 | Trade | Modifying position PID17 (SL: 1.08025, TP: 1.07509)
26/03/2025 06:00:00.000 | Trade | → Modifying position PID17 (SL: 1.08025, TP: 1.07509) SUCCEEDED, Position PID17
26/03/2025 09:35:00.000 | Info | === CLOSED Sell 1000u |PnL:-1.68|Pips:-18.4 ===
26/03/2025 09:35:00.000 | Info | Day PnL:-1.68 | Closed:1 / Exec:1
27/03/2025 00:00:00.000 | Info | === NEW DAY: 2025-03-27 ===
27/03/2025 13:12:00.000 | Info | 🚀 Order prep — Entry:1.07820, SL:1.08139, TP:1.07183, Vol:1000
27/03/2025 13:12:00.000 | Trade | Executing Market Order to Sell 1000 EURUSD
27/03/2025 13:12:00.000 | Trade | → Executing Market Order to Sell 1000 EURUSD SUCCEEDED, Position PID18
27/03/2025 13:12:00.000 | Trade | Modifying position PID18 (SL: 1.08139, TP: null)
27/03/2025 13:12:00.000 | Trade | → Modifying position PID18 (SL: 1.08139, TP: null) SUCCEEDED, Position PID18
27/03/2025 13:12:00.000 | Trade | Modifying position PID18 (SL: 1.08139, TP: 1.07183)
27/03/2025 13:12:00.000 | Trade | → Modifying position PID18 (SL: 1.08139, TP: 1.07183) SUCCEEDED, Position PID18
27/03/2025 14:00:00.000 | Info | Closing pos ID:18 — Session end
27/03/2025 14:00:00.000 | Trade | Closing position PID18 (Volume: 1000)
27/03/2025 14:00:00.000 | Trade | → Closing position PID18 (Volume: 1000) SUCCEEDED
27/03/2025 14:00:00.000 | Info | === CLOSED Sell 1000u |PnL:-0.01|Pips:0.6 ===
27/03/2025 14:00:00.000 | Info | Day PnL:-0.01 | Closed:1 / Exec:1
28/03/2025 00:00:00.000 | Info | === NEW DAY: 2025-03-28 ===
28/03/2025 04:21:00.000 | Info | 🚀 Order prep — Entry:1.07862, SL:1.08070, TP:1.07446, Vol:1000
28/03/2025 04:21:00.000 | Trade | Executing Market Order to Sell 1000 EURUSD
28/03/2025 04:21:00.000 | Trade | → Executing Market Order to Sell 1000 EURUSD SUCCEEDED, Position PID19
28/03/2025 04:21:00.000 | Trade | Modifying position PID19 (SL: 1.0807, TP: null)
28/03/2025 04:21:00.000 | Trade | → Modifying position PID19 (SL: 1.0807, TP: null) SUCCEEDED, Position PID19
28/03/2025 04:21:00.000 | Trade | Modifying position PID19 (SL: 1.0807, TP: 1.07446)
28/03/2025 04:21:00.000 | Trade | → Modifying position PID19 (SL: 1.0807, TP: 1.07446) SUCCEEDED, Position PID19
28/03/2025 09:22:00.000 | Trade | Modifying position PID19 (SL: 1.07852, TP: 1.07446)
28/03/2025 09:22:00.000 | Trade | → Modifying position PID19 (SL: 1.07852, TP: 1.07446) SUCCEEDED, Position PID19
28/03/2025 09:22:00.000 | Trade | Modifying position PID19 (SL: 1.07852, TP: 1.07446)
28/03/2025 09:22:00.000 | Trade | → Modifying position PID19 (SL: 1.07852, TP: 1.07446) SUCCEEDED, Position PID19
28/03/2025 09:22:00.000 | Info | ✅ Breakeven moved to 1.07852
28/03/2025 12:51:00.000 | Info | === CLOSED Sell 1000u |PnL:0.01|Pips:0.8 ===
28/03/2025 12:51:00.000 | Info | Day PnL:0.01 | Closed:1 / Exec:1
30/03/2025 21:01:00.000 | Info | === NEW DAY: 2025-03-30 ===
31/03/2025 00:00:00.000 | Info | === NEW DAY: 2025-03-31 ===
31/03/2025 10:12:00.000 | Info | 🚀 Order prep — Entry:1.08087, SL:1.08423, TP:1.07414, Vol:1000
31/03/2025 10:12:00.000 | Trade | Executing Market Order to Sell 1000 EURUSD
31/03/2025 10:12:00.000 | Trade | → Executing Market Order to Sell 1000 EURUSD SUCCEEDED, Position PID20
31/03/2025 10:12:00.000 | Trade | Modifying position PID20 (SL: 1.08423, TP: null)
31/03/2025 10:12:00.000 | Trade | → Modifying position PID20 (SL: 1.08423, TP: null) SUCCEEDED, Position PID20
31/03/2025 10:12:00.000 | Trade | Modifying position PID20 (SL: 1.08423, TP: 1.07414)
31/03/2025 10:12:00.000 | Trade | → Modifying position PID20 (SL: 1.08423, TP: 1.07414) SUCCEEDED, Position PID20
31/03/2025 14:00:00.000 | Info | Closing pos ID:20 — Session end
31/03/2025 14:00:00.000 | Trade | Closing position PID20 (Volume: 1000)
31/03/2025 14:00:00.000 | Trade | → Closing position PID20 (Volume: 1000) SUCCEEDED
31/03/2025 14:00:00.000 | Info | === CLOSED Sell 1000u |PnL:-0.07|Pips:-0.1 ===
31/03/2025 14:00:00.000 | Info | Day PnL:-0.07 | Closed:1 / Exec:1
01/04/2025 00:00:00.000 | Info | === NEW DAY: 2025-04-01 ===
02/04/2025 00:00:00.000 | Info | === NEW DAY: 2025-04-02 ===
03/04/2025 00:00:00.000 | Info | === NEW DAY: 2025-04-03 ===
04/04/2025 00:00:00.000 | Info | === NEW DAY: 2025-04-04 ===
04/04/2025 04:14:00.000 | Info | 🚀 Order prep — Entry:1.10897, SL:1.10384, TP:1.11922, Vol:1000
04/04/2025 04:14:00.000 | Trade | Executing Market Order to Buy 1000 EURUSD
04/04/2025 04:14:00.000 | Trade | → Executing Market Order to Buy 1000 EURUSD SUCCEEDED, Position PID21
04/04/2025 04:14:00.000 | Trade | Modifying position PID21 (SL: 1.10384, TP: null)
04/04/2025 04:14:00.000 | Trade | → Modifying position PID21 (SL: 1.10384, TP: null) SUCCEEDED, Position PID21
04/04/2025 04:14:00.000 | Trade | Modifying position PID21 (SL: 1.10384, TP: 1.11922)
04/04/2025 04:14:00.000 | Trade | → Modifying position PID21 (SL: 1.10384, TP: 1.11922) SUCCEEDED, Position PID21
04/04/2025 07:37:00.000 | Info | === CLOSED Buy 1000u |PnL:-4.62|Pips:-51.8 ===
04/04/2025 07:37:00.000 | Info | Day PnL:-4.62 | Closed:1 / Exec:1
04/04/2025 13:18:00.000 | Info | 🚀 Order prep — Entry:1.10401, SL:1.09589, TP:1.12025, Vol:1000
04/04/2025 13:18:00.000 | Trade | Executing Market Order to Buy 1000 EURUSD
04/04/2025 13:18:00.000 | Trade | → Executing Market Order to Buy 1000 EURUSD SUCCEEDED, Position PID22
04/04/2025 13:18:00.000 | Trade | Modifying position PID22 (SL: 1.09589, TP: null)
04/04/2025 13:18:00.000 | Trade | → Modifying position PID22 (SL: 1.09589, TP: null) SUCCEEDED, Position PID22
04/04/2025 13:18:00.000 | Trade | Modifying position PID22 (SL: 1.09589, TP: 1.12025)
04/04/2025 13:18:00.000 | Trade | → Modifying position PID22 (SL: 1.09589, TP: 1.12025) SUCCEEDED, Position PID22
04/04/2025 14:00:00.000 | Info | Closing pos ID:22 — Session end
04/04/2025 14:00:00.000 | Trade | Closing position PID22 (Volume: 1000)
04/04/2025 14:00:00.000 | Trade | → Closing position PID22 (Volume: 1000) SUCCEEDED
04/04/2025 14:00:00.000 | Info | === CLOSED Buy 1000u |PnL:-3.11|Pips:-34.7 ===
04/04/2025 14:00:00.000 | Info | Day PnL:-7.73 | Closed:2 / Exec:2
06/04/2025 21:01:00.000 | Info | === NEW DAY: 2025-04-06 ===
07/04/2025 00:00:00.000 | Info | === NEW DAY: 2025-04-07 ===
07/04/2025 04:27:00.000 | Info | 🚀 Order prep — Entry:1.09761, SL:1.08946, TP:1.11391, Vol:1000
07/04/2025 04:27:00.000 | Trade | Executing Market Order to Buy 1000 EURUSD
07/04/2025 04:27:00.000 | Trade | → Executing Market Order to Buy 1000 EURUSD SUCCEEDED, Position PID23
07/04/2025 04:27:00.000 | Trade | Modifying position PID23 (SL: 1.08946, TP: null)
07/04/2025 04:27:00.000 | Trade | → Modifying position PID23 (SL: 1.08946, TP: null) SUCCEEDED, Position PID23
07/04/2025 04:27:00.000 | Trade | Modifying position PID23 (SL: 1.08946, TP: 1.11391)
07/04/2025 04:27:00.000 | Trade | → Modifying position PID23 (SL: 1.08946, TP: 1.11391) SUCCEEDED, Position PID23
07/04/2025 07:12:00.000 | Trade | Modifying position PID23 (SL: 1.09771, TP: 1.11391)
07/04/2025 07:12:00.000 | Trade | → Modifying position PID23 (SL: 1.09771, TP: 1.11391) SUCCEEDED, Position PID23
07/04/2025 07:12:00.000 | Trade | Modifying position PID23 (SL: 1.09771, TP: 1.11391)
07/04/2025 07:12:00.000 | Trade | → Modifying position PID23 (SL: 1.09771, TP: 1.11391) SUCCEEDED, Position PID23
07/04/2025 07:12:00.000 | Info | ✅ Breakeven moved to 1.09771
07/04/2025 08:30:00.000 | Info | === CLOSED Buy 1000u |PnL:-0.55|Pips:-5.6 ===
07/04/2025 08:30:00.000 | Info | Day PnL:-0.55 | Closed:1 / Exec:1
08/04/2025 00:00:00.000 | Info | === NEW DAY: 2025-04-08 ===
09/04/2025 00:00:00.000 | Info | === NEW DAY: 2025-04-09 ===
09/04/2025 11:02:00.000 | Info | 🚀 Order prep — Entry:1.10256, SL:1.09542, TP:1.11683, Vol:1000
09/04/2025 11:02:00.000 | Trade | Executing Market Order to Buy 1000 EURUSD
09/04/2025 11:02:00.000 | Trade | → Executing Market Order to Buy 1000 EURUSD SUCCEEDED, Position PID24
09/04/2025 11:02:00.000 | Trade | Modifying position PID24 (SL: 1.09542, TP: null)
09/04/2025 11:02:00.000 | Trade | → Modifying position PID24 (SL: 1.09542, TP: null) SUCCEEDED, Position PID24
09/04/2025 11:02:00.000 | Trade | Modifying position PID24 (SL: 1.09542, TP: 1.11683)
09/04/2025 11:02:00.000 | Trade | → Modifying position PID24 (SL: 1.09542, TP: 1.11683) SUCCEEDED, Position PID24
09/04/2025 12:30:00.000 | Trade | Modifying position PID24 (SL: 1.10266, TP: 1.11683)
09/04/2025 12:30:00.000 | Trade | → Modifying position PID24 (SL: 1.10266, TP: 1.11683) SUCCEEDED, Position PID24
09/04/2025 12:30:00.000 | Trade | Modifying position PID24 (SL: 1.10266, TP: 1.11683)
09/04/2025 12:30:00.000 | Trade | → Modifying position PID24 (SL: 1.10266, TP: 1.11683) SUCCEEDED, Position PID24
09/04/2025 12:30:00.000 | Info | ✅ Breakeven moved to 1.10266
09/04/2025 14:00:00.000 | Info | Closing pos ID:24 — Session end
09/04/2025 14:00:00.000 | Trade | Closing position PID24 (Volume: 1000)
09/04/2025 14:00:00.000 | Trade | → Closing position PID24 (Volume: 1000) SUCCEEDED
09/04/2025 14:00:00.000 | Info | === CLOSED Buy 1000u |PnL:1.64|Pips:19.3 ===
09/04/2025 14:00:00.000 | Info | Day PnL:1.64 | Closed:1 / Exec:1
10/04/2025 00:00:00.000 | Info | === NEW DAY: 2025-04-10 ===
11/04/2025 00:00:00.000 | Info | === NEW DAY: 2025-04-11 ===
11/04/2025 11:14:00.000 | Info | 🚀 Order prep — Entry:1.13455, SL:1.12271, TP:1.15823, Vol:1000
11/04/2025 11:14:00.000 | Trade | Executing Market Order to Buy 1000 EURUSD
11/04/2025 11:14:00.000 | Trade | → Executing Market Order to Buy 1000 EURUSD SUCCEEDED, Position PID25
11/04/2025 11:14:00.000 | Trade | Modifying position PID25 (SL: 1.12271, TP: null)
11/04/2025 11:14:00.000 | Trade | → Modifying position PID25 (SL: 1.12271, TP: null) SUCCEEDED, Position PID25
11/04/2025 11:14:00.000 | Trade | Modifying position PID25 (SL: 1.12271, TP: 1.15823)
11/04/2025 11:14:00.000 | Trade | → Modifying position PID25 (SL: 1.12271, TP: 1.15823) SUCCEEDED, Position PID25
11/04/2025 14:00:00.000 | Info | Closing pos ID:25 — Session end
11/04/2025 14:00:00.000 | Trade | Closing position PID25 (Volume: 1000)
11/04/2025 14:00:00.000 | Trade | → Closing position PID25 (Volume: 1000) SUCCEEDED
11/04/2025 14:00:00.000 | Info | === CLOSED Buy 1000u |PnL:1.34|Pips:15.9 ===
11/04/2025 14:00:00.000 | Info | Day PnL:1.34 | Closed:1 / Exec:1
13/04/2025 21:14:00.000 | Info | === NEW DAY: 2025-04-13 ===
14/04/2025 00:00:00.000 | Info | === NEW DAY: 2025-04-14 ===
14/04/2025 03:00:00.000 | Info | 🚀 Order prep — Entry:1.13727, SL:1.13042, TP:1.15097, Vol:1000
14/04/2025 03:00:00.000 | Trade | Executing Market Order to Buy 1000 EURUSD
14/04/2025 03:00:00.000 | Trade | → Executing Market Order to Buy 1000 EURUSD SUCCEEDED, Position PID26
14/04/2025 03:00:00.000 | Trade | Modifying position PID26 (SL: 1.13042, TP: null)
14/04/2025 03:00:00.000 | Trade | → Modifying position PID26 (SL: 1.13042, TP: null) SUCCEEDED, Position PID26
14/04/2025 03:00:00.000 | Trade | Modifying position PID26 (SL: 1.13042, TP: 1.15097)
14/04/2025 03:00:00.000 | Trade | → Modifying position PID26 (SL: 1.13042, TP: 1.15097) SUCCEEDED, Position PID26
14/04/2025 06:54:00.000 | Trade | Modifying position PID26 (SL: 1.13737, TP: 1.15097)
14/04/2025 06:54:00.000 | Trade | → Modifying position PID26 (SL: 1.13737, TP: 1.15097) SUCCEEDED, Position PID26
14/04/2025 06:54:00.000 | Trade | Modifying position PID26 (SL: 1.13737, TP: 1.15097)
14/04/2025 06:54:00.000 | Trade | → Modifying position PID26 (SL: 1.13737, TP: 1.15097) SUCCEEDED, Position PID26
14/04/2025 06:54:00.000 | Info | ✅ Breakeven moved to 1.13737
14/04/2025 10:16:00.000 | Info | === CLOSED Buy 1000u |PnL:-0.02|Pips:0.5 ===
14/04/2025 10:16:00.000 | Info | Day PnL:-0.02 | Closed:1 / Exec:1
14/04/2025 10:16:00.000 | Info | 🚀 Order prep — Entry:1.13758, SL:1.13125, TP:1.15025, Vol:1000
14/04/2025 10:16:00.000 | Trade | Executing Market Order to Buy 1000 EURUSD
14/04/2025 10:16:00.000 | Trade | → Executing Market Order to Buy 1000 EURUSD SUCCEEDED, Position PID27
14/04/2025 10:16:00.000 | Trade | Modifying position PID27 (SL: 1.13125, TP: null)
14/04/2025 10:16:00.000 | Trade | → Modifying position PID27 (SL: 1.13125, TP: null) SUCCEEDED, Position PID27
14/04/2025 10:16:00.000 | Trade | Modifying position PID27 (SL: 1.13125, TP: 1.15025)
14/04/2025 10:16:00.000 | Trade | → Modifying position PID27 (SL: 1.13125, TP: 1.15025) SUCCEEDED, Position PID27
14/04/2025 13:09:00.000 | Info | === CLOSED Buy 1000u |PnL:-5.76|Pips:-64.8 ===
14/04/2025 13:09:00.000 | Info | Day PnL:-5.78 | Closed:2 / Exec:2
14/04/2025 13:09:00.000 | Info | 🚀 Order prep — Entry:1.13136, SL:1.12462, TP:1.14484, Vol:1000
14/04/2025 13:09:00.000 | Trade | Executing Market Order to Buy 1000 EURUSD
14/04/2025 13:09:00.000 | Trade | → Executing Market Order to Buy 1000 EURUSD SUCCEEDED, Position PID28
14/04/2025 13:09:00.000 | Trade | Modifying position PID28 (SL: 1.12462, TP: null)
14/04/2025 13:09:00.000 | Trade | → Modifying position PID28 (SL: 1.12462, TP: null) SUCCEEDED, Position PID28
14/04/2025 13:09:00.000 | Trade | Modifying position PID28 (SL: 1.12462, TP: 1.14484)
14/04/2025 13:09:00.000 | Trade | → Modifying position PID28 (SL: 1.12462, TP: 1.14484) SUCCEEDED, Position PID28
14/04/2025 14:00:00.000 | Info | Closing pos ID:28 — Session end
14/04/2025 14:00:00.000 | Trade | Closing position PID28 (Volume: 1000)
14/04/2025 14:00:00.000 | Trade | → Closing position PID28 (Volume: 1000) SUCCEEDED
14/04/2025 14:00:00.000 | Info | === CLOSED Buy 1000u |PnL:1.15|Pips:13.8 ===
14/04/2025 14:00:00.000 | Info | Day PnL:-4.63 | Closed:3 / Exec:3
15/04/2025 00:00:00.000 | Info | === NEW DAY: 2025-04-15 ===
16/04/2025 00:00:00.000 | Info | === NEW DAY: 2025-04-16 ===
16/04/2025 13:01:00.000 | Info | 🚀 Order prep — Entry:1.13558, SL:1.13076, TP:1.14523, Vol:1000
16/04/2025 13:01:00.000 | Trade | Executing Market Order to Buy 1000 EURUSD
16/04/2025 13:01:00.000 | Trade | → Executing Market Order to Buy 1000 EURUSD SUCCEEDED, Position PID29
16/04/2025 13:01:00.000 | Trade | Modifying position PID29 (SL: 1.13076, TP: null)
16/04/2025 13:01:00.000 | Trade | → Modifying position PID29 (SL: 1.13076, TP: null) SUCCEEDED, Position PID29
16/04/2025 13:01:00.000 | Trade | Modifying position PID29 (SL: 1.13076, TP: 1.14523)
16/04/2025 13:01:00.000 | Trade | → Modifying position PID29 (SL: 1.13076, TP: 1.14523) SUCCEEDED, Position PID29
16/04/2025 14:00:00.000 | Info | Closing pos ID:29 — Session end
16/04/2025 14:00:00.000 | Trade | Closing position PID29 (Volume: 1000)
16/04/2025 14:00:00.000 | Trade | → Closing position PID29 (Volume: 1000) SUCCEEDED
16/04/2025 14:00:00.000 | Info | === CLOSED Buy 1000u |PnL:1.00|Pips:12.0 ===
16/04/2025 14:00:00.000 | Info | Day PnL:1.00 | Closed:1 / Exec:1
17/04/2025 00:00:00.000 | Info | === NEW DAY: 2025-04-17 ===
17/04/2025 03:00:00.000 | Info | 🚀 Order prep — Entry:1.13792, SL:1.13409, TP:1.14558, Vol:1000
17/04/2025 03:00:00.000 | Trade | Executing Market Order to Buy 1000 EURUSD
17/04/2025 03:00:00.000 | Trade | → Executing Market Order to Buy 1000 EURUSD SUCCEEDED, Position PID30
17/04/2025 03:00:00.000 | Trade | Modifying position PID30 (SL: 1.13409, TP: null)
17/04/2025 03:00:00.000 | Trade | → Modifying position PID30 (SL: 1.13409, TP: null) SUCCEEDED, Position PID30
17/04/2025 03:00:00.000 | Trade | Modifying position PID30 (SL: 1.13409, TP: 1.14558)
17/04/2025 03:00:00.000 | Trade | → Modifying position PID30 (SL: 1.13409, TP: 1.14558) SUCCEEDED, Position PID30
17/04/2025 12:21:00.000 | Info | === CLOSED Buy 1000u |PnL:-3.92|Pips:-43.9 ===
17/04/2025 12:21:00.000 | Info | Day PnL:-3.92 | Closed:1 / Exec:1
18/04/2025 00:00:00.000 | Info | === NEW DAY: 2025-04-18 ===
20/04/2025 21:01:00.000 | Info | === NEW DAY: 2025-04-20 ===
21/04/2025 00:00:00.000 | Info | === NEW DAY: 2025-04-21 ===
21/04/2025 13:43:00.000 | Info | 🚀 Order prep — Entry:1.15150, SL:1.14509, TP:1.16431, Vol:1000
21/04/2025 13:43:00.000 | Trade | Executing Market Order to Buy 1000 EURUSD
21/04/2025 13:43:00.000 | Trade | → Executing Market Order to Buy 1000 EURUSD SUCCEEDED, Position PID31
21/04/2025 13:43:00.000 | Trade | Modifying position PID31 (SL: 1.14509, TP: null)
21/04/2025 13:43:00.000 | Trade | → Modifying position PID31 (SL: 1.14509, TP: null) SUCCEEDED, Position PID31
21/04/2025 13:43:00.000 | Trade | Modifying position PID31 (SL: 1.14509, TP: 1.16431)
21/04/2025 13:43:00.000 | Trade | → Modifying position PID31 (SL: 1.14509, TP: 1.16431) SUCCEEDED, Position PID31
21/04/2025 14:00:00.000 | Info | Closing pos ID:31 — Session end
21/04/2025 14:00:00.000 | Trade | Closing position PID31 (Volume: 1000)
21/04/2025 14:00:00.000 | Trade | → Closing position PID31 (Volume: 1000) SUCCEEDED
21/04/2025 14:00:00.000 | Info | === CLOSED Buy 1000u |PnL:0.28|Pips:3.9 ===
21/04/2025 14:00:00.000 | Info | Day PnL:0.28 | Closed:1 / Exec:1
22/04/2025 00:00:00.000 | Info | === NEW DAY: 2025-04-22 ===
22/04/2025 03:00:00.000 | Info | 🚀 Order prep — Entry:1.15215, SL:1.14853, TP:1.15939, Vol:1000
22/04/2025 03:00:00.000 | Trade | Executing Market Order to Buy 1000 EURUSD
22/04/2025 03:00:00.000 | Trade | → Executing Market Order to Buy 1000 EURUSD SUCCEEDED, Position PID32
22/04/2025 03:00:00.000 | Trade | Modifying position PID32 (SL: 1.14853, TP: null)
22/04/2025 03:00:00.000 | Trade | → Modifying position PID32 (SL: 1.14853, TP: null) SUCCEEDED, Position PID32
22/04/2025 03:00:00.000 | Trade | Modifying position PID32 (SL: 1.14853, TP: 1.15939)
22/04/2025 03:00:00.000 | Trade | → Modifying position PID32 (SL: 1.14853, TP: 1.15939) SUCCEEDED, Position PID32
22/04/2025 05:30:00.000 | Trade | Modifying position PID32 (SL: 1.15225, TP: 1.15939)
22/04/2025 05:30:00.000 | Trade | → Modifying position PID32 (SL: 1.15225, TP: 1.15939) SUCCEEDED, Position PID32
22/04/2025 05:30:00.000 | Trade | Modifying position PID32 (SL: 1.15225, TP: 1.15939)
22/04/2025 05:30:00.000 | Trade | → Modifying position PID32 (SL: 1.15225, TP: 1.15939) SUCCEEDED, Position PID32
22/04/2025 05:30:00.000 | Info | ✅ Breakeven moved to 1.15225
22/04/2025 06:35:00.000 | Info | === CLOSED Buy 1000u |PnL:0.00|Pips:0.7 ===
22/04/2025 06:35:00.000 | Info | Day PnL:0.00 | Closed:1 / Exec:1
22/04/2025 06:35:00.000 | Info | 🚀 Order prep — Entry:1.15235, SL:1.14855, TP:1.15994, Vol:1000
22/04/2025 06:35:00.000 | Trade | Executing Market Order to Buy 1000 EURUSD
22/04/2025 06:35:00.000 | Trade | → Executing Market Order to Buy 1000 EURUSD SUCCEEDED, Position PID33
22/04/2025 06:35:00.000 | Trade | Modifying position PID33 (SL: 1.14855, TP: null)
22/04/2025 06:35:00.000 | Trade | → Modifying position PID33 (SL: 1.14855, TP: null) SUCCEEDED, Position PID33
22/04/2025 06:35:00.000 | Trade | Modifying position PID33 (SL: 1.14855, TP: 1.15994)
22/04/2025 06:35:00.000 | Trade | → Modifying position PID33 (SL: 1.14855, TP: 1.15994) SUCCEEDED, Position PID33
22/04/2025 07:45:00.000 | Info | === CLOSED Buy 1000u |PnL:-3.57|Pips:-39.9 ===
22/04/2025 07:45:00.000 | Info | Day PnL:-3.57 | Closed:2 / Exec:2
22/04/2025 07:45:00.000 | Info | 🚀 Order prep — Entry:1.14844, SL:1.14420, TP:1.15691, Vol:1000
22/04/2025 07:45:00.000 | Trade | Executing Market Order to Buy 1000 EURUSD
22/04/2025 07:45:00.000 | Trade | → Executing Market Order to Buy 1000 EURUSD SUCCEEDED, Position PID34
22/04/2025 07:45:00.000 | Trade | Modifying position PID34 (SL: 1.1442, TP: null)
22/04/2025 07:45:00.000 | Trade | → Modifying position PID34 (SL: 1.1442, TP: null) SUCCEEDED, Position PID34
22/04/2025 07:45:00.000 | Trade | Modifying position PID34 (SL: 1.1442, TP: 1.15691)
22/04/2025 07:45:00.000 | Trade | → Modifying position PID34 (SL: 1.1442, TP: 1.15691) SUCCEEDED, Position PID34
22/04/2025 14:00:00.000 | Info | Closing pos ID:34 — Session end
22/04/2025 14:00:00.000 | Trade | Closing position PID34 (Volume: 1000)
22/04/2025 14:00:00.000 | Trade | → Closing position PID34 (Volume: 1000) SUCCEEDED
22/04/2025 14:00:00.000 | Info | === CLOSED Buy 1000u |PnL:-0.95|Pips:-10.1 ===
22/04/2025 14:00:00.000 | Info | Day PnL:-4.52 | Closed:3 / Exec:3
23/04/2025 00:00:00.000 | Info | === NEW DAY: 2025-04-23 ===
23/04/2025 09:21:00.000 | Info | 🚀 Order prep — Entry:1.14393, SL:1.13719, TP:1.15742, Vol:1000
23/04/2025 09:21:00.000 | Trade | Executing Market Order to Buy 1000 EURUSD
23/04/2025 09:21:00.000 | Trade | → Executing Market Order to Buy 1000 EURUSD SUCCEEDED, Position PID35
23/04/2025 09:21:00.000 | Trade | Modifying position PID35 (SL: 1.13719, TP: null)
23/04/2025 09:21:00.000 | Trade | → Modifying position PID35 (SL: 1.13719, TP: null) SUCCEEDED, Position PID35
23/04/2025 09:21:00.000 | Trade | Modifying position PID35 (SL: 1.13719, TP: 1.15742)
23/04/2025 09:21:00.000 | Trade | → Modifying position PID35 (SL: 1.13719, TP: 1.15742) SUCCEEDED, Position PID35
23/04/2025 13:48:00.000 | Info | === CLOSED Buy 1000u |PnL:-6.93|Pips:-78.1 ===
23/04/2025 13:48:00.000 | Info | Day PnL:-6.93 | Closed:1 / Exec:1
24/04/2025 00:00:00.000 | Info | === NEW DAY: 2025-04-24 ===
25/04/2025 00:00:00.000 | Info | === NEW DAY: 2025-04-25 ===
27/04/2025 21:32:00.000 | Info | === NEW DAY: 2025-04-27 ===
28/04/2025 00:00:00.000 | Info | === NEW DAY: 2025-04-28 ===
29/04/2025 00:00:00.000 | Info | === NEW DAY: 2025-04-29 ===
30/04/2025 00:00:00.000 | Info | === NEW DAY: 2025-04-30 ===
01/05/2025 00:00:00.000 | Info | === NEW DAY: 2025-05-01 ===
01/05/2025 08:00:00.000 | Info | 🚀 Order prep — Entry:1.13101, SL:1.13377, TP:1.12548, Vol:1000
01/05/2025 08:00:00.000 | Trade | Executing Market Order to Sell 1000 EURUSD
01/05/2025 08:00:00.000 | Trade | → Executing Market Order to Sell 1000 EURUSD SUCCEEDED, Position PID36
01/05/2025 08:00:00.000 | Trade | Modifying position PID36 (SL: 1.13377, TP: null)
01/05/2025 08:00:00.000 | Trade | → Modifying position PID36 (SL: 1.13377, TP: null) SUCCEEDED, Position PID36
01/05/2025 08:00:00.000 | Trade | Modifying position PID36 (SL: 1.13377, TP: 1.12548)
01/05/2025 08:00:00.000 | Trade | → Modifying position PID36 (SL: 1.13377, TP: 1.12548) SUCCEEDED, Position PID36
01/05/2025 11:19:00.000 | Info | === CLOSED Sell 1000u |PnL:-2.88|Pips:-32.0 ===
01/05/2025 11:19:00.000 | Info | Day PnL:-2.88 | Closed:1 / Exec:1
01/05/2025 11:19:00.000 | Info | 🚀 Order prep — Entry:1.13408, SL:1.13714, TP:1.12795, Vol:1000
01/05/2025 11:19:00.000 | Trade | Executing Market Order to Sell 1000 EURUSD
01/05/2025 11:19:00.000 | Trade | → Executing Market Order to Sell 1000 EURUSD SUCCEEDED, Position PID37
01/05/2025 11:19:00.000 | Trade | Modifying position PID37 (SL: 1.13714, TP: null)
01/05/2025 11:19:00.000 | Trade | → Modifying position PID37 (SL: 1.13714, TP: null) SUCCEEDED, Position PID37
01/05/2025 11:19:00.000 | Trade | Modifying position PID37 (SL: 1.13714, TP: 1.12795)
01/05/2025 11:19:00.000 | Trade | → Modifying position PID37 (SL: 1.13714, TP: 1.12795) SUCCEEDED, Position PID37
01/05/2025 11:53:00.000 | Trade | Modifying position PID37 (SL: 1.13398, TP: 1.12795)
01/05/2025 11:53:00.000 | Trade | → Modifying position PID37 (SL: 1.13398, TP: 1.12795) SUCCEEDED, Position PID37
01/05/2025 11:53:00.000 | Trade | Modifying position PID37 (SL: 1.13398, TP: 1.12795)
01/05/2025 11:53:00.000 | Trade | → Modifying position PID37 (SL: 1.13398, TP: 1.12795) SUCCEEDED, Position PID37
01/05/2025 11:53:00.000 | Info | ✅ Breakeven moved to 1.13398
01/05/2025 12:32:00.000 | Info | === CLOSED Sell 1000u |PnL:0.03|Pips:1.0 ===
01/05/2025 12:32:00.000 | Info | Day PnL:-2.85 | Closed:2 / Exec:2
01/05/2025 12:32:00.000 | Info | 🚀 Order prep — Entry:1.13318, SL:1.13674, TP:1.12606, Vol:1000
01/05/2025 12:32:00.000 | Trade | Executing Market Order to Sell 1000 EURUSD
01/05/2025 12:32:00.000 | Trade | → Executing Market Order to Sell 1000 EURUSD SUCCEEDED, Position PID38
01/05/2025 12:32:00.000 | Trade | Modifying position PID38 (SL: 1.13674, TP: null)
01/05/2025 12:32:00.000 | Trade | → Modifying position PID38 (SL: 1.13674, TP: null) SUCCEEDED, Position PID38
01/05/2025 12:32:00.000 | Trade | Modifying position PID38 (SL: 1.13674, TP: 1.12606)
01/05/2025 12:32:00.000 | Trade | → Modifying position PID38 (SL: 1.13674, TP: 1.12606) SUCCEEDED, Position PID38
01/05/2025 14:00:00.000 | Info | Closing pos ID:38 — Session end
01/05/2025 14:00:00.000 | Trade | Closing position PID38 (Volume: 1000)
01/05/2025 14:00:00.000 | Trade | → Closing position PID38 (Volume: 1000) SUCCEEDED
01/05/2025 14:00:00.000 | Info | === CLOSED Sell 1000u |PnL:1.44|Pips:17.0 ===
01/05/2025 14:00:00.000 | Info | Day PnL:-1.41 | Closed:3 / Exec:3
02/05/2025 00:00:00.000 | Info | === NEW DAY: 2025-05-02 ===
02/05/2025 03:00:00.000 | Info | 🚀 Order prep — Entry:1.12942, SL:1.13263, TP:1.12301, Vol:1000
02/05/2025 03:00:00.000 | Trade | Executing Market Order to Sell 1000 EURUSD
02/05/2025 03:00:00.000 | Trade | → Executing Market Order to Sell 1000 EURUSD SUCCEEDED, Position PID39
02/05/2025 03:00:00.000 | Trade | Modifying position PID39 (SL: 1.13263, TP: null)
02/05/2025 03:00:00.000 | Trade | → Modifying position PID39 (SL: 1.13263, TP: null) SUCCEEDED, Position PID39
02/05/2025 03:00:00.000 | Trade | Modifying position PID39 (SL: 1.13263, TP: 1.12301)
02/05/2025 03:00:00.000 | Trade | → Modifying position PID39 (SL: 1.13263, TP: 1.12301) SUCCEEDED, Position PID39
02/05/2025 06:21:00.000 | Info | === CLOSED Sell 1000u |PnL:-2.94|Pips:-32.7 ===
02/05/2025 06:21:00.000 | Info | Day PnL:-2.94 | Closed:1 / Exec:1
02/05/2025 06:46:00.000 | Info | 🚀 Order prep — Entry:1.13185, SL:1.13473, TP:1.12608, Vol:1000
02/05/2025 06:46:00.000 | Trade | Executing Market Order to Sell 1000 EURUSD
02/05/2025 06:46:00.000 | Trade | → Executing Market Order to Sell 1000 EURUSD SUCCEEDED, Position PID40
02/05/2025 06:46:00.000 | Trade | Modifying position PID40 (SL: 1.13473, TP: null)
02/05/2025 06:46:00.000 | Trade | → Modifying position PID40 (SL: 1.13473, TP: null) SUCCEEDED, Position PID40
02/05/2025 06:46:00.000 | Trade | Modifying position PID40 (SL: 1.13473, TP: 1.12608)
02/05/2025 06:46:00.000 | Trade | → Modifying position PID40 (SL: 1.13473, TP: 1.12608) SUCCEEDED, Position PID40
02/05/2025 09:40:00.000 | Info | === CLOSED Sell 1000u |PnL:-2.70|Pips:-30.0 ===
02/05/2025 09:40:00.000 | Info | Day PnL:-5.64 | Closed:2 / Exec:2
04/05/2025 21:09:00.000 | Info | === NEW DAY: 2025-05-04 ===
05/05/2025 00:00:00.000 | Info | === NEW DAY: 2025-05-05 ===
06/05/2025 00:00:00.000 | Info | === NEW DAY: 2025-05-06 ===
07/05/2025 00:00:00.000 | Info | === NEW DAY: 2025-05-07 ===
08/05/2025 00:00:00.000 | Info | === NEW DAY: 2025-05-08 ===
09/05/2025 00:00:00.000 | Info | === NEW DAY: 2025-05-09 ===
09/05/2025 03:01:00.000 | Info | 🚀 Order prep — Entry:1.12228, SL:1.12620, TP:1.11443, Vol:1000
09/05/2025 03:01:00.000 | Trade | Executing Market Order to Sell 1000 EURUSD
09/05/2025 03:01:00.000 | Trade | → Executing Market Order to Sell 1000 EURUSD SUCCEEDED, Position PID41
09/05/2025 03:01:00.000 | Trade | Modifying position PID41 (SL: 1.1262, TP: null)
09/05/2025 03:01:00.000 | Trade | → Modifying position PID41 (SL: 1.1262, TP: null) SUCCEEDED, Position PID41
09/05/2025 03:01:00.000 | Trade | Modifying position PID41 (SL: 1.1262, TP: 1.11443)
09/05/2025 03:01:00.000 | Trade | → Modifying position PID41 (SL: 1.1262, TP: 1.11443) SUCCEEDED, Position PID41
09/05/2025 13:10:00.000 | Info | === CLOSED Sell 1000u |PnL:-3.61|Pips:-40.3 ===
09/05/2025 13:10:00.000 | Info | Day PnL:-3.61 | Closed:1 / Exec:1
11/05/2025 21:02:00.000 | Info | === NEW DAY: 2025-05-11 ===
12/05/2025 00:00:00.000 | Info | === NEW DAY: 2025-05-12 ===
13/05/2025 00:00:00.000 | Info | === NEW DAY: 2025-05-13 ===
13/05/2025 03:00:00.000 | Info | 🚀 Order prep — Entry:1.11030, SL:1.11322, TP:1.10446, Vol:1000
13/05/2025 03:00:00.000 | Trade | Executing Market Order to Sell 1000 EURUSD
13/05/2025 03:00:00.000 | Trade | → Executing Market Order to Sell 1000 EURUSD SUCCEEDED, Position PID42
13/05/2025 03:00:00.000 | Trade | Modifying position PID42 (SL: 1.11322, TP: null)
13/05/2025 03:00:00.000 | Trade | → Modifying position PID42 (SL: 1.11322, TP: null) SUCCEEDED, Position PID42
13/05/2025 03:00:00.000 | Trade | Modifying position PID42 (SL: 1.11322, TP: 1.10446)
13/05/2025 03:00:00.000 | Trade | → Modifying position PID42 (SL: 1.11322, TP: 1.10446) SUCCEEDED, Position PID42
13/05/2025 12:46:00.000 | Info | === CLOSED Sell 1000u |PnL:-2.65|Pips:-29.4 ===
13/05/2025 12:46:00.000 | Info | Day PnL:-2.65 | Closed:1 / Exec:1
13/05/2025 12:46:00.000 | Info | 🚀 Order prep — Entry:1.11264, SL:1.11549, TP:1.10694, Vol:1000
13/05/2025 12:46:00.000 | Trade | Executing Market Order to Sell 1000 EURUSD
13/05/2025 12:46:00.000 | Trade | → Executing Market Order to Sell 1000 EURUSD SUCCEEDED, Position PID43
13/05/2025 12:46:00.000 | Trade | Modifying position PID43 (SL: 1.11549, TP: null)
13/05/2025 12:46:00.000 | Trade | → Modifying position PID43 (SL: 1.11549, TP: null) SUCCEEDED, Position PID43
13/05/2025 12:46:00.000 | Trade | Modifying position PID43 (SL: 1.11549, TP: 1.10694)
13/05/2025 12:46:00.000 | Trade | → Modifying position PID43 (SL: 1.11549, TP: 1.10694) SUCCEEDED, Position PID43
13/05/2025 14:00:00.000 | Info | Closing pos ID:43 — Session end
13/05/2025 14:00:00.000 | Trade | Closing position PID43 (Volume: 1000)
13/05/2025 14:00:00.000 | Trade | → Closing position PID43 (Volume: 1000) SUCCEEDED
13/05/2025 14:00:00.000 | Info | === CLOSED Sell 1000u |PnL:-0.94|Pips:-10.0 ===
13/05/2025 14:00:00.000 | Info | Day PnL:-3.59 | Closed:2 / Exec:2
14/05/2025 00:00:00.000 | Info | === NEW DAY: 2025-05-14 ===
15/05/2025 00:00:00.000 | Info | === NEW DAY: 2025-05-15 ===
15/05/2025 11:34:00.000 | Info | 🚀 Order prep — Entry:1.11878, SL:1.12198, TP:1.11238, Vol:1000
15/05/2025 11:34:00.000 | Trade | Executing Market Order to Sell 1000 EURUSD
15/05/2025 11:34:00.000 | Trade | → Executing Market Order to Sell 1000 EURUSD SUCCEEDED, Position PID44
15/05/2025 11:34:00.000 | Trade | Modifying position PID44 (SL: 1.12198, TP: null)
15/05/2025 11:34:00.000 | Trade | → Modifying position PID44 (SL: 1.12198, TP: null) SUCCEEDED, Position PID44
15/05/2025 11:34:00.000 | Trade | Modifying position PID44 (SL: 1.12198, TP: 1.11238)
15/05/2025 11:34:00.000 | Trade | → Modifying position PID44 (SL: 1.12198, TP: 1.11238) SUCCEEDED, Position PID44
15/05/2025 13:08:00.000 | Info | === CLOSED Sell 1000u |PnL:-3.10|Pips:-34.6 ===
15/05/2025 13:08:00.000 | Info | Day PnL:-3.10 | Closed:1 / Exec:1
16/05/2025 00:00:00.000 | Info | === NEW DAY: 2025-05-16 ===
18/05/2025 21:01:00.000 | Info | === NEW DAY: 2025-05-18 ===
19/05/2025 00:00:00.000 | Info | === NEW DAY: 2025-05-19 ===
20/05/2025 00:00:00.000 | Info | === NEW DAY: 2025-05-20 ===
20/05/2025 06:00:00.000 | Info | 🚀 Order prep — Entry:1.12556, SL:1.12314, TP:1.13040, Vol:1000
20/05/2025 06:00:00.000 | Trade | Executing Market Order to Buy 1000 EURUSD
20/05/2025 06:00:00.000 | Trade | → Executing Market Order to Buy 1000 EURUSD SUCCEEDED, Position PID45
20/05/2025 06:00:00.000 | Trade | Modifying position PID45 (SL: 1.12314, TP: null)
20/05/2025 06:00:00.000 | Trade | → Modifying position PID45 (SL: 1.12314, TP: null) SUCCEEDED, Position PID45
20/05/2025 06:00:00.000 | Trade | Modifying position PID45 (SL: 1.12314, TP: 1.1304)
20/05/2025 06:00:00.000 | Trade | → Modifying position PID45 (SL: 1.12314, TP: 1.1304) SUCCEEDED, Position PID45
20/05/2025 07:42:00.000 | Trade | Modifying position PID45 (SL: 1.12566, TP: 1.1304)
20/05/2025 07:42:00.000 | Trade | → Modifying position PID45 (SL: 1.12566, TP: 1.1304) SUCCEEDED, Position PID45
20/05/2025 07:42:00.000 | Trade | Modifying position PID45 (SL: 1.12566, TP: 1.1304)
20/05/2025 07:42:00.000 | Trade | → Modifying position PID45 (SL: 1.12566, TP: 1.1304) SUCCEEDED, Position PID45
20/05/2025 07:42:00.000 | Info | ✅ Breakeven moved to 1.12566
20/05/2025 08:45:00.000 | Info | === CLOSED Buy 1000u |PnL:-0.44|Pips:-4.3 ===
20/05/2025 08:45:00.000 | Info | Day PnL:-0.44 | Closed:1 / Exec:1
20/05/2025 10:23:00.000 | Info | 🚀 Order prep — Entry:1.12477, SL:1.12160, TP:1.13110, Vol:1000
20/05/2025 10:23:00.000 | Trade | Executing Market Order to Buy 1000 EURUSD
20/05/2025 10:23:00.000 | Trade | → Executing Market Order to Buy 1000 EURUSD SUCCEEDED, Position PID46
20/05/2025 10:23:00.000 | Trade | Modifying position PID46 (SL: 1.1216, TP: null)
20/05/2025 10:23:00.000 | Trade | → Modifying position PID46 (SL: 1.1216, TP: null) SUCCEEDED, Position PID46
20/05/2025 10:23:00.000 | Trade | Modifying position PID46 (SL: 1.1216, TP: 1.1311)
20/05/2025 10:23:00.000 | Trade | → Modifying position PID46 (SL: 1.1216, TP: 1.1311) SUCCEEDED, Position PID46
20/05/2025 14:00:00.000 | Info | Closing pos ID:46 — Session end
20/05/2025 14:00:00.000 | Trade | Closing position PID46 (Volume: 1000)
20/05/2025 14:00:00.000 | Trade | → Closing position PID46 (Volume: 1000) SUCCEEDED
20/05/2025 14:00:00.000 | Info | === CLOSED Buy 1000u |PnL:-0.19|Pips:-1.5 ===
20/05/2025 14:00:00.000 | Info | Day PnL:-0.63 | Closed:2 / Exec:2
21/05/2025 00:00:00.000 | Info | === NEW DAY: 2025-05-21 ===
21/05/2025 12:00:00.000 | Info | 🚀 Order prep — Entry:1.13254, SL:1.12874, TP:1.14015, Vol:1000
21/05/2025 12:00:00.000 | Trade | Executing Market Order to Buy 1000 EURUSD
21/05/2025 12:00:00.000 | Trade | → Executing Market Order to Buy 1000 EURUSD SUCCEEDED, Position PID47
21/05/2025 12:00:00.000 | Trade | Modifying position PID47 (SL: 1.12874, TP: null)
21/05/2025 12:00:00.000 | Trade | → Modifying position PID47 (SL: 1.12874, TP: null) SUCCEEDED, Position PID47
21/05/2025 12:00:00.000 | Trade | Modifying position PID47 (SL: 1.12874, TP: 1.14015)
21/05/2025 12:00:00.000 | Trade | → Modifying position PID47 (SL: 1.12874, TP: 1.14015) SUCCEEDED, Position PID47
21/05/2025 14:00:00.000 | Info | Closing pos ID:47 — Session end
21/05/2025 14:00:00.000 | Trade | Closing position PID47 (Volume: 1000)
21/05/2025 14:00:00.000 | Trade | → Closing position PID47 (Volume: 1000) SUCCEEDED
21/05/2025 14:00:00.000 | Info | === CLOSED Buy 1000u |PnL:0.97|Pips:11.7 ===
21/05/2025 14:00:00.000 | Info | Day PnL:0.97 | Closed:1 / Exec:1
22/05/2025 00:00:00.000 | Info | === NEW DAY: 2025-05-22 ===
22/05/2025 03:00:00.000 | Info | 🚀 Order prep — Entry:1.13400, SL:1.13070, TP:1.14060, Vol:1000
22/05/2025 03:00:00.000 | Trade | Executing Market Order to Buy 1000 EURUSD
22/05/2025 03:00:00.000 | Trade | → Executing Market Order to Buy 1000 EURUSD SUCCEEDED, Position PID48
22/05/2025 03:00:00.000 | Trade | Modifying position PID48 (SL: 1.1307, TP: null)
22/05/2025 03:00:00.000 | Trade | → Modifying position PID48 (SL: 1.1307, TP: null) SUCCEEDED, Position PID48
22/05/2025 03:00:00.000 | Trade | Modifying position PID48 (SL: 1.1307, TP: 1.1406)
22/05/2025 03:00:00.000 | Trade | → Modifying position PID48 (SL: 1.1307, TP: 1.1406) SUCCEEDED, Position PID48
22/05/2025 07:31:00.000 | Info | === CLOSED Buy 1000u |PnL:-3.99|Pips:-44.7 ===
22/05/2025 07:31:00.000 | Info | Day PnL:-3.99 | Closed:1 / Exec:1
22/05/2025 07:31:00.000 | Info | 🚀 Order prep — Entry:1.13083, SL:1.12740, TP:1.13769, Vol:1000
22/05/2025 07:31:00.000 | Trade | Executing Market Order to Buy 1000 EURUSD
22/05/2025 07:31:00.000 | Trade | → Executing Market Order to Buy 1000 EURUSD SUCCEEDED, Position PID49
22/05/2025 07:31:00.000 | Trade | Modifying position PID49 (SL: 1.1274, TP: null)
22/05/2025 07:31:00.000 | Trade | → Modifying position PID49 (SL: 1.1274, TP: null) SUCCEEDED, Position PID49
22/05/2025 07:31:00.000 | Trade | Modifying position PID49 (SL: 1.1274, TP: 1.13769)
22/05/2025 07:31:00.000 | Trade | → Modifying position PID49 (SL: 1.1274, TP: 1.13769) SUCCEEDED, Position PID49
22/05/2025 08:15:00.000 | Trade | Modifying position PID49 (SL: 1.13093, TP: 1.13769)
22/05/2025 08:15:00.000 | Trade | → Modifying position PID49 (SL: 1.13093, TP: 1.13769) SUCCEEDED, Position PID49
22/05/2025 08:15:00.000 | Trade | Modifying position PID49 (SL: 1.13093, TP: 1.13769)
22/05/2025 08:15:00.000 | Trade | → Modifying position PID49 (SL: 1.13093, TP: 1.13769) SUCCEEDED, Position PID49
22/05/2025 08:15:00.000 | Info | ✅ Breakeven moved to 1.13093
22/05/2025 08:44:00.000 | Info | === CLOSED Buy 1000u |PnL:-0.02|Pips:0.4 ===
22/05/2025 08:44:00.000 | Info | Day PnL:-4.01 | Closed:2 / Exec:2
22/05/2025 08:44:00.000 | Info | 🚀 Order prep — Entry:1.13122, SL:1.12766, TP:1.13833, Vol:1000
22/05/2025 08:44:00.000 | Trade | Executing Market Order to Buy 1000 EURUSD
22/05/2025 08:44:00.000 | Trade | → Executing Market Order to Buy 1000 EURUSD SUCCEEDED, Position PID50
22/05/2025 08:44:00.000 | Trade | Modifying position PID50 (SL: 1.12766, TP: null)
22/05/2025 08:44:00.000 | Trade | → Modifying position PID50 (SL: 1.12766, TP: null) SUCCEEDED, Position PID50
22/05/2025 08:44:00.000 | Trade | Modifying position PID50 (SL: 1.12766, TP: 1.13833)
22/05/2025 08:44:00.000 | Trade | → Modifying position PID50 (SL: 1.12766, TP: 1.13833) SUCCEEDED, Position PID50
22/05/2025 14:00:00.000 | Info | Closing pos ID:50 — Session end
22/05/2025 14:00:00.000 | Trade | Closing position PID50 (Volume: 1000)
22/05/2025 14:00:00.000 | Trade | → Closing position PID50 (Volume: 1000) SUCCEEDED
22/05/2025 14:00:00.000 | Info | === CLOSED Buy 1000u |PnL:-2.66|Pips:-29.5 ===
22/05/2025 14:00:00.000 | Info | Day PnL:-6.67 | Closed:3 / Exec:3
23/05/2025 00:00:00.000 | Info | === NEW DAY: 2025-05-23 ===
23/05/2025 12:49:00.000 | Info | 🚀 Order prep — Entry:1.13424, SL:1.12956, TP:1.14360, Vol:1000
23/05/2025 12:49:00.000 | Trade | Executing Market Order to Buy 1000 EURUSD
23/05/2025 12:49:00.000 | Trade | → Executing Market Order to Buy 1000 EURUSD SUCCEEDED, Position PID51
23/05/2025 12:49:00.000 | Trade | Modifying position PID51 (SL: 1.12956, TP: null)
23/05/2025 12:49:00.000 | Trade | → Modifying position PID51 (SL: 1.12956, TP: null) SUCCEEDED, Position PID51
23/05/2025 12:49:00.000 | Trade | Modifying position PID51 (SL: 1.12956, TP: 1.1436)
23/05/2025 12:49:00.000 | Trade | → Modifying position PID51 (SL: 1.12956, TP: 1.1436) SUCCEEDED, Position PID51
23/05/2025 14:00:00.000 | Info | Closing pos ID:51 — Session end
23/05/2025 14:00:00.000 | Trade | Closing position PID51 (Volume: 1000)
23/05/2025 14:00:00.000 | Trade | → Closing position PID51 (Volume: 1000) SUCCEEDED
23/05/2025 14:00:00.000 | Info | === CLOSED Buy 1000u |PnL:-2.52|Pips:-27.9 ===
23/05/2025 14:00:00.000 | Info | Day PnL:-2.52 | Closed:1 / Exec:1
25/05/2025 21:01:00.000 | Info | === NEW DAY: 2025-05-25 ===
25/05/2025 23:59:00.000 | Info | === HybridTrendBot v6.0 Stopped ===
25/05/2025 23:59:00.000 | Info | CBot instance [NewBot3.0, EURUSD, h1] stopped.
